video_id,Title,Video Link,Publish Date,View Count,Like Count,Channel ID,Channel View,Subscriber Count,Video Count
NmQVEKlP-aE,"Stock Market Day Trading Live with TodayTrader Jan 7, 2009",https://www.youtube.com/watch?v=NmQVEKlP-aE,2010-01-07 23:54:48+00:00,4968.0,26.0,UCOnefmG-8hSp66O2dHr3vgg,3124210,10000,547
lF7j6RFg8eo,Stock Market Technical Analysis Review 1/8/10,https://www.youtube.com/watch?v=lF7j6RFg8eo,2010-01-08 21:57:57+00:00,3168.0,25.0,UCfD3rq06LaA8wc3s2m3LwRQ,6055929,58800,1975
_qX1Cnl97jA,"Technical Analysis Stock Market Review Jan 12, 2010",https://www.youtube.com/watch?v=_qX1Cnl97jA,2010-01-12 21:29:52+00:00,1380.0,20.0,UCfD3rq06LaA8wc3s2m3LwRQ,6055929,58800,1975
4gucww_XbBg,Stock Market Trading Help online trading for Jan 21,https://www.youtube.com/watch?v=4gucww_XbBg,2010-01-22 03:27:10+00:00,2255.0,32.0,UCOnefmG-8hSp66O2dHr3vgg,3124210,10000,547
zeyj-SAdJjA,Online Trading Stock Market discussion for the day Jan 31,https://www.youtube.com/watch?v=zeyj-SAdJjA,2010-01-31 19:18:46+00:00,1236.0,34.0,UCOnefmG-8hSp66O2dHr3vgg,3124210,10000,547
6FQlHtvgOXk,Stockscores.com Weekly Market Analysis for Feb 1 2010.mp4,https://www.youtube.com/watch?v=6FQlHtvgOXk,2010-02-02 05:31:33+00:00,1033.0,2.0,UC151mnaPrIvTELng72QtFDQ,1665628,18300,855
T3aA5ZErKD8,"Online Trading and Stock Market help day Feb 18, 2010",https://www.youtube.com/watch?v=T3aA5ZErKD8,2010-02-19 02:55:25+00:00,3072.0,25.0,UCOnefmG-8hSp66O2dHr3vgg,3124210,10000,547
8qpIwMl7yrk,Stock Market Statistics &amp; Learning From a Broker - SentimenTrader Jason Goepfert,https://www.youtube.com/watch?v=8qpIwMl7yrk,2010-02-19 08:35:52+00:00,1577.0,2.0,UCIbdTTriG-IxoCdg1Zwbv5Q,294289,1000,99
nWann9eKlgs,Day Trading | Stock Market Reaction | Online Software,https://www.youtube.com/watch?v=nWann9eKlgs,2010-02-19 18:13:16+00:00,10586.0,53.0,UCLDuZe12blTBAbT3hrTdIiA,107602,893,30
seeH-ZH6HAA,Type and size of orders in the Stock Market 1: An Introduction,https://www.youtube.com/watch?v=seeH-ZH6HAA,2010-02-19 21:54:00+00:00,1611.0,,UCjWmQ6C0i02nUyLd_ykfr8g,3537606,15100,105
i0Y0SxVDGjc,"Weekend Technical Analysis - Market Swings, Bumps, Blasts To Continue...Pattern, Price, Setups",https://www.youtube.com/watch?v=i0Y0SxVDGjc,2010-02-21 16:58:44+00:00,1067.0,9.0,UCEggVJ_xt6van8nkzyBhK9w,4280992,27600,5415
AyIWw7djtVY,(Part 1 of 10)  10 Things Documentary - Stock Market Prophecy  Master Prophet Bishop Bernard Jordan,https://www.youtube.com/watch?v=AyIWw7djtVY,2010-02-21 19:48:28+00:00,7502.0,14.0,UCnCAKZScn89E63xmtlH5rQA,3857198,11900,3239
0BcnQ09B768,Market Technical Analysis - Market Slammed On Economic News But Dollar Saves The Day!,https://www.youtube.com/watch?v=0BcnQ09B768,2010-02-25 19:27:39+00:00,1633.0,10.0,UCEggVJ_xt6van8nkzyBhK9w,4280992,27600,5415
x65ndyrsaPI,Online Trading and Swing Trading the Stock Market day Feb 25,https://www.youtube.com/watch?v=x65ndyrsaPI,2010-02-26 03:13:34+00:00,2648.0,18.0,UCOnefmG-8hSp66O2dHr3vgg,3124210,10000,547
6TmleJXjp00,Stockscores Market Analysis for Mar 1 2010,https://www.youtube.com/watch?v=6TmleJXjp00,2010-03-02 05:50:04+00:00,1182.0,2.0,UC151mnaPrIvTELng72QtFDQ,1665628,18300,855
-VFk5LOQp74,"Market Technical Analysis - Markets Float Into Double Top, Master Trade On PALM, Key Stock Analysis",https://www.youtube.com/watch?v=-VFk5LOQp74,2010-03-02 19:12:42+00:00,1788.0,9.0,UCEggVJ_xt6van8nkzyBhK9w,4280992,27600,5415
uOJk8ZHbXHA,Market Technical Analysis - Markets Initially Jump Higher On Jobs Report Then Stall. 52 Week Highs?,https://www.youtube.com/watch?v=uOJk8ZHbXHA,2010-03-05 19:07:12+00:00,1103.0,10.0,UCEggVJ_xt6van8nkzyBhK9w,4280992,27600,5415
hnkACUP6NWE,Online Trading Day Trading and Stock Market ideas for Monday,https://www.youtube.com/watch?v=hnkACUP6NWE,2010-03-08 01:29:59+00:00,1943.0,27.0,UCOnefmG-8hSp66O2dHr3vgg,3124210,10000,547
ccNilnpvbJg,The Crash of 1929 &amp; The Great Depression (PBS) 1of6,https://www.youtube.com/watch?v=ccNilnpvbJg,2010-03-13 03:58:59+00:00,402988.0,799.0,UCBsHVT_fAGIZG56oh8nWR_Q,40792261,78500,319
9iz95It5c_Q,Market Technical Analysis - Markets Lower As Bear Flag Plays Out...New One Forming But Volume Dead,https://www.youtube.com/watch?v=9iz95It5c_Q,2010-03-15 18:19:51+00:00,1008.0,7.0,UCEggVJ_xt6van8nkzyBhK9w,4280992,27600,5415
P36CmETsVWs,Online Trading Stock Market Review,https://www.youtube.com/watch?v=P36CmETsVWs,2010-03-20 15:36:19+00:00,1244.0,23.0,UCfD3rq06LaA8wc3s2m3LwRQ,6055929,58800,1975
mmAo99SW6_E,OSHO: I Respect Money (Preview),https://www.youtube.com/watch?v=mmAo99SW6_E,2010-03-21 17:20:40+00:00,1396471.0,18835.0,UCS0s6BFzIcvC2gTH52_vBEA,186941685,1150000,2048
BRvZXekEGos,Part 1 - Stock Market Investing with Dr Dar on I Mean Business,https://www.youtube.com/watch?v=BRvZXekEGos,2010-04-25 14:56:12+00:00,1150.0,4.0,UC4HKInLNA3_eW0_KyjjrlTw,2646806,5290,3028
REGnWnPoEq4,Online Trading Stock Market Review 5/7/10,https://www.youtube.com/watch?v=REGnWnPoEq4,2010-05-07 21:42:00+00:00,3192.0,22.0,UCfD3rq06LaA8wc3s2m3LwRQ,6055929,58800,1975
WrxlVjZJawQ,Stock Market Flash Crash - May 6th 2010,https://www.youtube.com/watch?v=WrxlVjZJawQ,2010-05-11 20:49:03+00:00,29515.0,135.0,UCLdZZPcnxZLB_G7bzG8ZM7A,1727642,20100,194
QO4WacxSps0,Stock Market Review 5/12/10,https://www.youtube.com/watch?v=QO4WacxSps0,2010-05-12 20:41:52+00:00,1877.0,19.0,UCfD3rq06LaA8wc3s2m3LwRQ,6055929,58800,1975
qz0aHQ8KUpQ,"Stock market, U.S. economy, financial regs, exchange controls",https://www.youtube.com/watch?v=qz0aHQ8KUpQ,2010-05-20 21:31:50+00:00,29295.0,678.0,UCIjuLiLHdFxYtFmWlbTGQRQ,125674755,567000,2398
o-ehyLfTgu4,"Weekend Technical Analysis - Market Psychology, Technical Analysis Gives Profits. Learn It!",https://www.youtube.com/watch?v=o-ehyLfTgu4,2010-05-23 15:09:06+00:00,1362.0,10.0,UCEggVJ_xt6van8nkzyBhK9w,4280992,27600,5415
qXeIqkUWiZ8,Using Calculus to Make Money on the Stock Market Problem - Calculus - User Submitted Quesiton,https://www.youtube.com/watch?v=qXeIqkUWiZ8,2010-05-26 03:07:55+00:00,30919.0,287.0,UC_k_A_2-782aX_42pCZGTTw,526389,1110,199
jGcb3yhT9KM,Craig Ferguson Monologue 2006.06.26 Stock Market,https://www.youtube.com/watch?v=jGcb3yhT9KM,2010-05-29 19:10:34+00:00,5839.0,32.0,UC4To_u1goNDhAnHUrGTjYbQ,1597964,924,427
Uo_yf6C2MeU,Stock Market Trading Strategies,https://www.youtube.com/watch?v=Uo_yf6C2MeU,2010-06-03 15:37:59+00:00,2400.0,4.0,UCqsjBcxpPrrrRIjfDB_YbPg,33512,188,62
KsSm9xb1xkE,Stock Market Investing the Right Way,https://www.youtube.com/watch?v=KsSm9xb1xkE,2010-06-14 00:46:48+00:00,4075.0,67.0,UCwRXb5dUK4cvsHbx-rGzSgw,119413318,1270000,1232
cbomGzMjrEM,Stock Market Forecast Anatomy of a Bear Market - ASX,https://www.youtube.com/watch?v=cbomGzMjrEM,2010-06-20 01:04:54+00:00,2325.0,3.0,UC4vgOyM0JR649M94a8d8skg,28148,183,164
Ne4cD9UYoo4,The Mystery of the Stock Market Flash Crash - The Ring Of Fire,https://www.youtube.com/watch?v=Ne4cD9UYoo4,2010-06-29 17:39:31+00:00,2884.0,18.0,UCYWIEbibRcZav6xMLo9qWWw,1045618675,971000,20653
L0x7TOIrs5A,"Do You Know When to Stand Aside?  S&amp;P 500, Nasdaq Easy Emini Day Trade Set Ups 6-30-10",https://www.youtube.com/watch?v=L0x7TOIrs5A,2010-07-01 12:07:34+00:00,1023.0,,UCbZ7G5UQ69rUe31iJTPSYLQ,503911,3430,376
ySXlV4vz__c,"Lower Stock Prices Ahead, Bear Market Getting Stronger",https://www.youtube.com/watch?v=ySXlV4vz__c,2010-07-01 22:24:46+00:00,2432.0,23.0,UCmp8PhCEfZaWEDPYrowYujQ,5428543,35400,1106
wK-nQ7OUYpQ,Dow Jones Stock Market Trading Analysis &amp; Global Trends: Bear Case Part 1,https://www.youtube.com/watch?v=wK-nQ7OUYpQ,2010-07-18 14:44:22+00:00,2264.0,10.0,UCJBHw3WIta5ozyZ_izMWakw,3980488,10900,8855
ATONy6neSN4,Dow Jones Stock Market Trading Analysis &amp; Global Trends: Bear Case Part 2,https://www.youtube.com/watch?v=ATONy6neSN4,2010-07-18 15:05:49+00:00,2659.0,7.0,UCJBHw3WIta5ozyZ_izMWakw,3980488,10900,8855
SLG3TLsX0x0,Using the Trend to Predict the Next Move in the Stock Market,https://www.youtube.com/watch?v=SLG3TLsX0x0,2010-07-18 21:13:30+00:00,1928.0,4.0,UCxt-bSHoD3JObnfvps77Hbg,799244,1170,428
8hOMLw9Ev4Q,"Market Technical Analysis - Market Rips Higher, Key Plays To Watch and Profit From",https://www.youtube.com/watch?v=8hOMLw9Ev4Q,2010-07-22 19:18:17+00:00,1095.0,4.0,UCEggVJ_xt6van8nkzyBhK9w,4280992,27600,5415
ClG3QacbqSY,Stock Market Manipulation-The Truth.avi,https://www.youtube.com/watch?v=ClG3QacbqSY,2010-07-24 19:40:08+00:00,6414.0,18.0,UCEN0rg-Sa7tnGOrtolozA1Q,427189,4170,368
NWNP6Hhsoeg,"Market Technical Analysis - Markets Surge On Volume And Optimism,Money Flows On Winning Plays",https://www.youtube.com/watch?v=NWNP6Hhsoeg,2010-08-02 18:44:31+00:00,1052.0,8.0,UCEggVJ_xt6van8nkzyBhK9w,4280992,27600,5415
HJZhN8N6NJ8,"Elliott Wave and Technical Analysis of Short Term S&amp;P 500,  Long Term Dow Jones, Copper",https://www.youtube.com/watch?v=HJZhN8N6NJ8,2010-08-04 20:51:25+00:00,1191.0,4.0,UCSmbbWQjXYnhQlXNGzrW_PQ,143599,504,155
1Tkf2zkX45Q,Stock Market Trading Live Online  Day Aug 18 TodayTrader,https://www.youtube.com/watch?v=1Tkf2zkX45Q,2010-08-19 00:40:05+00:00,5014.0,25.0,UCOnefmG-8hSp66O2dHr3vgg,3124210,10000,547
10Y1onXXSL8,Stock Market Online Trading discussion  Sept 5 SPY,https://www.youtube.com/watch?v=10Y1onXXSL8,2010-09-05 18:55:49+00:00,4396.0,17.0,UCOnefmG-8hSp66O2dHr3vgg,3124210,10000,547
uXWB19V0frY,THE STOCK MARKET DEATH CROSS AND GOLDEN CROSS,https://www.youtube.com/watch?v=uXWB19V0frY,2010-09-17 19:29:54+00:00,12164.0,65.0,UCT4WixjPnohEg6r4EJuE0kw,70652,468,85
qpQ_TrX2Ibo,"Stock Market Technical Analysis - PPT Light Volume Float Keeping Market Flat, Key Levels Revealed",https://www.youtube.com/watch?v=qpQ_TrX2Ibo,2010-09-27 18:48:06+00:00,2379.0,6.0,UCEggVJ_xt6van8nkzyBhK9w,4280992,27600,5415
DWB4ypeYJL8,Market Technical Analysis - Plunge Protection Team Saves The Day Again As Dollar Drops,https://www.youtube.com/watch?v=DWB4ypeYJL8,2010-09-28 18:38:35+00:00,1101.0,11.0,UCEggVJ_xt6van8nkzyBhK9w,4280992,27600,5415
Yz_Uw692qCk,Stock Market Technical Analysis - Markets Have Major Reversal After Massive Gap Higher,https://www.youtube.com/watch?v=Yz_Uw692qCk,2010-09-30 18:37:55+00:00,1046.0,10.0,UCEggVJ_xt6van8nkzyBhK9w,4280992,27600,5415
OGkWVKy_OKI,"Weekend Stock Market Analysis - Big Move To Start This Week, Watch These Levels, Join To Profit!",https://www.youtube.com/watch?v=OGkWVKy_OKI,2010-10-03 17:03:32+00:00,1275.0,7.0,UCEggVJ_xt6van8nkzyBhK9w,4280992,27600,5415
w55P6XDb66Y,"Stock Market Analysis Weekend Edition - Earnings Galore, Dollar Key As Volatility Will Rock!",https://www.youtube.com/watch?v=w55P6XDb66Y,2010-10-10 16:21:35+00:00,1059.0,6.0,UCEggVJ_xt6van8nkzyBhK9w,4280992,27600,5415
WstJM_aNSj8,Wall Street: The Speed Traders,https://www.youtube.com/watch?v=WstJM_aNSj8,2010-10-10 23:08:22+00:00,306405.0,1538.0,UClzCn8DxRSCuMFv_WfzkcrQ,1991158318,2080000,50841
bMq-emn6A7o,"Stock Market Video - Weekend Edition - Dollar And Earnings At Center Stage, Be Ready For Action",https://www.youtube.com/watch?v=bMq-emn6A7o,2010-10-16 18:10:45+00:00,1093.0,9.0,UCEggVJ_xt6van8nkzyBhK9w,4280992,27600,5415
bUJvWbrl9Rs,"Stock Market Analysis Video - China Strikes Back, Fed Continues To Prop",https://www.youtube.com/watch?v=bUJvWbrl9Rs,2010-10-19 16:36:54+00:00,1160.0,16.0,UCEggVJ_xt6van8nkzyBhK9w,4280992,27600,5415
ZYxagpG1xsE,Stock Market and Online Trading Help for Oct 21,https://www.youtube.com/watch?v=ZYxagpG1xsE,2010-10-21 23:33:52+00:00,3501.0,15.0,UCOnefmG-8hSp66O2dHr3vgg,3124210,10000,547
itoNb1lb5hY,Currency Exchange Introduction,https://www.youtube.com/watch?v=itoNb1lb5hY,2010-10-24 15:12:19+00:00,778576.0,3990.0,UC4a-Gbdw7vOaccHmFo40b9g,2097916959,8140000,8454
HCVnxv5nNTw,Stock Market Video: POMO Saves The Day As Markets Await Elections And QE2,https://www.youtube.com/watch?v=HCVnxv5nNTw,2010-10-26 17:38:46+00:00,2550.0,10.0,UCEggVJ_xt6van8nkzyBhK9w,4280992,27600,5415
afpwofm9Ggk,Stock Market Structure,https://www.youtube.com/watch?v=afpwofm9Ggk,2010-10-28 01:56:22+00:00,3408.0,29.0,UCfD3rq06LaA8wc3s2m3LwRQ,6055929,58800,1975
Niwco2h2Up4,Stock Market Video: Crazy Trading During Crazier Times,https://www.youtube.com/watch?v=Niwco2h2Up4,2010-10-28 17:13:37+00:00,1264.0,7.0,UCEggVJ_xt6van8nkzyBhK9w,4280992,27600,5415
BPnJHfiFWJw,Milton Friedman - Solutions to Market Failures,https://www.youtube.com/watch?v=BPnJHfiFWJw,2010-10-29 21:05:50+00:00,97284.0,1524.0,UC51_awyLXl2nxCduuzzmw4w,74756753,225000,2115
9Qg_zP6e9ZY,2010 November 2 Congressional Elections and the Stock Market,https://www.youtube.com/watch?v=9Qg_zP6e9ZY,2010-11-01 23:02:40+00:00,2702.0,3.0,UCPAxB5TPQ_5PVXWYIgAx4Mw,1205676,3310,695
_2Kt4moES0U,How the Stock Market Works for Dummies,https://www.youtube.com/watch?v=_2Kt4moES0U,2010-11-02 05:08:17+00:00,427429.0,2753.0,UC69oUh89EBxjxTKvDOoqTug,1903488,1390,158
Gqp_1EAKrrY,Are You Prepared to Trade in the Stock Market,https://www.youtube.com/watch?v=Gqp_1EAKrrY,2010-11-04 16:26:35+00:00,1230.0,5.0,UCi3HkGY69ZLZhAHE729Rz6w,624359,2830,290
pVj2Qyd6or0,Stock Market Video: The Reality Of The Game,https://www.youtube.com/watch?v=pVj2Qyd6or0,2010-11-04 19:22:15+00:00,1497.0,12.0,UCEggVJ_xt6van8nkzyBhK9w,4280992,27600,5415
WqZZcR5tIz4,"Weekend Stock Market Video: The Truth Behind The Market Rally, Play It Right.",https://www.youtube.com/watch?v=WqZZcR5tIz4,2010-11-07 16:40:59+00:00,1296.0,11.0,UCEggVJ_xt6van8nkzyBhK9w,4280992,27600,5415
QFRNUej-ma0,Stock Market Video: Markets Collapse As China Gets Crushed,https://www.youtube.com/watch?v=QFRNUej-ma0,2010-11-12 18:36:33+00:00,1469.0,9.0,UCEggVJ_xt6van8nkzyBhK9w,4280992,27600,5415
djgQS0sk8T8,Beginner&#39;s guide to investing: the currency markets - MoneyWeek Investment Tutorials,https://www.youtube.com/watch?v=djgQS0sk8T8,2010-12-03 10:17:16+00:00,347146.0,2439.0,UCLnZvwNt6xDtlwIEmDJEtrA,3050020,38300,29
RVlRj1xxOGE,Making Money from Stock Market by Intra-day Trading in Equity Shares,https://www.youtube.com/watch?v=RVlRj1xxOGE,2010-12-05 18:54:34+00:00,76312.0,32.0,UCPbHsTFbBE3DOtsRE0P-gnw,457502,682,393
75afiFcdZHc,Stock Market Video: How An Amateur Loser Becomes A Pro Winner,https://www.youtube.com/watch?v=75afiFcdZHc,2010-12-07 18:32:40+00:00,1127.0,11.0,UCEggVJ_xt6van8nkzyBhK9w,4280992,27600,5415
fboNrR6IZjo,"Stock Market Video: Markets See Small Declines, Key Setups Revealed",https://www.youtube.com/watch?v=fboNrR6IZjo,2010-12-15 18:40:17+00:00,1735.0,18.0,UCEggVJ_xt6van8nkzyBhK9w,4280992,27600,5415
FCoO4BGK60E,A beginner&#39;s guide to the stock market.flv,https://www.youtube.com/watch?v=FCoO4BGK60E,2010-12-22 20:33:47+00:00,18945.0,295.0,UCKKLtHejpnK45xi6s-8qmJg,308382,1130,639
gaK5G_sf330,How to Buy a Pullback in the Stock Market,https://www.youtube.com/watch?v=gaK5G_sf330,2011-01-22 23:07:28+00:00,2255.0,6.0,UC3-xjExu0Qr4L_5SCcqsoeA,47868,276,35
Q9GEZeDjB3w,"Stock Market Video: Markets Collapse on Global Instability, Volatility Equals Great Trades",https://www.youtube.com/watch?v=Q9GEZeDjB3w,2011-01-28 18:19:44+00:00,1005.0,15.0,UCEggVJ_xt6van8nkzyBhK9w,4280992,27600,5415
PzoSJhF7p7o,Tradescores Market Analysis for Feb 9 2011,https://www.youtube.com/watch?v=PzoSJhF7p7o,2011-02-10 02:59:33+00:00,2623.0,4.0,UC151mnaPrIvTELng72QtFDQ,1665628,18300,855
jBNvGLFjupo,"Stock Market Video: Markets Whip As Friday Looms Large, Key Levels, Master Trades and Profits",https://www.youtube.com/watch?v=jBNvGLFjupo,2011-03-09 18:39:19+00:00,1809.0,12.0,UCEggVJ_xt6van8nkzyBhK9w,4280992,27600,5415
l7DBftejri4,"Stock Market Video: Markets Continue Their Bounce, Major Pivots Shown",https://www.youtube.com/watch?v=l7DBftejri4,2011-03-21 18:28:25+00:00,1092.0,11.0,UCEggVJ_xt6van8nkzyBhK9w,4280992,27600,5415
a4bzfvtq8n0,03/28/2011 Oscar Carboni Points out how the Stock Market is Poised to move Higher Continued,https://www.youtube.com/watch?v=a4bzfvtq8n0,2011-03-28 06:07:58+00:00,2408.0,,UCez8uA1o_fDYsrSf4auWSjg,4278829,13900,2175
YP8fw2yveRY,Stock Chart Tips for the Long Term Stock Market Investor,https://www.youtube.com/watch?v=YP8fw2yveRY,2011-04-01 14:03:56+00:00,6252.0,25.0,UCI1IQHHh9S3mBtcnHjpzt1w,168494,1140,107
UOwi7MBSfhk,An introduction to financial markets - MoneyWeek Investment Tutorials,https://www.youtube.com/watch?v=UOwi7MBSfhk,2011-04-01 16:42:46+00:00,222296.0,3078.0,UCKrz9GW8_Dtm41aOc05S4Vg,21305452,293000,448
wNv__bi-AVw,How Will Raising the Debt Ceiling Impact U.S. Markets?,https://www.youtube.com/watch?v=wNv__bi-AVw,2011-04-14 00:53:34+00:00,4958.0,13.0,UC6ZFN9Tx6xh-skXCuRHCDpQ,2334000454,3840000,47436
0rxS15Bsh-Y,Volatility calculation in Excel,https://www.youtube.com/watch?v=0rxS15Bsh-Y,2011-04-30 13:03:47+00:00,120574.0,622.0,UCqqQctA6wHQrpmoJwmWkJbA,841408,2150,25
XabI5QjqdOU,"Stock Market Video: Commodities Crash, Market Top In",https://www.youtube.com/watch?v=XabI5QjqdOU,2011-05-05 17:26:40+00:00,1028.0,12.0,UCEggVJ_xt6van8nkzyBhK9w,4280992,27600,5415
Bx2HGseD9Ao,Stock Market Trading For Beginners Using Dynamic System | Part #2,https://www.youtube.com/watch?v=Bx2HGseD9Ao,2011-05-10 18:07:40+00:00,8847.0,63.0,UCImlmqO0-0og9Pmt8c_IKJQ,198848,3200,953
7dg0-O2iXDE,Stock Market Trading For Beginners Using Dynamic System | Part #3,https://www.youtube.com/watch?v=7dg0-O2iXDE,2011-05-10 18:25:15+00:00,4904.0,47.0,UCImlmqO0-0og9Pmt8c_IKJQ,198848,3200,953
_0d3fTZ3y_Y,Millionaire: The Stock Market Simulation for the Apple II,https://www.youtube.com/watch?v=_0d3fTZ3y_Y,2011-05-25 05:16:00+00:00,3641.0,15.0,UCrqu6imeJQ_A7YcB-dLFlfQ,14494568,12500,9798
mbWhKM77r0I,Wall Street: The speed traders,https://www.youtube.com/watch?v=mbWhKM77r0I,2011-06-06 00:00:00+00:00,493118.0,5369.0,UC8p1vwvWtl6T73JiExfWs1g,4669000492,5410000,115974
I5nAovTXu6I,Wall Street: The speed traders,https://www.youtube.com/watch?v=I5nAovTXu6I,2011-06-06 00:00:00+00:00,6138.0,57.0,UClzCn8DxRSCuMFv_WfzkcrQ,1991158318,2080000,50841
w2lBE6ei-9g,"Stock Market Videos: Stocks Set To Bounce, Projections, Analysis",https://www.youtube.com/watch?v=w2lBE6ei-9g,2011-06-11 18:03:19+00:00,1542.0,23.0,UCEggVJ_xt6van8nkzyBhK9w,4280992,27600,5415
iAExE1fbh5k,What is technical analysis in stock market,https://www.youtube.com/watch?v=iAExE1fbh5k,2011-06-21 02:27:03+00:00,43437.0,168.0,UCSGEUt-evPiTlVcHKBAI6Mg,105849,912,19
zoKaGGOaYFk,What are trends in technical analysis ( stock market) ?,https://www.youtube.com/watch?v=zoKaGGOaYFk,2011-06-27 18:04:11+00:00,30158.0,79.0,UCSGEUt-evPiTlVcHKBAI6Mg,105849,912,19
NmGc7qH4-hw,Occult Stock Market Codes,https://www.youtube.com/watch?v=NmGc7qH4-hw,2011-07-04 04:27:53+00:00,3727.0,48.0,UCRSur8lNUQN7uh1BDGvEFVA,2804115,17500,2968
xtR9qV3vkwk,Accounting for Stock Transactions,https://www.youtube.com/watch?v=xtR9qV3vkwk,2011-07-09 18:15:05+00:00,11399.0,52.0,UCTJpki0vWP0iU6v4gYBhr-Q,5087921,25300,181
l0zwLt1pjZ8,Stock Market Videos: Make Money In The Market Today,https://www.youtube.com/watch?v=l0zwLt1pjZ8,2011-07-18 17:52:36+00:00,1215.0,13.0,UCEggVJ_xt6van8nkzyBhK9w,4280992,27600,5415
k1AZMWOHz24,"Stock Market Videos: Profiting From Uncertainty, Rules Of The Trade",https://www.youtube.com/watch?v=k1AZMWOHz24,2011-07-25 18:29:01+00:00,1200.0,14.0,UCEggVJ_xt6van8nkzyBhK9w,4280992,27600,5415
zbUuCDcP6FE,"Stock Market Videos: Markets Collapse On Europe, Trades, Levels, Profits",https://www.youtube.com/watch?v=zbUuCDcP6FE,2011-08-04 18:38:41+00:00,2295.0,15.0,UCEggVJ_xt6van8nkzyBhK9w,4280992,27600,5415
3DkcLAGCMAU,"Stock Market Videos: Master Insight Into The Markets, Profit With The Pros",https://www.youtube.com/watch?v=3DkcLAGCMAU,2011-08-05 18:39:32+00:00,1341.0,22.0,UCEggVJ_xt6van8nkzyBhK9w,4280992,27600,5415
ZDOW7ppQSUI,Penny Stock Pump &amp; Dump - Stock Market Terminology,https://www.youtube.com/watch?v=ZDOW7ppQSUI,2011-08-06 21:16:37+00:00,2403.0,11.0,UCDtnOp7jxs-OxlHrYw6QTAg,66878967,90800,10325
wuNa01L0_SY,"Stock Market Trading Watch List for Tuesday, August 9th, 2011",https://www.youtube.com/watch?v=wuNa01L0_SY,2011-08-09 01:43:04+00:00,1032.0,5.0,UCQRO58I8i5NUKY-t2mylDCA,199767,758,620
PRVrSRkceHU,"Stock Market Videos: Rally Beginning, Enjoy The Profits",https://www.youtube.com/watch?v=PRVrSRkceHU,2011-08-10 18:19:54+00:00,1261.0,23.0,UCEggVJ_xt6van8nkzyBhK9w,4280992,27600,5415
LTVxK6Rqpco,Stock Market Analysis 8/10/11,https://www.youtube.com/watch?v=LTVxK6Rqpco,2011-08-10 20:21:21+00:00,2028.0,19.0,UCfD3rq06LaA8wc3s2m3LwRQ,6055929,58800,1975
enm5cLrOvNw,"Stock market Trading Watch List For Friday, August 19th, 2011",https://www.youtube.com/watch?v=enm5cLrOvNw,2011-08-19 04:40:24+00:00,1015.0,535.0,UCQRO58I8i5NUKY-t2mylDCA,199767,758,620
b8JW6orf1Z4,"Stock Market Videos: Markets Nearing Key Breakpoint, Profit now",https://www.youtube.com/watch?v=b8JW6orf1Z4,2011-08-22 18:37:36+00:00,1191.0,21.0,UCEggVJ_xt6van8nkzyBhK9w,4280992,27600,5415
JDWjBWx2-EQ,Stock Market Videos: How To Trade The Future Like Institutions,https://www.youtube.com/watch?v=JDWjBWx2-EQ,2011-08-25 18:49:00+00:00,1190.0,20.0,UCEggVJ_xt6van8nkzyBhK9w,4280992,27600,5415
tqwb3KjL_Ao,Stock Market Videos: The Keys To Profiting From Next Week,https://www.youtube.com/watch?v=tqwb3KjL_Ao,2011-09-04 18:23:41+00:00,1274.0,22.0,UCEggVJ_xt6van8nkzyBhK9w,4280992,27600,5415
l8WO2cNyTwc,Stock Market Analysis 9/6/11,https://www.youtube.com/watch?v=l8WO2cNyTwc,2011-09-06 20:31:50+00:00,1842.0,14.0,UCfD3rq06LaA8wc3s2m3LwRQ,6055929,58800,1975
zp-0y1IW0ls,What is a Gagged Transfer Agent (&quot;TA&quot;)? - Stock Market Terminology,https://www.youtube.com/watch?v=zp-0y1IW0ls,2011-09-07 01:40:51+00:00,1483.0,3.0,UCDtnOp7jxs-OxlHrYw6QTAg,66878967,90800,10325
OEzsdiX3qAs,Bull flag Bear flag chart patterns on the E-mini S&amp;P 500,https://www.youtube.com/watch?v=OEzsdiX3qAs,2011-09-13 08:08:29+00:00,1817.0,15.0,UCe6tb9LKiIu9eD2fVZurxnQ,8947557,41000,4286
GRnE38YyNC4,Stock Market Videos: Learn How To Trade From The Pros,https://www.youtube.com/watch?v=GRnE38YyNC4,2011-09-13 18:34:53+00:00,1088.0,11.0,UCEggVJ_xt6van8nkzyBhK9w,4280992,27600,5415
ObD4qO7gVlY,Bearish Stock Market Outlook Intact,https://www.youtube.com/watch?v=ObD4qO7gVlY,2011-09-19 03:52:41+00:00,1604.0,,UC_ywfvIR2JrnMuZt33y7QYQ,8327980,69000,654
7b3lGTNBdBU,Stock Market Videos: Markets Up Ahead Of Key Fed Announcement,https://www.youtube.com/watch?v=7b3lGTNBdBU,2011-09-20 18:43:55+00:00,1296.0,13.0,UCEggVJ_xt6van8nkzyBhK9w,4280992,27600,5415
xH3Pn3baG1Q,Selling Short - How To Profit From A Stock Market Crash,https://www.youtube.com/watch?v=xH3Pn3baG1Q,2011-10-02 13:08:38+00:00,46279.0,521.0,UCnJjRjmthxPCoQaAL44tR6g,43854246,376000,769
Y8hiaEu68k8,"Stock Market Videos: Markets Tag Master Low, Key Levels Revealed",https://www.youtube.com/watch?v=Y8hiaEu68k8,2011-10-03 18:24:33+00:00,1164.0,13.0,UCEggVJ_xt6van8nkzyBhK9w,4280992,27600,5415
Fy0gYxMjCuY,Stock Market Videos: Wild Swings As Key Levels Create Profits,https://www.youtube.com/watch?v=Fy0gYxMjCuY,2011-10-04 18:37:52+00:00,1042.0,16.0,UCEggVJ_xt6van8nkzyBhK9w,4280992,27600,5415
0k20uP03ci0,Stock Market Expert Videos: Will The S&amp;P 500 Surge Continue,https://www.youtube.com/watch?v=0k20uP03ci0,2011-10-16 02:21:04+00:00,1349.0,10.0,UCEggVJ_xt6van8nkzyBhK9w,4280992,27600,5415
dbfkbZwlXio,What is a stock exchange? - MoneyWeek Investment Tutorials,https://www.youtube.com/watch?v=dbfkbZwlXio,2011-10-20 15:44:15+00:00,178658.0,1611.0,UCKrz9GW8_Dtm41aOc05S4Vg,21305452,293000,448
F6_h6go5bwQ,10.25.2011 - Stock Market and Silver Technical Analysis,https://www.youtube.com/watch?v=F6_h6go5bwQ,2011-10-25 15:03:20+00:00,1732.0,35.0,UCoWvWMmXMPXiu1T9B1ZekOA,3557868,12000,4775
hi2XpUNS2Wo,"Stock Market Videos: Sell On Earnings, Europe, Economic News",https://www.youtube.com/watch?v=hi2XpUNS2Wo,2011-10-25 18:54:45+00:00,1148.0,14.0,UCEggVJ_xt6van8nkzyBhK9w,4280992,27600,5415
FinRqCocwGE,The Gun Markets of Pakistan with Suroosh Alvi,https://www.youtube.com/watch?v=FinRqCocwGE,2011-10-26 16:24:13+00:00,13867495.0,99112.0,UCn8zNIfYAQNdrFRrr8oibKw,4791011838,17500000,3973
Qwj7t5RlPOI,Stock Market Videos: Here Is The Trade Off The Hangover,https://www.youtube.com/watch?v=Qwj7t5RlPOI,2011-10-28 18:28:20+00:00,1252.0,18.0,UCEggVJ_xt6van8nkzyBhK9w,4280992,27600,5415
0tQ4y3yIyg0,Halloween Black Monday 10/31/11 Stock Market Update!,https://www.youtube.com/watch?v=0tQ4y3yIyg0,2011-10-31 14:33:22+00:00,2652.0,56.0,UC4SH8rh0OjYV3zwqnIfqNbA,247848122,367000,16011
4iybvz69MRg,"Basic Stock Market Investing Strategies:  Breakouts, Pullbacks and Bollinger Bands",https://www.youtube.com/watch?v=4iybvz69MRg,2011-11-06 14:07:53+00:00,9862.0,21.0,UCi3HkGY69ZLZhAHE729Rz6w,624359,2830,290
wQ7fDvfqwbc,Stock Market Videos: Analysis And Trade Setups For Today,https://www.youtube.com/watch?v=wQ7fDvfqwbc,2011-11-08 19:32:21+00:00,1193.0,19.0,UCEggVJ_xt6van8nkzyBhK9w,4280992,27600,5415
nwnt9VZ_qWs,"Stock Market Videos: Live Trade Taken, Profits Everywhere",https://www.youtube.com/watch?v=nwnt9VZ_qWs,2011-11-09 19:43:40+00:00,1253.0,19.0,UCEggVJ_xt6van8nkzyBhK9w,4280992,27600,5415
yZWoQl4FuCY,Alphatrends Stock Market Analysis 11/14/11,https://www.youtube.com/watch?v=yZWoQl4FuCY,2011-11-14 21:22:04+00:00,1348.0,5.0,UCfD3rq06LaA8wc3s2m3LwRQ,6055929,58800,1975
tdrpCsm9sNI,www.SP500Chart.com S&amp;P 500 Technical Analysis Weekly Review for 11/18/2011,https://www.youtube.com/watch?v=tdrpCsm9sNI,2011-11-19 15:50:47+00:00,1094.0,,UCdpLlkAPtsMMJPvg26V-KJA,327249,1350,1151
EkUfa9oO2zY,Stockscores Market Analysis for Nov 21,https://www.youtube.com/watch?v=EkUfa9oO2zY,2011-11-22 06:41:19+00:00,1351.0,7.0,UC151mnaPrIvTELng72QtFDQ,1665628,18300,855
fnU2x2PlAmk,Alphatrends Stock Market Analysis 11/25/11,https://www.youtube.com/watch?v=fnU2x2PlAmk,2011-11-25 19:32:26+00:00,1805.0,19.0,UCfD3rq06LaA8wc3s2m3LwRQ,6055929,58800,1975
QmKC86W4TBg,Setting Up Templates &amp; Layouts In Stock Market Software Metastock,https://www.youtube.com/watch?v=QmKC86W4TBg,2011-11-28 11:32:28+00:00,8244.0,39.0,UCveoezNsTziAUt89zn0GMTQ,79458,509,36
Ti4eqnL_L1s,What is the relationship between Gold Prices and the US Dollar,https://www.youtube.com/watch?v=Ti4eqnL_L1s,2011-11-29 05:23:55+00:00,62601.0,726.0,UCgV0Ej3y9m2shjfy1mNsSkw,66089,526,39
ntoAWMLj4tM,"Stock Market Videos: If You Were Not Long, Shame!",https://www.youtube.com/watch?v=ntoAWMLj4tM,2011-11-30 19:47:33+00:00,1580.0,20.0,UCEggVJ_xt6van8nkzyBhK9w,4280992,27600,5415
MD_drYvIFz0,Stock Market Videos: Predicting The Next Market Move,https://www.youtube.com/watch?v=MD_drYvIFz0,2011-12-01 18:12:47+00:00,1417.0,16.0,UCEggVJ_xt6van8nkzyBhK9w,4280992,27600,5415
9GSHuzCB4T8,Stock Market Video: Learn How The Master Levels Tell Every Move,https://www.youtube.com/watch?v=9GSHuzCB4T8,2011-12-03 17:37:02+00:00,3375.0,17.0,UCEggVJ_xt6van8nkzyBhK9w,4280992,27600,5415
ofqwwMSIT4Q,ANC Shop Talk: Stock Market 101 | Part 1,https://www.youtube.com/watch?v=ofqwwMSIT4Q,2011-12-05 08:12:01+00:00,10275.0,24.0,UCvi6hEzLM-Z_unKPSuuzKvg,696629961,1430000,64607
qtP6S5ESUxI,Stock Market Video: Explaining The True Market Action,https://www.youtube.com/watch?v=qtP6S5ESUxI,2011-12-08 19:20:01+00:00,1340.0,12.0,UCEggVJ_xt6van8nkzyBhK9w,4280992,27600,5415
mpWw-MZd8bY,Stock Market Video: The Next Major Move In The Market,https://www.youtube.com/watch?v=mpWw-MZd8bY,2011-12-10 20:11:08+00:00,1970.0,12.0,UCEggVJ_xt6van8nkzyBhK9w,4280992,27600,5415
P86ocS5gkNw,www.SP500Chart.com S&amp;P 500 Weekly Review and Daily Update for 12/9/2011,https://www.youtube.com/watch?v=P86ocS5gkNw,2011-12-10 22:13:52+00:00,3456.0,,UCdpLlkAPtsMMJPvg26V-KJA,327249,1350,1151
GuVvSJCdpbI,Stock Market Video: Choppy Action Means Macro Bull Flag,https://www.youtube.com/watch?v=GuVvSJCdpbI,2011-12-12 19:44:43+00:00,1540.0,14.0,UCEggVJ_xt6van8nkzyBhK9w,4280992,27600,5415
yBwxTIvNUwg,Alphatrends Stock Market Analysis 12/16/11,https://www.youtube.com/watch?v=yBwxTIvNUwg,2011-12-16 22:16:49+00:00,1313.0,10.0,UCfD3rq06LaA8wc3s2m3LwRQ,6055929,58800,1975
aCJ7yKGlu68,www.SP500Chart.com S&amp;P 500 Weekly Review and Daily Update for 12/16/2011,https://www.youtube.com/watch?v=aCJ7yKGlu68,2011-12-17 17:05:29+00:00,25915.0,,UCdpLlkAPtsMMJPvg26V-KJA,327249,1350,1151
yhDO1-QGIyk,Stock Market Video: Market Setups For The Week,https://www.youtube.com/watch?v=yhDO1-QGIyk,2011-12-17 19:55:39+00:00,1400.0,12.0,UCEggVJ_xt6van8nkzyBhK9w,4280992,27600,5415
gDaoh6f_QLc,Alphatrends Stock Market Analysis 12/24/11,https://www.youtube.com/watch?v=gDaoh6f_QLc,2011-12-24 21:52:14+00:00,1617.0,9.0,UCfD3rq06LaA8wc3s2m3LwRQ,6055929,58800,1975
slhwGuJULlM,Stock Market Video: Revealing The Next Market Move,https://www.youtube.com/watch?v=slhwGuJULlM,2011-12-31 19:45:35+00:00,2090.0,20.0,UCEggVJ_xt6van8nkzyBhK9w,4280992,27600,5415
PEMkfgrifDw,"Market equilibrium | Supply, demand, and market equilibrium | Microeconomics | Khan Academy",https://www.youtube.com/watch?v=PEMkfgrifDw,2012-01-02 19:57:29+00:00,1628045.0,10559.0,UC4a-Gbdw7vOaccHmFo40b9g,2097916959,8140000,8454
5VmTJ9LrLek,How To Calculate Market Share in Excel,https://www.youtube.com/watch?v=5VmTJ9LrLek,2012-01-03 09:59:32+00:00,186642.0,726.0,UCydJQVl-GRFlpm1eDkePEVw,3911735,6310,52
I5b8FmVxNH4,Stock Market Videos: Key Breakout And January Plays,https://www.youtube.com/watch?v=I5b8FmVxNH4,2012-01-03 19:30:55+00:00,1173.0,11.0,UCEggVJ_xt6van8nkzyBhK9w,4280992,27600,5415
Wjlw7ZpZVK4,What are derivatives? - MoneyWeek Investment Tutorials,https://www.youtube.com/watch?v=Wjlw7ZpZVK4,2012-01-03 22:38:44+00:00,801340.0,8178.0,UCKrz9GW8_Dtm41aOc05S4Vg,21305452,293000,448
3xvzZWw0AuI,Stock Market Video: Continued Upside Expected,https://www.youtube.com/watch?v=3xvzZWw0AuI,2012-01-04 19:27:05+00:00,1267.0,11.0,UCEggVJ_xt6van8nkzyBhK9w,4280992,27600,5415
6XpSsw2VZLw,www.SP500Chart.com S&amp;P 500 Weekly Review and Daily Update for 1/6/2012,https://www.youtube.com/watch?v=6XpSsw2VZLw,2012-01-06 21:48:05+00:00,1011.0,,UCdpLlkAPtsMMJPvg26V-KJA,327249,1350,1151
SA3iAiIuEmA,Stock Market Video: Live Trade Analysis For Profit,https://www.youtube.com/watch?v=SA3iAiIuEmA,2012-01-07 19:04:47+00:00,2800.0,16.0,UCEggVJ_xt6van8nkzyBhK9w,4280381,27600,5413
7Ub8uHHTTwo,PHP Stock Market Analyzer - 3 - Connecting to the Database,https://www.youtube.com/watch?v=7Ub8uHHTTwo,2012-01-09 16:18:24+00:00,20659.0,90.0,UCJbPGzawDH1njbqV-D5HqKw,500619935,2670000,4458
WgE-PdJUVsg,PHP Stock Market Analyzer - 6 - Downloading and Saving Data,https://www.youtube.com/watch?v=WgE-PdJUVsg,2012-01-09 16:28:17+00:00,16677.0,87.0,UCJbPGzawDH1njbqV-D5HqKw,500619935,2670000,4458
dEWNTqEr0lQ,PHP Stock Market Analyzer - 15 - Getting Tomorrows Date,https://www.youtube.com/watch?v=dEWNTqEr0lQ,2012-01-09 17:03:39+00:00,9192.0,43.0,UCJbPGzawDH1njbqV-D5HqKw,500619935,2670000,4458
8wOPR-d9akA,"Stock Market Video: Earnings On Tap, Light Volume Float",https://www.youtube.com/watch?v=8wOPR-d9akA,2012-01-09 19:36:26+00:00,1089.0,13.0,UCEggVJ_xt6van8nkzyBhK9w,4280992,27600,5415
W0CjoayXATM,"Stock Market Videos: Major Target Hit, Chart Reading Is Key",https://www.youtube.com/watch?v=W0CjoayXATM,2012-01-10 19:35:01+00:00,1063.0,10.0,UCEggVJ_xt6van8nkzyBhK9w,4280992,27600,5415
QqK6H1JPjv0,What are &#39;market makers&#39;? - MoneyWeek Investment Tutorials,https://www.youtube.com/watch?v=QqK6H1JPjv0,2012-01-10 20:30:32+00:00,249641.0,3845.0,UCKrz9GW8_Dtm41aOc05S4Vg,21303706,293000,448
ldeho0Xb8sQ,Stock Market Video: Analysis From A Pro,https://www.youtube.com/watch?v=ldeho0Xb8sQ,2012-01-12 19:57:51+00:00,1305.0,15.0,UCEggVJ_xt6van8nkzyBhK9w,4280992,27600,5415
haJ6FlEuaLc,"Stock Market Secrets +Free Extra $2,000 a Month + Emails",https://www.youtube.com/watch?v=haJ6FlEuaLc,2012-01-13 04:33:45+00:00,12658.0,105.0,UC1CK0ojo3qBdpwqZ7h8pzmw,29482746,134000,1180
hIoIZRJQiMI,Stock Market Probability and Odds Analysis - Technical Analysis,https://www.youtube.com/watch?v=hIoIZRJQiMI,2012-01-17 12:07:26+00:00,30252.0,237.0,UCQAvjhqp559qSQx2dcg9WVg,22390583,276000,736
8VNmVr6OwoQ,Alphatrends Stock Market Analysis 1/17/11,https://www.youtube.com/watch?v=8VNmVr6OwoQ,2012-01-17 21:27:24+00:00,1419.0,9.0,UCfD3rq06LaA8wc3s2m3LwRQ,6055929,58800,1975
Ttt675hN9nQ,"Stock Market Video: Market Top Analysis, Profit Today",https://www.youtube.com/watch?v=Ttt675hN9nQ,2012-01-25 19:26:35+00:00,1449.0,14.0,UCEggVJ_xt6van8nkzyBhK9w,4280381,27600,5413
81a4W60hvyc,Alphatrends Stock Market Analysis 1/27/12,https://www.youtube.com/watch?v=81a4W60hvyc,2012-01-27 22:42:29+00:00,1549.0,8.0,UCfD3rq06LaA8wc3s2m3LwRQ,6055091,58800,1975
vYJqgMswOQU,Stock Market Video: Education To Avoid The Wall Street Hype,https://www.youtube.com/watch?v=vYJqgMswOQU,2012-02-01 19:40:46+00:00,1668.0,13.0,UCEggVJ_xt6van8nkzyBhK9w,4280381,27600,5413
zmiOMoR0YcM,Alphatrends Stock Market Analysis 2/3/12,https://www.youtube.com/watch?v=zmiOMoR0YcM,2012-02-03 21:23:38+00:00,1594.0,15.0,UCfD3rq06LaA8wc3s2m3LwRQ,6055091,58800,1975
yIeZKkyLolw,www.SP500Chart.com S&amp;P 500 Weekly Review and Daily Update for 2/3/2012,https://www.youtube.com/watch?v=yIeZKkyLolw,2012-02-04 19:07:16+00:00,1058.0,,UCdpLlkAPtsMMJPvg26V-KJA,327243,1350,1151
EA5RkUW7OUI,Short Setups Reveled With Stock Market Analysis,https://www.youtube.com/watch?v=EA5RkUW7OUI,2012-02-08 19:38:58+00:00,1278.0,15.0,UCEggVJ_xt6van8nkzyBhK9w,4280381,27600,5413
vuHPjcLcPNE,Medusa Shocks The Stock Markets Again,https://www.youtube.com/watch?v=vuHPjcLcPNE,2012-02-10 13:47:32+00:00,1240.0,13.0,UCEggVJ_xt6van8nkzyBhK9w,4280381,27600,5413
4PA3tP2NSE8,The Stock Market Insight That Will Make You Millions,https://www.youtube.com/watch?v=4PA3tP2NSE8,2012-02-13 19:46:20+00:00,2688.0,20.0,UCEggVJ_xt6van8nkzyBhK9w,4280381,27600,5413
wNzRlHbQwxA,Stock Market Speculation in the 1920&#39;s.mp4,https://www.youtube.com/watch?v=wNzRlHbQwxA,2012-02-14 20:07:27+00:00,9491.0,113.0,UC3WFVZBuhFDpdkoO8IED1Aw,2302764,14600,269
OQY-JhYAyQ0,Stock Market 101: Investment diversification strategies for beginners,https://www.youtube.com/watch?v=OQY-JhYAyQ0,2012-02-17 08:05:07+00:00,10694.0,40.0,UCvi6hEzLM-Z_unKPSuuzKvg,695788314,1430000,64552
0naiMBF8ULg,Alphatrends Stock Market Analysis Week Ending 2/17/12,https://www.youtube.com/watch?v=0naiMBF8ULg,2012-02-17 21:41:42+00:00,1837.0,7.0,UCfD3rq06LaA8wc3s2m3LwRQ,6055091,58800,1975
gXx46s0lZ8Y,Jim Cramer - How Does News Affect the Stock Market?,https://www.youtube.com/watch?v=gXx46s0lZ8Y,2012-02-18 20:29:29+00:00,2031.0,3.0,UCYGJMSR_s0cX5W0cOvpC7Xw,1424278,752,185
mG8f3rxiPyw,VIX Shows Extended Stock Market,https://www.youtube.com/watch?v=mG8f3rxiPyw,2012-02-26 20:59:57+00:00,2464.0,,UC_ywfvIR2JrnMuZt33y7QYQ,8327254,69000,654
eQYy25kLijA,"The truth about rising gas prices, the stock market, &amp; Warren Buffett&#39;s taxes",https://www.youtube.com/watch?v=eQYy25kLijA,2012-02-28 02:36:00+00:00,64186.0,1020.0,UCIjuLiLHdFxYtFmWlbTGQRQ,125630025,567000,2397
y6ToWWXAib0,Stock Market Timing Newsletter- U.S. Consumer Confidence - 20120229,https://www.youtube.com/watch?v=y6ToWWXAib0,2012-02-29 12:57:26+00:00,1549.0,78.0,UCtk2fVemNAVoegSFWOK2GVA,1125991,5540,3427
BO6rE_Vxf6E,Alphatrends Stock Market Analysis 2/29/12,https://www.youtube.com/watch?v=BO6rE_Vxf6E,2012-02-29 21:32:15+00:00,1343.0,14.0,UCfD3rq06LaA8wc3s2m3LwRQ,6055091,58800,1975
vItRHYu-A88,Money supply and demand impacting interest rates | Macroeconomics | Khan Academy,https://www.youtube.com/watch?v=vItRHYu-A88,2012-03-01 00:17:29+00:00,358285.0,1615.0,UC4a-Gbdw7vOaccHmFo40b9g,2097515761,8140000,8454
nZb0lo1sIwI,Stock Market Timing - Get Ready for a Major Trend Change,https://www.youtube.com/watch?v=nZb0lo1sIwI,2012-03-05 13:16:06+00:00,7413.0,274.0,UCtk2fVemNAVoegSFWOK2GVA,1125991,5540,3427
d9Ty6AVkTuo,Stock Market Analysis 3/5/12 Alphatrends,https://www.youtube.com/watch?v=d9Ty6AVkTuo,2012-03-05 21:21:15+00:00,1409.0,8.0,UCfD3rq06LaA8wc3s2m3LwRQ,6055091,58800,1975
bMRXAapP0C8,Stock Market Timing - Are You Ready To Sell?,https://www.youtube.com/watch?v=bMRXAapP0C8,2012-03-06 13:10:50+00:00,37588.0,233.0,UCtk2fVemNAVoegSFWOK2GVA,1125991,5540,3427
beVKVkkiyqw,Market Timing Service - Still Watching S&amp;P 500 1375,https://www.youtube.com/watch?v=beVKVkkiyqw,2012-03-12 12:36:23+00:00,3326.0,121.0,UCtk2fVemNAVoegSFWOK2GVA,1125991,5540,3427
6iKSaSMmbPY,Stock Market Trading - Lock in Some Apple Profits Today,https://www.youtube.com/watch?v=6iKSaSMmbPY,2012-03-16 12:57:31+00:00,1325.0,58.0,UCtk2fVemNAVoegSFWOK2GVA,1125991,5540,3427
C3s6AHxTAJs,Canadian Stock Market Analysis - 20120321,https://www.youtube.com/watch?v=C3s6AHxTAJs,2012-03-21 11:19:24+00:00,1150.0,56.0,UCtk2fVemNAVoegSFWOK2GVA,1125991,5540,3427
67hHDfDwL-E,"Faber Expects 10% Drop in S&amp;P 500, Says Stocks Expensive: Video",https://www.youtube.com/watch?v=67hHDfDwL-E,2012-03-23 16:37:19+00:00,12516.0,,UCUMZ7gohGI9HcU9VNsr2FJQ,889570450,3590000,48613
MkLETkIOYOQ,Alphatrends Stock Market Analysis Week Ending 3/23/12,https://www.youtube.com/watch?v=MkLETkIOYOQ,2012-03-23 20:49:24+00:00,2107.0,13.0,UCfD3rq06LaA8wc3s2m3LwRQ,6055091,58800,1975
I0Jbce3i29c,"Emini S&amp;P 500 Day Trading Futures, VWAP",https://www.youtube.com/watch?v=I0Jbce3i29c,2012-03-27 21:02:21+00:00,12600.0,75.0,UCl8Ah_nWaHZmGfM6Ni4TMug,136432,379,491
dnapCVyZV44,What is market abuse? - MoneyWeek Investment Tutorials,https://www.youtube.com/watch?v=dnapCVyZV44,2012-04-05 13:24:53+00:00,18095.0,182.0,UCKrz9GW8_Dtm41aOc05S4Vg,21303706,293000,448
89wc2c1UVFM,Alphatrends Stock Market Analysis Week Ending 4/13/12,https://www.youtube.com/watch?v=89wc2c1UVFM,2012-04-13 20:30:04+00:00,2062.0,15.0,UCfD3rq06LaA8wc3s2m3LwRQ,6055091,58800,1975
4MoR0ucU7ew,Stock Market Timing - Ignore Tuesday,https://www.youtube.com/watch?v=4MoR0ucU7ew,2012-04-18 12:38:38+00:00,3768.0,2.0,UCtk2fVemNAVoegSFWOK2GVA,1125991,5540,3427
EHjToZLtSnA,Stock Market Basics - How The Stock Price Is Set,https://www.youtube.com/watch?v=EHjToZLtSnA,2012-04-21 21:14:44+00:00,21298.0,54.0,UC5k4XTTGxGoK2tTQryb_4MQ,89133,447,29
cFgLvcEoOzc,Stock Market Basics - The Initial Public Offering or IPO,https://www.youtube.com/watch?v=cFgLvcEoOzc,2012-04-22 01:50:12+00:00,10823.0,17.0,UC5k4XTTGxGoK2tTQryb_4MQ,89133,447,29
WvAdIVMEct8,Stock Market Basics - Research A Stock As A Company,https://www.youtube.com/watch?v=WvAdIVMEct8,2012-04-22 01:59:23+00:00,1836.0,3.0,UC5k4XTTGxGoK2tTQryb_4MQ,89133,447,29
BMZDfRRLWus,Stock Market Basics - Factors That Affect Supply and Demand,https://www.youtube.com/watch?v=BMZDfRRLWus,2012-04-22 21:43:15+00:00,6900.0,13.0,UC5k4XTTGxGoK2tTQryb_4MQ,89133,447,29
Z8IytC2UUsg,Stock Market Trading Newsletter - Confidence is Low,https://www.youtube.com/watch?v=Z8IytC2UUsg,2012-04-26 12:45:21+00:00,1097.0,6.0,UCtk2fVemNAVoegSFWOK2GVA,1125991,5540,3427
5jl7NS_K7xY,Alphatrends Stock Market Analysis Week Ending 4/27/12,https://www.youtube.com/watch?v=5jl7NS_K7xY,2012-04-27 20:25:29+00:00,1766.0,7.0,UCfD3rq06LaA8wc3s2m3LwRQ,6055091,58800,1975
Edx5UR4yFOo,10. Stock Market Crash and Market Bubbles,https://www.youtube.com/watch?v=Edx5UR4yFOo,2012-04-29 11:44:31+00:00,249347.0,2712.0,UCLTdCY-fNXc1GqzIuflK-OQ,18549124,225000,699
lml9wEWcGuo,Stock Market Trading Necessary For Long Term Investing?,https://www.youtube.com/watch?v=lml9wEWcGuo,2012-05-01 05:07:28+00:00,36736.0,317.0,UCcjyImdSWDTCGCa7G24faIQ,11232300,107000,465
I8RbLeNffzI,Alphatrends Stock Market Analysis 5/3/12,https://www.youtube.com/watch?v=I8RbLeNffzI,2012-05-03 20:39:44+00:00,1363.0,11.0,UCfD3rq06LaA8wc3s2m3LwRQ,6055091,58800,1975
flnHXBbAK4o,Stock Market Video: Understanding The Facebook IPO Manipulation,https://www.youtube.com/watch?v=flnHXBbAK4o,2012-05-21 18:40:50+00:00,1874.0,15.0,UCEggVJ_xt6van8nkzyBhK9w,4280381,27600,5413
1HRXW1DfDF4,How to Time the Stock Market,https://www.youtube.com/watch?v=1HRXW1DfDF4,2012-05-29 19:35:56+00:00,3023.0,27.0,UCPu1mkB9N5oY2kvf-DJ4VxQ,980973,2730,859
sK9Qg-u8T24,Day Trading - How to Make a Living Trading the Stock Market - SCATE 2012,https://www.youtube.com/watch?v=sK9Qg-u8T24,2012-05-30 00:01:43+00:00,3723.0,12.0,UC151mnaPrIvTELng72QtFDQ,1665175,18300,854
BEUvGAr61nE,Canadian Stock Market Analysis - 20120601,https://www.youtube.com/watch?v=BEUvGAr61nE,2012-06-01 11:40:16+00:00,1836.0,2.0,UCtk2fVemNAVoegSFWOK2GVA,1125991,5540,3427
IMa0URvdKNc,Canadian Stock Market Analysis - 20120604,https://www.youtube.com/watch?v=IMa0URvdKNc,2012-06-04 13:25:51+00:00,1037.0,1.0,UCtk2fVemNAVoegSFWOK2GVA,1125991,5540,3427
pFffouTcG1w,Stock Market Analysis 6/7/12,https://www.youtube.com/watch?v=pFffouTcG1w,2012-06-07 20:34:49+00:00,1053.0,10.0,UCfD3rq06LaA8wc3s2m3LwRQ,6055091,58800,1975
VzEECtJX6Ng,Alphatrends Stock Market Technical Analysis 6/11/12,https://www.youtube.com/watch?v=VzEECtJX6Ng,2012-06-11 20:16:59+00:00,1494.0,12.0,UCfD3rq06LaA8wc3s2m3LwRQ,6055091,58800,1975
GMb1hlLOXkM,Stock Market Trading Moon Cycles 20120613,https://www.youtube.com/watch?v=GMb1hlLOXkM,2012-06-13 13:33:53+00:00,4219.0,25.0,UCtk2fVemNAVoegSFWOK2GVA,1125991,5540,3427
VjIr9RA4dPs,U.S. Markets Ahead of Greece 06-14-2012,https://www.youtube.com/watch?v=VjIr9RA4dPs,2012-06-14 21:16:36+00:00,1260.0,18.0,UCmp8PhCEfZaWEDPYrowYujQ,5428381,35400,1106
Uf-vY5Z4-x4,U.S. Market Analysis 06-19-2012,https://www.youtube.com/watch?v=Uf-vY5Z4-x4,2012-06-19 21:09:12+00:00,1033.0,14.0,UCmp8PhCEfZaWEDPYrowYujQ,5428381,35400,1106
VhcX4C-dOeA,How To Trade In Stock Market With Dynamic Live For Beginners To Advanced  Traders,https://www.youtube.com/watch?v=VhcX4C-dOeA,2012-06-29 05:26:31+00:00,4439.0,23.0,UCImlmqO0-0og9Pmt8c_IKJQ,198846,3200,953
hdYCt8LpM8c,"Gallagher&#39;s Stock Market Seminar in Marion, Ohio (6/29/12)",https://www.youtube.com/watch?v=hdYCt8LpM8c,2012-06-30 20:00:34+00:00,1260.0,8.0,UCRW77OtPEQPNRLyhwlhWQ-g,1017821,1530,822
F94RcWvUWC0,Timing The Stock Market 20120702,https://www.youtube.com/watch?v=F94RcWvUWC0,2012-07-02 12:54:58+00:00,2943.0,383.0,UCtk2fVemNAVoegSFWOK2GVA,1125991,5540,3427
75fdzk07Xlg,Canadian Stock Market Technical Analysis 20120703,https://www.youtube.com/watch?v=75fdzk07Xlg,2012-07-03 13:18:21+00:00,1158.0,1.0,UCtk2fVemNAVoegSFWOK2GVA,1125991,5540,3427
ADwZqc9WZhQ,Stock Market Technical Analysis Week Ending 7/13/12,https://www.youtube.com/watch?v=ADwZqc9WZhQ,2012-07-13 20:30:43+00:00,1676.0,9.0,UCfD3rq06LaA8wc3s2m3LwRQ,6055091,58800,1975
sbPByb-NXdQ,What is a repo? - MoneyWeek investment tutorials,https://www.youtube.com/watch?v=sbPByb-NXdQ,2012-07-19 11:33:57+00:00,182090.0,2597.0,UCKrz9GW8_Dtm41aOc05S4Vg,21303706,293000,448
C38TiygpmU0,Stock Market Analysis for Week Ending 7/20/12,https://www.youtube.com/watch?v=C38TiygpmU0,2012-07-20 20:26:58+00:00,1512.0,13.0,UCfD3rq06LaA8wc3s2m3LwRQ,6055091,58800,1975
YSBfaYKtBhQ,Stock Market Forecast: The Next 15 Years and One Strategy That Will Outperform,https://www.youtube.com/watch?v=YSBfaYKtBhQ,2012-07-29 04:14:58+00:00,1348.0,6.0,UCQH3d17HKuhp-bg_z8ourNQ,775656,7120,200
ut6q-p8JD88,Timing The Stock Market 20120731,https://www.youtube.com/watch?v=ut6q-p8JD88,2012-07-31 12:32:32+00:00,4925.0,552.0,UCtk2fVemNAVoegSFWOK2GVA,1125991,5540,3427
mp_77S5Exkw,Stock Market Analysis For Week Ending 8/3/12,https://www.youtube.com/watch?v=mp_77S5Exkw,2012-08-03 21:23:50+00:00,1498.0,17.0,UCfD3rq06LaA8wc3s2m3LwRQ,6055091,58800,1975
IQeKe-y3qzo,Stock Market Technical Analysis 8/14/12,https://www.youtube.com/watch?v=IQeKe-y3qzo,2012-08-14 20:34:19+00:00,1530.0,10.0,UCfD3rq06LaA8wc3s2m3LwRQ,6055091,58800,1975
Tn7S1FCiEBw,Timing The Stock Market 20120816,https://www.youtube.com/watch?v=Tn7S1FCiEBw,2012-08-16 13:49:47+00:00,2407.0,79.0,UCtk2fVemNAVoegSFWOK2GVA,1125991,5540,3427
jlhy746cwdM,How the Stock Market Works_ Working Dollars (1957 Animated Film),https://www.youtube.com/watch?v=jlhy746cwdM,2012-08-17 01:22:33+00:00,1422.0,6.0,UCRfAdOtt1MVmwx9QAeK9wiw,1408545,2790,374
50yJHK_g_Ts,How the Stock Market Works - Cartoon Tutorial - Economics and Investing Video (1952),https://www.youtube.com/watch?v=50yJHK_g_Ts,2012-08-17 01:32:07+00:00,50575.0,398.0,UCRfAdOtt1MVmwx9QAeK9wiw,1408545,2790,374
57Gf2z3Ij2U,Stock Market Video Analysis for Week Ending 8/24/12,https://www.youtube.com/watch?v=57Gf2z3Ij2U,2012-08-24 20:39:21+00:00,1636.0,10.0,UCfD3rq06LaA8wc3s2m3LwRQ,6055091,58800,1975
CUcnD_StbO4,"Action Alert: Stock Market Levels, Direction, Cycles And Profits",https://www.youtube.com/watch?v=CUcnD_StbO4,2012-09-01 16:26:33+00:00,1391.0,19.0,UCEggVJ_xt6van8nkzyBhK9w,4280381,27600,5413
vhMxye5S3ns,Timing The Canadian Stock Market - 20120904,https://www.youtube.com/watch?v=vhMxye5S3ns,2012-09-04 12:50:11+00:00,4024.0,88.0,UCtk2fVemNAVoegSFWOK2GVA,1125991,5540,3427
f8h1ugvNgBM,Timing The Stock Market 20120904,https://www.youtube.com/watch?v=f8h1ugvNgBM,2012-09-04 14:04:21+00:00,3952.0,89.0,UCtk2fVemNAVoegSFWOK2GVA,1125991,5540,3427
IJnadrVbw3E,The Basics of Stock Chart Reading - Stockscores Market Minutes for Sept 4 2012,https://www.youtube.com/watch?v=IJnadrVbw3E,2012-09-05 02:01:04+00:00,6810.0,30.0,UC151mnaPrIvTELng72QtFDQ,1665175,18300,854
etlv7qTQUSY,What is Beta? - MoneyWeek Investment Tutorials,https://www.youtube.com/watch?v=etlv7qTQUSY,2012-09-06 18:46:11+00:00,301889.0,4473.0,UCKrz9GW8_Dtm41aOc05S4Vg,21303706,293000,448
XKRXa7wW-YY,Stock Market Video Analysis For Week Ending 9/7/12,https://www.youtube.com/watch?v=XKRXa7wW-YY,2012-09-07 20:25:45+00:00,1677.0,16.0,UCfD3rq06LaA8wc3s2m3LwRQ,6055091,58800,1975
p4rcdn9ytf0,Ten Secrets Of Stock Markets Part-1| Hindi-English| Share Market Basics For Beginners,https://www.youtube.com/watch?v=p4rcdn9ytf0,2012-09-11 18:45:16+00:00,511527.0,2337.0,UC1MpYXPsMGGA7MZev4fln_g,2789349,70900,204
wVMcAx-PKb8,Time To Buy Facebook - Timing The Stock Market 20120912,https://www.youtube.com/watch?v=wVMcAx-PKb8,2012-09-12 12:04:13+00:00,11297.0,243.0,UCtk2fVemNAVoegSFWOK2GVA,1125991,5540,3427
trOe53Rw2Eo,Stock Market Analysis for Week Ending 9/14/12,https://www.youtube.com/watch?v=trOe53Rw2Eo,2012-09-14 20:34:05+00:00,1638.0,14.0,UCfD3rq06LaA8wc3s2m3LwRQ,6055091,58800,1975
QAoVCs4rs1s,Stock Market Analysis &amp; Trade Ideas for 9/23/12,https://www.youtube.com/watch?v=QAoVCs4rs1s,2012-09-21 20:30:53+00:00,1343.0,18.0,UCfD3rq06LaA8wc3s2m3LwRQ,6055091,58800,1975
YMV8YW7EfEM,Timing The Stock Market 20121001,https://www.youtube.com/watch?v=YMV8YW7EfEM,2012-10-01 13:07:05+00:00,3325.0,172.0,UCtk2fVemNAVoegSFWOK2GVA,1125991,5540,3427
oXRo3_w0f7A,Secrets of Warren Buffett&#39;s Investing Strategy - Stock Market Passive Income How to Tips,https://www.youtube.com/watch?v=oXRo3_w0f7A,2012-10-09 08:45:04+00:00,237555.0,1622.0,UCdUZd0syImlNx3btCkHtyKA,25709135,46800,479
CUrTWFGoQQU,Timing The Stock Market 20121011,https://www.youtube.com/watch?v=CUrTWFGoQQU,2012-10-11 12:45:27+00:00,1191.0,120.0,UCtk2fVemNAVoegSFWOK2GVA,1125991,5540,3427
SvwnAjC8K20,Stock Market Analysis For Week Ending 10/12/2012,https://www.youtube.com/watch?v=SvwnAjC8K20,2012-10-12 20:38:14+00:00,1683.0,17.0,UCfD3rq06LaA8wc3s2m3LwRQ,6055091,58800,1975
kjecTSDKKvs,Short Skirts and Bear Markets: An Interview with Stock Market Analyst Robert Prechter,https://www.youtube.com/watch?v=kjecTSDKKvs,2012-10-14 14:23:58+00:00,11007.0,129.0,UC0uVZd8N7FfIZnPu0y7o95A,294122718,874000,3704
bij3B2ofdD8,Options Expiration And The 1987 Stock Market Crash Anniversary,https://www.youtube.com/watch?v=bij3B2ofdD8,2012-10-19 12:48:32+00:00,1040.0,19.0,UCEggVJ_xt6van8nkzyBhK9w,4280381,27600,5413
5CFY7JU0Vww,Stock Market Analysis for Week Ending 10/26/12,https://www.youtube.com/watch?v=5CFY7JU0Vww,2012-10-26 22:23:31+00:00,1762.0,14.0,UCfD3rq06LaA8wc3s2m3LwRQ,6055091,58800,1975
s3pJkU31FL0,Timing The Stock Market 20121116,https://www.youtube.com/watch?v=s3pJkU31FL0,2012-11-16 12:51:19+00:00,7092.0,4.0,UCtk2fVemNAVoegSFWOK2GVA,1125991,5540,3427
0aGlpjSKzAs,Stock Market Analysis for Week Ending 11/23/12,https://www.youtube.com/watch?v=0aGlpjSKzAs,2012-11-24 02:33:09+00:00,2028.0,18.0,UCfD3rq06LaA8wc3s2m3LwRQ,6055091,58800,1975
9cMyEaGUgOc,"Stock Market Education for Beginners, Part 1, Market Cycles -- Investing Education",https://www.youtube.com/watch?v=9cMyEaGUgOc,2012-11-25 01:13:30+00:00,76276.0,315.0,UC2b4D05rJegJmsU13wpNBcA,943637,5020,106
feP65tTbQIw,The Stock Market - 20121207,https://www.youtube.com/watch?v=feP65tTbQIw,2012-12-07 13:37:40+00:00,1113.0,49.0,UCtk2fVemNAVoegSFWOK2GVA,1125991,5540,3427
guy361mW1BU,Stock Market Analysis for Week Ending 12/7/12,https://www.youtube.com/watch?v=guy361mW1BU,2012-12-07 21:29:04+00:00,1424.0,15.0,UCfD3rq06LaA8wc3s2m3LwRQ,6055091,58800,1975
N6gtQtSMCDs,Stock Market simulator that I use to train myself on investing,https://www.youtube.com/watch?v=N6gtQtSMCDs,2013-01-04 02:34:50+00:00,13125.0,26.0,UC_Hkx2axj50Jkmp4USHSSaQ,48234,146,169
6uznwgiVmUY,Stock Market Analysis for Week Ending 1/4/13,https://www.youtube.com/watch?v=6uznwgiVmUY,2013-01-04 21:16:31+00:00,2151.0,15.0,UCfD3rq06LaA8wc3s2m3LwRQ,6055091,58800,1975
6xdlJzHRhrk,Stock Market Trading Success Part 1,https://www.youtube.com/watch?v=6xdlJzHRhrk,2013-01-10 22:50:21+00:00,59131.0,184.0,UC24ZoKsZMFKVA_MfhgL34_w,16393442,66600,359
0NE93zCBQgU,Stock Market Analysis for Week Ending 1/18/13,https://www.youtube.com/watch?v=0NE93zCBQgU,2013-01-18 21:45:18+00:00,1802.0,20.0,UCfD3rq06LaA8wc3s2m3LwRQ,6055091,58800,1975
1qUXd0LBfI0,Stock Market for Investing in 2013,https://www.youtube.com/watch?v=1qUXd0LBfI0,2013-01-21 03:35:18+00:00,13276.0,34.0,UCcjyImdSWDTCGCa7G24faIQ,11232300,107000,465
vHs9wbkYls4,Where To Short The Stock Market,https://www.youtube.com/watch?v=vHs9wbkYls4,2013-01-28 13:13:17+00:00,1656.0,21.0,UCnJjRjmthxPCoQaAL44tR6g,43852366,376000,769
uKL53Q773T8,Stock Market Technical Analysis for Week Ending 2/1/13,https://www.youtube.com/watch?v=uKL53Q773T8,2013-02-01 21:27:40+00:00,1371.0,92.0,UCfD3rq06LaA8wc3s2m3LwRQ,6055091,58800,1975
Q4qS55imhHY,Stock Market Analysis for Week Ending 2/8/13,https://www.youtube.com/watch?v=Q4qS55imhHY,2013-02-08 21:48:14+00:00,2103.0,18.0,UCfD3rq06LaA8wc3s2m3LwRQ,6055091,58800,1975
OkHUGIsPuAc,Automated Stock Analysis Using Excel VBA and FinViz-com,https://www.youtube.com/watch?v=OkHUGIsPuAc,2013-02-09 14:49:58+00:00,57153.0,99.0,UCvxE4ylcG96JS-ltzNScSeg,706506,1050,218
AUjcGLwAzqU,Stock Market Psychology - Dr. Daniel Crosby,https://www.youtube.com/watch?v=AUjcGLwAzqU,2013-02-14 15:21:19+00:00,18707.0,,UCYMmV6qtHk4Fyb4N-khZAXQ,113889,1320,180
sXqDna_c9_M,Analyzing Stock Sector ETFs - Stockscores Market Minutes for Feb 18 2013,https://www.youtube.com/watch?v=sXqDna_c9_M,2013-02-19 02:06:54+00:00,1091.0,10.0,UC151mnaPrIvTELng72QtFDQ,1665175,18300,854
Zd-YGpwFBbc,Technical Analysis of US Stock Market 2/20/13,https://www.youtube.com/watch?v=Zd-YGpwFBbc,2013-02-20 21:15:54+00:00,1545.0,9.0,UCfD3rq06LaA8wc3s2m3LwRQ,6055091,58800,1975
if-grS048E0,Stock Market Video Analysis for Week Ending 2/22/13,https://www.youtube.com/watch?v=if-grS048E0,2013-02-22 21:19:55+00:00,2177.0,39.0,UCfD3rq06LaA8wc3s2m3LwRQ,6055091,58800,1975
XE39u2zJSwg,Stock Market to Keep on Rolling,https://www.youtube.com/watch?v=XE39u2zJSwg,2013-02-27 19:23:27+00:00,5273.0,15.0,UCIf6t3gpKr_D46xuWlj9UAQ,8451085,60300,801
LvFQmeqy0Rs,Phil&#39;s Gang Stock Market Addiction High,https://www.youtube.com/watch?v=LvFQmeqy0Rs,2013-03-02 01:07:24+00:00,3082.0,,UCrqwZJqt47QZXVkZHSOSWIA,1972647,13600,3057
Bni4qr7dcTs,Stock Market Analysis for Week Ending 3/8/13,https://www.youtube.com/watch?v=Bni4qr7dcTs,2013-03-08 21:24:40+00:00,1721.0,11.0,UCfD3rq06LaA8wc3s2m3LwRQ,6055091,58800,1975
GuIo4LKSzGo,Stock Market Analysis for Week Ending 3/15/13,https://www.youtube.com/watch?v=GuIo4LKSzGo,2013-03-15 20:32:10+00:00,1618.0,13.0,UCfD3rq06LaA8wc3s2m3LwRQ,6055091,58800,1975
_GbZDWxMlVM,Defensive Sectors Growing | Stock Market Video 3/29/2013,https://www.youtube.com/watch?v=_GbZDWxMlVM,2013-03-29 20:21:19+00:00,1333.0,1.0,UCPu1mkB9N5oY2kvf-DJ4VxQ,980973,2730,859
PO_w9g12IF8,Stock Market Analysis for Week Ending 4/5/13,https://www.youtube.com/watch?v=PO_w9g12IF8,2013-04-05 20:22:36+00:00,1709.0,15.0,UCfD3rq06LaA8wc3s2m3LwRQ,6055091,58800,1975
RNftCCwAol0,The Market Revolution: Crash Course US History #12,https://www.youtube.com/watch?v=RNftCCwAol0,2013-04-26 15:46:13+00:00,3053412.0,24394.0,UCX6b17PVsYBQ0ip5gyeme-Q,1884446179,15100000,1503
p_dSVWVAQBI,This Is The Reason The Stock Market Is Going Up,https://www.youtube.com/watch?v=p_dSVWVAQBI,2013-05-03 20:06:40+00:00,2205.0,3.0,UCpeNTBaLA3xmrKSl7f0tWTA,375332,1730,540
gHGKF8uhowk,General Market Overview On The E-Mini S&amp;P 500 Futures Market and Potential Trades,https://www.youtube.com/watch?v=gHGKF8uhowk,2013-05-06 16:01:55+00:00,1868.0,1.0,UCRmqy1bk5369J5OzG5OGQTw,886827,3200,830
hgiioLWkG7s,Stock Market Basics I How to Earn Money from The Dow Jones Blue Chip Stocks I Part 3 I Episode 7,https://www.youtube.com/watch?v=hgiioLWkG7s,2013-05-07 21:32:23+00:00,2661.0,12.0,UCO3vhVCXqUssYDYTInvto9A,4706056,22400,2671
LUzxIlpARr0,Stock Market Analysis for Week Ending 5/10/13,https://www.youtube.com/watch?v=LUzxIlpARr0,2013-05-10 20:26:22+00:00,1878.0,15.0,UCfD3rq06LaA8wc3s2m3LwRQ,6055091,58800,1975
FZy9xtSJvw4,Why Should We Invest on Stock Market in the Philippines?,https://www.youtube.com/watch?v=FZy9xtSJvw4,2013-05-11 14:41:11+00:00,98820.0,901.0,UClm7oKiRtEtV3l57XuqnTtQ,568990,9450,21
2ieeEAI4L08,"Bo Sanchez Featured on Pesos and Sense - Stock Market, How to Start?",https://www.youtube.com/watch?v=2ieeEAI4L08,2013-05-13 09:17:45+00:00,122675.0,639.0,UClm7oKiRtEtV3l57XuqnTtQ,568990,9450,21
ANele0sKKUY,Holy $hlT: This Stock Market Video Has Amazing Stuff In It,https://www.youtube.com/watch?v=ANele0sKKUY,2013-05-14 18:56:04+00:00,1239.0,18.0,UCEggVJ_xt6van8nkzyBhK9w,4280381,27600,5413
LYBB2MO3MW8,Stock Market Analysis for Week Ending 5/17/13,https://www.youtube.com/watch?v=LYBB2MO3MW8,2013-05-17 20:29:56+00:00,1754.0,12.0,UCfD3rq06LaA8wc3s2m3LwRQ,6055091,58800,1975
bkB-Xqb0JGg,Shooting Stars on all U.S. Markets 05-20-2013,https://www.youtube.com/watch?v=bkB-Xqb0JGg,2013-05-20 20:49:38+00:00,1177.0,18.0,UCmp8PhCEfZaWEDPYrowYujQ,5428381,35400,1106
c6KPVL3zoXY,Mastering Trading Psychology to improve stock market returns Pt1,https://www.youtube.com/watch?v=c6KPVL3zoXY,2013-05-21 01:20:45+00:00,10598.0,88.0,UCNueBybS08RL3iQ6YSrx4WA,926099,10000,726
ZNCsXO8IeZI,Mastering Trading Psychology to improve stock market returns Pt2,https://www.youtube.com/watch?v=ZNCsXO8IeZI,2013-05-22 02:18:48+00:00,4650.0,56.0,UCNueBybS08RL3iQ6YSrx4WA,926099,10000,726
E5bAUHm49vA,How to Spot Stock Market &amp; Forex Trading Scams 2,https://www.youtube.com/watch?v=E5bAUHm49vA,2013-05-22 13:26:27+00:00,157418.0,5531.0,UC6ZkHcW5QQubZ-Q6XYINE3Q,27841066,511000,184
rDBaowX69es,Truly Rich Club: Stock Market for Overseas Filipinos,https://www.youtube.com/watch?v=rDBaowX69es,2013-05-25 16:32:35+00:00,23711.0,145.0,UCejJUJjb8rWIYqxolod2ykg,254593,3630,19
PrLxpTfDwXI,Stock Market Reversals Explained,https://www.youtube.com/watch?v=PrLxpTfDwXI,2013-06-07 11:34:21+00:00,1491.0,5.0,UCenLy4V5NgxEz7pwosA9hiw,1132063,20500,631
suQH16fYX_E,STOCK MARKET TRADING: TRADING THE TREND REVERSAL IS AS EASY AS 1 2 3,https://www.youtube.com/watch?v=suQH16fYX_E,2013-06-07 18:43:10+00:00,5573.0,26.0,UCT4WixjPnohEg6r4EJuE0kw,70652,468,85
7cJ-3Zo1_5E,"Stock Market Analysis for Week Ending June 7, 2013",https://www.youtube.com/watch?v=7cJ-3Zo1_5E,2013-06-07 20:19:55+00:00,1903.0,12.0,UCfD3rq06LaA8wc3s2m3LwRQ,6055091,58800,1975
3dxTMAkpYJU,"Stock Market Analysis for Week Ending June 21, 2013",https://www.youtube.com/watch?v=3dxTMAkpYJU,2013-06-21 20:29:35+00:00,2870.0,11.0,UCfD3rq06LaA8wc3s2m3LwRQ,6055091,58800,1975
cKhprVKmfjE,&quot;How to make Big Pips Target trading the Forex Stock Market&quot; @marketfy,https://www.youtube.com/watch?v=cKhprVKmfjE,2013-06-26 17:42:51+00:00,1465.0,6.0,UCFEz7E6_tr4oOmEQZ_DDTCQ,278967,2190,45
_IgZweSArcc,What Is a Hot Sector and Industry in Stock Market? I Technical Analysis on Whiteboard,https://www.youtube.com/watch?v=_IgZweSArcc,2013-06-27 03:08:29+00:00,1466.0,12.0,UCO3vhVCXqUssYDYTInvto9A,4706056,22400,2671
FyXgdi1SJg0,Stock Market Analysis for First Half of 2013,https://www.youtube.com/watch?v=FyXgdi1SJg0,2013-06-28 20:53:40+00:00,2181.0,12.0,UCfD3rq06LaA8wc3s2m3LwRQ,6055091,58800,1975
Xxg9Bc6RQGg,Big Story - Local Algos Dominate Indian Stock Market,https://www.youtube.com/watch?v=Xxg9Bc6RQGg,2013-07-01 13:28:47+00:00,3141.0,11.0,UCcC8Yq1ka5NbqDWHJqCnhpA,19223505,53600,11988
AYSwiyjTCMg,Stock Market Meltdown: How to Prepare Yourself for the Upcoming Stock Market Crash,https://www.youtube.com/watch?v=AYSwiyjTCMg,2013-07-01 14:03:06+00:00,3553.0,16.0,UCELihIAZWZzYf-GjOYQ5T3w,1284173,7490,113
N-LRKDC8I1E,Euro Currency | How The Stock Market Works,https://www.youtube.com/watch?v=N-LRKDC8I1E,2013-07-12 19:19:21+00:00,1583.0,6.0,UCLDuZe12blTBAbT3hrTdIiA,107600,893,30
dDQ4BU0w6e8,Why the P/S Ratio is My Favorite Valuation Metric,https://www.youtube.com/watch?v=dDQ4BU0w6e8,2013-07-17 12:40:28+00:00,16012.0,363.0,UChLnhKjHRlCl4DSncwJ1D_A,3575219,43500,5485
s0ld-iJecTQ,The Truth About Average Stock Market Returns,https://www.youtube.com/watch?v=s0ld-iJecTQ,2013-07-24 19:59:18+00:00,5102.0,52.0,UCSmphPVkfYHatu8JBoCzi9g,1862312,981,181
StIVbAc-dBk,"Stock Market Interview: Long Term Investing, Short Term Trading",https://www.youtube.com/watch?v=StIVbAc-dBk,2013-08-01 19:54:19+00:00,2243.0,11.0,UCEggVJ_xt6van8nkzyBhK9w,4280381,27600,5413
08j9WlXsbYo,"Brian Shannon&#39;s Stock Market Video Analysis for Week Ending August 2, 2013",https://www.youtube.com/watch?v=08j9WlXsbYo,2013-08-02 20:22:09+00:00,1712.0,10.0,UCfD3rq06LaA8wc3s2m3LwRQ,6055091,58800,1975
sujphCWp00g,Stock Market Analysis for Week Ending 8/9/13,https://www.youtube.com/watch?v=sujphCWp00g,2013-08-09 22:59:18+00:00,2468.0,19.0,UCfD3rq06LaA8wc3s2m3LwRQ,6055091,58800,1975
GyEUHUYazPA,New York Stock Exchange: NYSE Nation&#39;s Market Place (1932) - CharlieDeanArchives / Archival Footage,https://www.youtube.com/watch?v=GyEUHUYazPA,2013-08-10 06:10:02+00:00,6119.0,85.0,UCuX0poHk--DqZIVh_O9G5rQ,17762470,66300,1791
4RIIqYl8Dzo,Stock Market Profits: Stocks Decline Accelerating Member Gains,https://www.youtube.com/watch?v=4RIIqYl8Dzo,2013-08-19 19:50:33+00:00,1032.0,16.0,UCEggVJ_xt6van8nkzyBhK9w,4280381,27600,5413
uaoaQb4J2FM,U.S. Market Review 08-20-2013,https://www.youtube.com/watch?v=uaoaQb4J2FM,2013-08-20 21:28:14+00:00,1074.0,18.0,UCmp8PhCEfZaWEDPYrowYujQ,5428381,35400,1106
THkpeF4FFPk,Brian Shannon Stock Market Technical Analysis 8/23/13,https://www.youtube.com/watch?v=THkpeF4FFPk,2013-08-23 20:57:51+00:00,2188.0,18.0,UCfD3rq06LaA8wc3s2m3LwRQ,6055091,58800,1975
OtxA2Wa1kPg,"Stock Market Trading Room: Expert Insight, Live Action, Profits",https://www.youtube.com/watch?v=OtxA2Wa1kPg,2013-08-26 13:01:23+00:00,1889.0,21.0,UCEggVJ_xt6van8nkzyBhK9w,4280381,27600,5413
_sCbdKZUIQQ,"Calculate Market Share: Sales GAP Analysis Customer, Territory &amp; Market",https://www.youtube.com/watch?v=_sCbdKZUIQQ,2013-09-02 21:07:59+00:00,21714.0,157.0,UCEP2IeBbRmBqnCGdWbnlEEQ,4331314,44300,86
ZHDb_Qdq3Sk,Uncertain State of the Market | Stock Market Video 9/6/13,https://www.youtube.com/watch?v=ZHDb_Qdq3Sk,2013-09-06 18:43:21+00:00,1240.0,1.0,UCPu1mkB9N5oY2kvf-DJ4VxQ,980973,2730,859
iRtFDvGORQk,Dave Explains Why He Doesn&#39;t Recommend Bonds,https://www.youtube.com/watch?v=iRtFDvGORQk,2013-09-12 15:29:44+00:00,566543.0,4994.0,UC7eBNeDW1GQf2NJQ6G6gAxw,978914750,2800000,7361
i-1AmDhKaeI,"Stock Market History: A Crash Course for Investors, Part 8",https://www.youtube.com/watch?v=i-1AmDhKaeI,2013-09-13 05:05:18+00:00,7880.0,61.0,UCQblwANa5Y9e4z-WvymNivg,1243066,9410,179
nB6ywyAvzY4,GTA V | How To Make Money Using The Stock Market (GTA 5 Tips &amp; Tricks),https://www.youtube.com/watch?v=nB6ywyAvzY4,2013-09-18 19:56:08+00:00,738710.0,5231.0,UCst9GLZ-X47MxWBmx9cCrKA,1134062301,2890000,4907
IY2sv3ssJpk,GTA 5 - How to Make Money Using The Stock Market Guide (GTA V),https://www.youtube.com/watch?v=IY2sv3ssJpk,2013-09-20 04:41:25+00:00,4558616.0,62695.0,UC2wKfjlioOCLP4xQMOWNcgg,4495163046,13900000,4547
Acynk7-sYo4,Grand Theft Auto 5 | Lester Mission : Bus Assassination | Stock Market Money Making Tips,https://www.youtube.com/watch?v=Acynk7-sYo4,2013-09-20 19:41:28+00:00,191138.0,336.0,UCY5_y8zuinRLPjYHXgsGBEg,1041274,1110,206
B9hKE8AZge8,GTA 5 - How To Make MONEY From The STOCK MARKET! - (Guide/Tutorial - MAKE MILLIONS),https://www.youtube.com/watch?v=B9hKE8AZge8,2013-09-20 20:00:17+00:00,517442.0,3619.0,UCBw-Dz6wHRkxiXKCLoWqDzA,2307133439,9740000,3570
0Z8sp6ycxSI,GTA 5 - &quot;STOCK MARKET&quot; BASICS To Get More Money! (GTA V),https://www.youtube.com/watch?v=0Z8sp6ycxSI,2013-09-21 14:00:13+00:00,683759.0,5734.0,UCcTAkp1FiUjkf-_CqT7dP0g,313580841,1770000,3697
5zWEQ0UCdRQ,GTAV: Attempting To Manipulate The Stock Markets (TacoBomb/Cluckin&#39; Bell) - ENDGAME,https://www.youtube.com/watch?v=5zWEQ0UCdRQ,2013-09-25 19:23:02+00:00,276381.0,683.0,UCRtboZ53Ym3MxtyJ_scBP_Q,573435,674,279
Jk4sNvb1YuI,The MetaGame - GTA V - Stock Market Campaign Guide,https://www.youtube.com/watch?v=Jk4sNvb1YuI,2013-09-26 00:50:21+00:00,7534.0,119.0,UCUEF9XL3o8dZ6hvVf8jAi8Q,21858743,99700,366
qQWiA-M1Tl8,Stock Market Simplified,https://www.youtube.com/watch?v=qQWiA-M1Tl8,2013-09-26 03:25:38+00:00,3355.0,137.0,UCOO5Mg3Z9qQGC-CBJfFxk_A,1246197,10000,60
I7FDx4DPapw,Relationship between bond prices and interest rates | Finance &amp; Capital Markets | Khan Academy,https://www.youtube.com/watch?v=I7FDx4DPapw,2013-09-29 04:26:27+00:00,1558829.0,17913.0,UC4a-Gbdw7vOaccHmFo40b9g,2097515761,8140000,8454
Qh-M3_L4xYk,Introduction to bonds | Stocks and bonds | Finance &amp; Capital Markets | Khan Academy,https://www.youtube.com/watch?v=Qh-M3_L4xYk,2013-09-29 04:38:35+00:00,1050758.0,8334.0,UC4a-Gbdw7vOaccHmFo40b9g,2097515761,8140000,8454
jKMmRARC4-A,Playing the Stock Market Game,https://www.youtube.com/watch?v=jKMmRARC4-A,2013-10-01 23:55:56+00:00,23778.0,39.0,UCiu-5d3YHShWCYM_G-_EM7w,102879,191,59
GCQfMWAikyU,The Great Depression: Crash Course US History #33,https://www.youtube.com/watch?v=GCQfMWAikyU,2013-10-10 23:46:11+00:00,6527250.0,65437.0,UCX6b17PVsYBQ0ip5gyeme-Q,1884446179,15100000,1503
u4KDQTyNJLg,Black Monday: Art Cashin On His Experience During The Stock Market Crash Of 1987,https://www.youtube.com/watch?v=u4KDQTyNJLg,2013-10-18 23:36:58+00:00,3114.0,16.0,UCenF67ejtD5KUGAcayYE3xw,22643194,11100,1783
n7WgRtLbx4k,Trading as a way of life: Jihan Bowes Little at TEDxASL,https://www.youtube.com/watch?v=n7WgRtLbx4k,2013-10-25 16:09:11+00:00,200621.0,3408.0,UCsT0YIqwnpJCM-mx7-gSA4Q,7577612051,39600000,205525
TXbjMIch17k,Alphatrends Stock Market Analysis for Week Ending 10/25/13,https://www.youtube.com/watch?v=TXbjMIch17k,2013-10-27 00:10:08+00:00,1187.0,19.0,UCfD3rq06LaA8wc3s2m3LwRQ,6055091,58800,1975
klTUBhVvlhs,Auction Market Theory,https://www.youtube.com/watch?v=klTUBhVvlhs,2013-10-31 22:24:11+00:00,29160.0,574.0,UCvgqCzgJwsj-yTewnudZTZw,206835,2610,35
6lSSkzKJSsU,Stock Market Analysis: Understand What The Charts Are Saying,https://www.youtube.com/watch?v=6lSSkzKJSsU,2013-11-05 20:17:44+00:00,3336.0,28.0,UCEggVJ_xt6van8nkzyBhK9w,4280381,27600,5413
37n0cY0ynSo,Stock Market Video Analysis for Week Ending 11/8/13,https://www.youtube.com/watch?v=37n0cY0ynSo,2013-11-08 21:33:49+00:00,1989.0,10.0,UCfD3rq06LaA8wc3s2m3LwRQ,6055091,58800,1975
fQBIjtiDrF0,Market&#39;s Intermediate Picture | Stock Market Video 11/8/13,https://www.youtube.com/watch?v=fQBIjtiDrF0,2013-11-08 22:04:09+00:00,1583.0,3.0,UCPu1mkB9N5oY2kvf-DJ4VxQ,980973,2730,859
B_L2rsGuh-4,Market&#39;s Changed Leadership | Stock Market Video 11/15/13,https://www.youtube.com/watch?v=B_L2rsGuh-4,2013-11-15 18:43:45+00:00,1398.0,1.0,UCPu1mkB9N5oY2kvf-DJ4VxQ,980973,2730,859
nwk0mfpOi_s,Can Google predict the stock market? Tobias Preis at TEDxWarwickSalon (Technology),https://www.youtube.com/watch?v=nwk0mfpOi_s,2013-11-16 23:56:53+00:00,155668.0,1159.0,UCsT0YIqwnpJCM-mx7-gSA4Q,7577612051,39600000,205525
yZlE6zoqGB8,Buyable Growth Stocks | Stock Market Video,https://www.youtube.com/watch?v=yZlE6zoqGB8,2013-12-06 20:21:12+00:00,1668.0,3.0,UCPu1mkB9N5oY2kvf-DJ4VxQ,980973,2730,859
FFgw0mCg2Xw,Stock Market Charting: Watch For This If You Want To Make Money,https://www.youtube.com/watch?v=FFgw0mCg2Xw,2013-12-09 19:27:50+00:00,1178.0,18.0,UCEggVJ_xt6van8nkzyBhK9w,4280381,27600,5413
Ye0MHKJ00hw,Are The Markets Rigged?,https://www.youtube.com/watch?v=Ye0MHKJ00hw,2013-12-10 03:14:59+00:00,9859.0,100.0,UCKjU3KzdbJE1EFcHVqXC3_g,986495014,1590000,27817
EfmTWu2yn5Q,Bill Poulos Presents: Call Options &amp; Put Options Explained In 8 Minutes (Options For Beginners),https://www.youtube.com/watch?v=EfmTWu2yn5Q,2013-12-10 16:01:31+00:00,3147312.0,54845.0,UC0abuO9zwGl2icSq9SM1zKw,5027846,67500,206
FnL7I6tESAs,What can physics tell us about stock market crashes? Dragan Mihailovi at TEDxLjubljana,https://www.youtube.com/watch?v=FnL7I6tESAs,2014-01-10 12:36:11+00:00,32017.0,343.0,UCsT0YIqwnpJCM-mx7-gSA4Q,7577612051,39600000,205525
sEcscL85hC0,Stock Market Analysis from Alphatrends.net 1/10/14,https://www.youtube.com/watch?v=sEcscL85hC0,2014-01-10 21:33:20+00:00,1969.0,17.0,UCfD3rq06LaA8wc3s2m3LwRQ,6055091,58800,1975
hc-w6IJiE2Q,1920s Video Lecture # 4 The Stock Market Crash of 1929,https://www.youtube.com/watch?v=hc-w6IJiE2Q,2014-01-15 03:12:25+00:00,1465.0,2.0,UCe28SonOFWAhtXJ7IMLTv2g,44479,158,88
LVCGjGrzLGE,How to use Support &amp; Resistance to profit on the stock market,https://www.youtube.com/watch?v=LVCGjGrzLGE,2014-02-07 01:24:47+00:00,9829.0,80.0,UCNueBybS08RL3iQ6YSrx4WA,926099,10000,726
HEL3QxkixIE,"World Economy : Chart shows similarities between 1929 Stock Market Crash and Today (Feb 17, 2014)",https://www.youtube.com/watch?v=HEL3QxkixIE,2014-02-17 22:31:46+00:00,12977.0,80.0,UCPejB1cCtTCwzi9yk10CR3g,40199775,83300,1589
yel8xbu2-Ng,Inside the Tape: Stock Market Technical Analysis To Profit From,https://www.youtube.com/watch?v=yel8xbu2-Ng,2014-02-25 20:19:14+00:00,1271.0,,UCEggVJ_xt6van8nkzyBhK9w,4280381,27600,5413
2rMiFctBEts,How to build a stock market sector correlation matrix in excel,https://www.youtube.com/watch?v=2rMiFctBEts,2014-03-04 02:51:17+00:00,9848.0,74.0,UCaCirxuWcGsGQ22oQEHxcyg,211785,1570,35
ronjacMW8j0,JM hurst Cycle Trading - Use Fourier Analysis to Find the Dominant Cycle,https://www.youtube.com/watch?v=ronjacMW8j0,2014-03-08 18:20:03+00:00,7119.0,56.0,UC8MQA67J7j-T-ck7YqUJhGg,469748,2640,140
VobGOe-RHqg,FractalWAVE Forecast Stock Market Software,https://www.youtube.com/watch?v=VobGOe-RHqg,2014-03-08 22:20:03+00:00,2302.0,15.0,UCQw61CsJQDScZ6qsc-hvx_A,274168,2500,225
dmXEtRCIn9w,The Stock Market is NOT the Economy,https://www.youtube.com/watch?v=dmXEtRCIn9w,2014-03-11 01:59:01+00:00,8081.0,250.0,UCcjX483N0jRI3qznYU0w3pg,54762278,110000,7416
p3zFAaH9QA0,Why very few Investors are successful in stock market!,https://www.youtube.com/watch?v=p3zFAaH9QA0,2014-03-14 08:36:31+00:00,109972.0,1418.0,UCRDzUUlovpOWM2AyLMlRJjQ,1465606,36800,61
aUX6BnY0rHQ,Why People FAIL to Buy LOW and Sell HIGH in Stock Market?,https://www.youtube.com/watch?v=aUX6BnY0rHQ,2014-03-15 06:02:03+00:00,561538.0,7390.0,UCRDzUUlovpOWM2AyLMlRJjQ,1465606,36800,61
Zznv9blH8oM,Today&#39;s Stock Market Insight: A Guide To Profitable Trading For Life,https://www.youtube.com/watch?v=Zznv9blH8oM,2014-03-25 18:15:12+00:00,1113.0,19.0,UCEggVJ_xt6van8nkzyBhK9w,4280381,27600,5413
I0Yx7RnHAcw,Michael Lewis: Nobody Understands the Stock Market,https://www.youtube.com/watch?v=I0Yx7RnHAcw,2014-04-02 15:12:12+00:00,817947.0,9527.0,UCUMZ7gohGI9HcU9VNsr2FJQ,889570450,3590000,48613
wNhQ0_81Xb0,The Future Direction of The Stock Market,https://www.youtube.com/watch?v=wNhQ0_81Xb0,2014-04-05 00:39:36+00:00,1470.0,1.0,UCsW7oCAA6iVmCZ0RT_0WI4Q,65325,130,78
REpZSIc4EeM,COL Financial - SMart Money through the Stock Market - Jose T. Sio,https://www.youtube.com/watch?v=REpZSIc4EeM,2014-04-15 07:37:12+00:00,10383.0,41.0,UC4Jt1VpKL7mVpQhhDNa7JLQ,6881593,125000,452
T8NpTC7T9x0,COL Financial - SMart Money through the Stock Market - Adriano Ramos,https://www.youtube.com/watch?v=T8NpTC7T9x0,2014-04-15 08:06:37+00:00,5677.0,9.0,UC4Jt1VpKL7mVpQhhDNa7JLQ,6881593,125000,452
gcN7xngj0h0,COL Financial - SMart Money through the Stock Market - Bernhard Tsai,https://www.youtube.com/watch?v=gcN7xngj0h0,2014-04-15 09:16:52+00:00,3511.0,12.0,UC4Jt1VpKL7mVpQhhDNa7JLQ,6881593,125000,452
fpf2N39wS70,The Stock Market Seasonality Indicator,https://www.youtube.com/watch?v=fpf2N39wS70,2014-04-16 21:34:02+00:00,1378.0,8.0,UCfiAxWV_sZDc-22CS26Khgw,538863,3800,979
_Alvggifsns,Live Stock Trade - How Charts Eliminate Emotions,https://www.youtube.com/watch?v=_Alvggifsns,2014-04-17 16:06:27+00:00,14391.0,90.0,UCn2JOViAAWssWefchGpTNvw,44782628,597000,3427
t-LejQwCB9E,What&#39;s keeping less expensive versions of biologic drugs off the U.S. market?,https://www.youtube.com/watch?v=t-LejQwCB9E,2014-04-19 20:31:27+00:00,5322.0,33.0,UC6ZFN9Tx6xh-skXCuRHCDpQ,2333081266,3830000,47424
1PdnUYieOTg,How Much Money Can Be Made In the Penny Stock Market,https://www.youtube.com/watch?v=1PdnUYieOTg,2014-04-22 04:26:57+00:00,15160.0,103.0,UC46jvKDsLQjpQ3JQ96_7cmg,4058985,56100,286
pD592fXuPpA,Wealthy Investor Online Stock Market Workshop,https://www.youtube.com/watch?v=pD592fXuPpA,2014-04-25 04:21:03+00:00,2126.0,15.0,UC24ZoKsZMFKVA_MfhgL34_w,16393442,66600,359
xeBwAwjqV-Y,Commodity and Energy Stocks | Stock Market Video,https://www.youtube.com/watch?v=xeBwAwjqV-Y,2014-04-25 15:10:18+00:00,1513.0,4.0,UCPu1mkB9N5oY2kvf-DJ4VxQ,980973,2730,859
x7IP10hDWlc,Strategies For A 60/40 Stock Market,https://www.youtube.com/watch?v=x7IP10hDWlc,2014-05-03 03:05:15+00:00,2985.0,,UC_ywfvIR2JrnMuZt33y7QYQ,8327254,69000,654
mOvQLMsdMc4,How to Start Investing on the Stock Market today? + Col Financial and Truly Rich Club,https://www.youtube.com/watch?v=mOvQLMsdMc4,2014-05-10 22:18:33+00:00,128362.0,559.0,UClm7oKiRtEtV3l57XuqnTtQ,568990,9450,21
XRyiPn6qBiE,Truly Rich Club : How I Earned in the Stock Market,https://www.youtube.com/watch?v=XRyiPn6qBiE,2014-05-13 10:37:25+00:00,35215.0,144.0,UCejJUJjb8rWIYqxolod2ykg,254593,3630,19
HeRDK8gkYJY,"Stock Market Chart Warning Signs: We Saw Them, Did You?",https://www.youtube.com/watch?v=HeRDK8gkYJY,2014-05-15 18:37:05+00:00,1281.0,24.0,UCEggVJ_xt6van8nkzyBhK9w,4280381,27600,5413
Ght7CfZWwBU,The Shady Aspects Of Holiday Stock Market Action: Inside Tips,https://www.youtube.com/watch?v=Ght7CfZWwBU,2014-05-23 16:45:25+00:00,1173.0,32.0,UCEggVJ_xt6van8nkzyBhK9w,4280381,27600,5413
HaOsqkiKlYY,Investing in Real Estate vs. The Stock Market,https://www.youtube.com/watch?v=HaOsqkiKlYY,2014-05-27 20:33:05+00:00,26587.0,229.0,UCANbiv7ZczMkNh67X2IYMrA,16349044,195000,1035
VxHIayTJOWo,How to Invest $2500 Into the Stock Market Wisely By Time,https://www.youtube.com/watch?v=VxHIayTJOWo,2014-06-09 00:57:56+00:00,1266.0,6.0,UC6WnM4P4FkSsIsbMZLbZSAg,38514,219,36
OyNTfVmgKBM,The Impact on Macro-Economic Variables on Stock Market..,https://www.youtube.com/watch?v=OyNTfVmgKBM,2014-07-02 09:01:44+00:00,1865.0,7.0,UC7ZZ7-0agZ5fCpPeejFShew,181693,1270,801
ho4ul69p1ew,Identifying Return Distribution of Sri Lankan Stock Market Index,https://www.youtube.com/watch?v=ho4ul69p1ew,2014-07-02 09:05:16+00:00,2775.0,13.0,UC7ZZ7-0agZ5fCpPeejFShew,181693,1270,801
dYmHee4LBW8,Growth Stocks for Your Watch List | Stock Market Video,https://www.youtube.com/watch?v=dYmHee4LBW8,2014-07-03 19:55:43+00:00,1645.0,3.0,UCPu1mkB9N5oY2kvf-DJ4VxQ,980973,2730,859
MYQrSRtsHNg,Stock Market Analysis for Week Ending 7/3/14,https://www.youtube.com/watch?v=MYQrSRtsHNg,2014-07-03 21:01:39+00:00,1777.0,9.0,UCfD3rq06LaA8wc3s2m3LwRQ,6055091,58800,1975
OMUfFvrNO-s,Stock Market Analysis for 7/8/14,https://www.youtube.com/watch?v=OMUfFvrNO-s,2014-07-08 20:26:33+00:00,1742.0,6.0,UCfD3rq06LaA8wc3s2m3LwRQ,6055091,58800,1975
vtapW-Fu2Vw,The human stock exchange | Laetitia Puyfaucher | TEDxAix,https://www.youtube.com/watch?v=vtapW-Fu2Vw,2014-07-17 17:24:24+00:00,41070.0,549.0,UCsT0YIqwnpJCM-mx7-gSA4Q,7577612051,39600000,205525
WiseRo36_-s,Stock Market Analysis for Week Ending 7/18/14,https://www.youtube.com/watch?v=WiseRo36_-s,2014-07-19 14:37:38+00:00,1893.0,6.0,UCfD3rq06LaA8wc3s2m3LwRQ,6055091,58800,1975
7WmAlyhwfD4,Weekend Stock Market Analysis 07/19/2014 [PUBLIC],https://www.youtube.com/watch?v=7WmAlyhwfD4,2014-07-19 16:25:52+00:00,1522.0,16.0,UCRSur8lNUQN7uh1BDGvEFVA,2803763,17500,2968
fYhZvMDolFs,How to protect and lock in your stock market gains,https://www.youtube.com/watch?v=fYhZvMDolFs,2014-07-30 13:38:20+00:00,1902.0,16.0,UCELihIAZWZzYf-GjOYQ5T3w,1284173,7490,113
artMWTTrxrw,Learn the ways to invest in the stock market,https://www.youtube.com/watch?v=artMWTTrxrw,2014-08-06 13:59:58+00:00,563862.0,2677.0,UCZFMm1mMw0F81Z37aaEzTUA,5204129249,12800000,159027
lCAE2frIfy4,How Does a Stock Exchange Work -NDTV- Episode 2- English,https://www.youtube.com/watch?v=lCAE2frIfy4,2014-08-08 13:15:02+00:00,166300.0,1540.0,UCjDnt2b8-I7bu4MRF9Uwf-A,10483863,94300,835
W0LjdMeS-LA,Understanding the basics of stock market investment,https://www.youtube.com/watch?v=W0LjdMeS-LA,2014-08-14 10:03:06+00:00,342377.0,1733.0,UCZFMm1mMw0F81Z37aaEzTUA,5204129249,12800000,159027
_9x-lGn-NT4,IMMINENT STOCK MARKET RALLY of 50% starts today until Jan 15 2016,https://www.youtube.com/watch?v=_9x-lGn-NT4,2014-08-14 22:11:41+00:00,1058.0,25.0,UCuLdUUU9Q09ipFzVZDkPl0g,1044578,6670,1193
2SCqtoHDS2Q,"Stock Market CRASH, Bank Run, and Hyperinflation Coming!",https://www.youtube.com/watch?v=2SCqtoHDS2Q,2014-08-16 18:15:40+00:00,12967.0,118.0,UCngq92xrmmsfEgGdfAJ6giQ,95477532,287000,4232
PG5yLhDHRio,Illegal Wash Trades Dominate US Market,https://www.youtube.com/watch?v=PG5yLhDHRio,2014-08-17 18:59:37+00:00,1427.0,15.0,UCjAksfEn6njeBZVQxKvoYkA,522877,1730,1352
jlGVHOd2hdo,1987 Stock Market Crash (stock footage / archival footage),https://www.youtube.com/watch?v=jlGVHOd2hdo,2014-08-18 17:01:39+00:00,333909.0,,UCArqJanq9gN5sUFv3Fg6iVg,8194936,14800,557
k3AoXeWWZCQ,Understanding the Basics of Stock Market Investment 2,https://www.youtube.com/watch?v=k3AoXeWWZCQ,2014-08-21 09:47:33+00:00,7882.0,54.0,UCjDnt2b8-I7bu4MRF9Uwf-A,10483863,94300,835
U3D9a_H_Vrs,Session 4: Equity Risk Premiums,https://www.youtube.com/watch?v=U3D9a_H_Vrs,2014-08-25 20:48:31+00:00,321122.0,2832.0,UCLvnJL8htRR1T9cbSccaoVw,22070666,659000,1098
MKeou3_qG5s,BOOM? Stock Market Pumped Up by Fed Hyperinflation Policies!,https://www.youtube.com/watch?v=MKeou3_qG5s,2014-08-27 19:00:04+00:00,2256.0,116.0,UCngq92xrmmsfEgGdfAJ6giQ,95477532,287000,4232
z4nCTdQlH8w,High Frequency Trading,https://www.youtube.com/watch?v=z4nCTdQlH8w,2014-09-01 15:49:36+00:00,604588.0,13438.0,UCXp-7hqRbBkZHLMqLAcFb2A,964755,5760,65
qcLoANOrCoQ,Stock Market Trading Analysis for Week Ending 9/5/14,https://www.youtube.com/watch?v=qcLoANOrCoQ,2014-09-05 20:44:32+00:00,2499.0,13.0,UCfD3rq06LaA8wc3s2m3LwRQ,6055091,58800,1975
tb2e9W4SYN4,Stock Market Training: Learn How to Paper Trade,https://www.youtube.com/watch?v=tb2e9W4SYN4,2014-09-16 13:41:04+00:00,34410.0,730.0,UCn2JOViAAWssWefchGpTNvw,44782628,597000,3427
lDPTHWZC8mM,Stock Market Analysis for Week Ending 9/19/19,https://www.youtube.com/watch?v=lDPTHWZC8mM,2014-09-19 20:38:17+00:00,2457.0,15.0,UCfD3rq06LaA8wc3s2m3LwRQ,6055091,58800,1975
vHFRY2vTVmk,Reasons to be Cautious | Stock Market Video,https://www.youtube.com/watch?v=vHFRY2vTVmk,2014-09-26 15:52:05+00:00,2107.0,4.0,UCPu1mkB9N5oY2kvf-DJ4VxQ,980973,2730,859
njwf1FZ-l4k,2010 Stock Market Flash Crash - Crazy Wild Commentary From Chicago Futures Pit,https://www.youtube.com/watch?v=njwf1FZ-l4k,2014-09-28 17:56:25+00:00,29854.0,292.0,UCYnZiPUvLeVtGcQ1PntpEnw,310372,247,47
JzZbHwfEjYI,Getting Started - Introduction to the Stock Market,https://www.youtube.com/watch?v=JzZbHwfEjYI,2014-09-29 14:50:54+00:00,14597.0,130.0,UC151mnaPrIvTELng72QtFDQ,1665175,18300,855
xefiZjkv2A4,Stock Market Internals In Rapid Breakdown,https://www.youtube.com/watch?v=xefiZjkv2A4,2014-10-01 12:38:34+00:00,4297.0,4.0,UCPAxB5TPQ_5PVXWYIgAx4Mw,1205662,3310,695
g8-4WJ6g4fA,"S&amp;P 500 Elliott Wave Technical Analysis - 7th October, 2014",https://www.youtube.com/watch?v=g8-4WJ6g4fA,2014-10-07 23:31:46+00:00,1244.0,6.0,UCK5sgIqry2y4XyyONmAYTjw,1299536,15600,963
7M8tExMTapg,Stock Market ROLLER COASTER as Global Crisis Spreads!,https://www.youtube.com/watch?v=7M8tExMTapg,2014-10-10 18:30:04+00:00,3012.0,142.0,UCngq92xrmmsfEgGdfAJ6giQ,95477532,287000,4232
KY9CJB0ez8Q,"Stock Market Video Analysis for Close October 10, 2014",https://www.youtube.com/watch?v=KY9CJB0ez8Q,2014-10-10 23:14:05+00:00,3901.0,21.0,UCfD3rq06LaA8wc3s2m3LwRQ,6055091,58800,1975
j_Szn5cCbfA,Is the Stock Market a Casino?,https://www.youtube.com/watch?v=j_Szn5cCbfA,2014-10-12 09:00:15+00:00,3448.0,38.0,UCnKPQUoCRb1Vu-qWwWituGQ,69229500,387000,4782
11W_kN4aK-0,How to Buy Stocks / Buy Low &amp; Cheap - Stock Market 101 (Part 7 of 11),https://www.youtube.com/watch?v=11W_kN4aK-0,2014-10-14 00:17:30+00:00,52657.0,248.0,UCdppOxr6Vo5KKhu2zW2Sabg,361637,8000,79
IzxP36ukVyE,Long-Term Stocks Analysis US Markets plus DAX,https://www.youtube.com/watch?v=IzxP36ukVyE,2014-10-14 14:55:12+00:00,1090.0,5.0,UCkDKLo1u9XSSWpqvnGkRh1Q,487851,8240,393
jOSaN5loYKg,Overview of the Market | Stock Market Video,https://www.youtube.com/watch?v=jOSaN5loYKg,2014-10-17 18:21:33+00:00,2036.0,4.0,UCPu1mkB9N5oY2kvf-DJ4VxQ,980973,2730,859
rLndz6Jeycg,Stock Market Video Analysis for Week Ending 10/24/14,https://www.youtube.com/watch?v=rLndz6Jeycg,2014-10-25 18:02:46+00:00,3384.0,13.0,UCfD3rq06LaA8wc3s2m3LwRQ,6055091,58800,1975
adbvRZHWcCM,V-Shaped Correction and Recovery | Stock Market Video,https://www.youtube.com/watch?v=adbvRZHWcCM,2014-10-31 17:03:02+00:00,3082.0,13.0,UCPu1mkB9N5oY2kvf-DJ4VxQ,980973,2730,859
seTRuIbKBac,Stock Market Analyiss for Week Ending 10/31/14,https://www.youtube.com/watch?v=seTRuIbKBac,2014-10-31 20:29:02+00:00,2818.0,20.0,UCfD3rq06LaA8wc3s2m3LwRQ,6055091,58800,1975
NbLC-xYsZos,Petrodollar DISASTER as Stock Market Unstable Signs of Major RISK!,https://www.youtube.com/watch?v=NbLC-xYsZos,2014-11-04 19:31:04+00:00,4010.0,179.0,UCngq92xrmmsfEgGdfAJ6giQ,95477532,287000,4232
vl2aP8dlIn4,Warren Buffett - Brief History of Stocks,https://www.youtube.com/watch?v=vl2aP8dlIn4,2014-11-06 04:28:17+00:00,108910.0,1829.0,UC2hAoOK3Dw7NbIbnAllxtfg,2328243,2860,155
25RDW2IfXio,Lean Bullish | Stock Market Video,https://www.youtube.com/watch?v=25RDW2IfXio,2014-11-07 16:25:44+00:00,1685.0,4.0,UCPu1mkB9N5oY2kvf-DJ4VxQ,980973,2730,859
fLReiHGveTA,"Stock Market BOOM: QE4, ECB Stimulus, Japan QE, 0% Interest Rates!",https://www.youtube.com/watch?v=fLReiHGveTA,2014-11-07 19:30:01+00:00,3034.0,271.0,UCngq92xrmmsfEgGdfAJ6giQ,95477532,287000,4232
RK3r96BFpjk,"Stock Market, Food, and Electricity Prices Rise to RECORD HIGH!",https://www.youtube.com/watch?v=RK3r96BFpjk,2014-11-12 19:30:03+00:00,3013.0,159.0,UCngq92xrmmsfEgGdfAJ6giQ,95477532,287000,4232
zOyVekePejA,The Right Stocks to Buy | Stock Market Video,https://www.youtube.com/watch?v=zOyVekePejA,2014-11-14 17:40:02+00:00,1706.0,3.0,UCPu1mkB9N5oY2kvf-DJ4VxQ,980973,2730,859
9UHfCnj7_Ys,Swiss Central Bank Admits Buying Shares of Stock Market! Preventing Deflation Collapse!,https://www.youtube.com/watch?v=9UHfCnj7_Ys,2014-11-15 19:00:02+00:00,3173.0,158.0,UCngq92xrmmsfEgGdfAJ6giQ,95477532,287000,4232
arycujwU-sE,Honda HR-V (US Market),https://www.youtube.com/watch?v=arycujwU-sE,2014-11-20 08:30:44+00:00,10561.0,15.0,UCnXWdGzcNKWvQOe5Q3ispEw,100713310,219000,2141
7JZnlhm2vME,Strongest Industry Groups | Stock Market Video,https://www.youtube.com/watch?v=7JZnlhm2vME,2014-11-26 16:47:11+00:00,1529.0,4.0,UCPu1mkB9N5oY2kvf-DJ4VxQ,980973,2730,859
7HKzai-Hvck,Grand Theft Auto V Stock Market AirEmu/FlyUS,https://www.youtube.com/watch?v=7HKzai-Hvck,2014-11-27 16:08:03+00:00,90289.0,292.0,UCc1PI9yI0qYcqXXXemScyMA,9591321,12800,135
HozP7iJwbvs,"Stock Market - The Game gameplay (PC Game, 1987)",https://www.youtube.com/watch?v=HozP7iJwbvs,2014-11-30 06:05:21+00:00,6393.0,39.0,UCxd0EQG3ODJz0encVA1ABKg,31302383,25400,4772
RrFSO62p0jk,The real truth about the 2008 financial crisis | Brian S. Wesbury | TEDxCountyLineRoad,https://www.youtube.com/watch?v=RrFSO62p0jk,2014-12-03 18:12:43+00:00,3687365.0,29071.0,UCsT0YIqwnpJCM-mx7-gSA4Q,7577612051,39600000,205525
NYJgS9UpudE,Stock Market Education: Options Trading Simplified,https://www.youtube.com/watch?v=NYJgS9UpudE,2014-12-05 17:21:03+00:00,78753.0,1446.0,UCn2JOViAAWssWefchGpTNvw,44782628,597000,3427
KUURrIyWzrA,The Chartist - Understanding the Effect of Volume on the Stock Market,https://www.youtube.com/watch?v=KUURrIyWzrA,2014-12-06 00:01:54+00:00,4379.0,56.0,UCUSUgUnv5fvT0SsA5bUby8w,850685,12700,233
03XSNVrbHV4,Stock Market Analysis for Week Ending 12/12/14,https://www.youtube.com/watch?v=03XSNVrbHV4,2014-12-12 21:29:12+00:00,6159.0,24.0,UCfD3rq06LaA8wc3s2m3LwRQ,6055091,58800,1975
hf-W_Z9mnGk,Stock Market Training: How to Avoid the Pattern Day Trading (PDT) Rule,https://www.youtube.com/watch?v=hf-W_Z9mnGk,2014-12-15 18:59:35+00:00,94775.0,920.0,UCn2JOViAAWssWefchGpTNvw,44782628,597000,3427
o4pCOrAG3xg,GTA 5 Construction Assassination And Stock Market Guide,https://www.youtube.com/watch?v=o4pCOrAG3xg,2014-12-23 22:35:41+00:00,129052.0,992.0,UCWfV87wkAOyTjpaauCqK64g,2373146,3690,359
T1POnt9583k,Stock Market Analysis for Week Ending 1/2/15,https://www.youtube.com/watch?v=T1POnt9583k,2015-01-02 21:33:28+00:00,3709.0,14.0,UCfD3rq06LaA8wc3s2m3LwRQ,6055091,58800,1975
GLJm849uSyE,Can the U.S. Dollar and Stock Market Save the Global Economy from Financial COLLAPSE?,https://www.youtube.com/watch?v=GLJm849uSyE,2015-01-04 00:51:20+00:00,6704.0,233.0,UCngq92xrmmsfEgGdfAJ6giQ,95477532,287000,4232
8AynwfArZUM,How can I get start trading in the stock market?,https://www.youtube.com/watch?v=8AynwfArZUM,2015-01-06 00:43:26+00:00,149278.0,1567.0,UCnKPQUoCRb1Vu-qWwWituGQ,69229500,387000,4782
XFq-9IMFJtA,Oil Falls And Drags Down U.S. Stock Market as Global Economy Enters CRISIS MODE!,https://www.youtube.com/watch?v=XFq-9IMFJtA,2015-01-06 19:30:01+00:00,4011.0,280.0,UCngq92xrmmsfEgGdfAJ6giQ,95477532,287000,4232
ynB1yl25HUI,Stock Market SELLOFF Just a Warning of Global Financial Disaster!,https://www.youtube.com/watch?v=ynB1yl25HUI,2015-01-07 20:13:40+00:00,4347.0,285.0,UCngq92xrmmsfEgGdfAJ6giQ,95477532,287000,4232
SkiyRV99eEI,OverStock Creating A Stock Market For This Asset!,https://www.youtube.com/watch?v=SkiyRV99eEI,2015-01-20 18:53:22+00:00,10243.0,237.0,UChwwoeOZ3EJPobW83dgQfAg,224920211,867000,3771
6emWWgnUwhc,Top Performing Industry Groups | Stock Market Video,https://www.youtube.com/watch?v=6emWWgnUwhc,2015-01-23 16:22:17+00:00,1640.0,1.0,UCPu1mkB9N5oY2kvf-DJ4VxQ,980973,2730,859
Yk2jG9PkUPQ,How to earn daily 1%(CHURNING) out of your stock market holding with no risk,https://www.youtube.com/watch?v=Yk2jG9PkUPQ,2015-01-29 14:59:31+00:00,195373.0,1347.0,UCmo_Y2q_BAJ30ZTg6Qhcytg,20532202,188000,2882
bjucXLlthX0,How to make money in GTA 5 (Stock Market Guide),https://www.youtube.com/watch?v=bjucXLlthX0,2015-02-01 06:08:15+00:00,4572086.0,64345.0,UCuWcjpKbIDAbZfHoru1toFg,2235512376,3700000,6099
aR1aw6GI_L0,Turning Bullish | Stock Market Video,https://www.youtube.com/watch?v=aR1aw6GI_L0,2015-02-13 18:25:12+00:00,1642.0,5.0,UCPu1mkB9N5oY2kvf-DJ4VxQ,980973,2730,859
i-MZ2fOxZ0Q,How To Profit From A US Stock Market Holiday,https://www.youtube.com/watch?v=i-MZ2fOxZ0Q,2015-02-17 03:42:17+00:00,3591.0,60.0,UCoSG43KFjTe0trsteSQ46Ng,37429465,462000,1990
lSR_FHhWYuk,Stocks Course for Dummies. Definitions &amp; What Must You Know? [Stock Market Course 102 Part 02/10],https://www.youtube.com/watch?v=lSR_FHhWYuk,2015-02-17 05:58:28+00:00,3044.0,23.0,UCdppOxr6Vo5KKhu2zW2Sabg,361637,8000,79
z4S3InyxE2A,U.S. Stock Market Hits Another RECORD HIGH as Greece Exit Fear Increases!,https://www.youtube.com/watch?v=z4S3InyxE2A,2015-02-18 19:30:19+00:00,5013.0,411.0,UCngq92xrmmsfEgGdfAJ6giQ,95477532,287000,4232
5syFY2SeRbU,Stock Market Analysis for Week Ending Feb 20 2015,https://www.youtube.com/watch?v=5syFY2SeRbU,2015-02-20 21:36:42+00:00,4455.0,18.0,UCfD3rq06LaA8wc3s2m3LwRQ,6055091,58800,1975
E4BGGpsQrOM,stock returns regression in excel,https://www.youtube.com/watch?v=E4BGGpsQrOM,2015-02-23 15:19:50+00:00,159980.0,1249.0,UCF17DXhmh39n0CufkY6qIIw,8392159,18400,149
uVM1d386CXw,US Dollar &amp; Stock Market BOOM! QE and Negative Interest Rates Go VIRAL!,https://www.youtube.com/watch?v=uVM1d386CXw,2015-03-03 05:27:13+00:00,5277.0,310.0,UCngq92xrmmsfEgGdfAJ6giQ,95477532,287000,4232
zPIhMJGWiM8,Capitalism and the Dutch East India Company: Crash Course World History 229,https://www.youtube.com/watch?v=zPIhMJGWiM8,2015-03-19 00:42:32+00:00,2062738.0,31988.0,UCX6b17PVsYBQ0ip5gyeme-Q,1884446179,15100000,1503
4hsee-kkNjo,Annuity Education: Can a Fixed Index Annuity beat the Stock Market?,https://www.youtube.com/watch?v=4hsee-kkNjo,2015-03-19 07:40:30+00:00,20192.0,242.0,UClvt22s43cxfE5JZFgBQlww,67324,381,24
nPVSUMsc0Q8,"End of Week Video Stock Market Analysis March 21, 2015",https://www.youtube.com/watch?v=nPVSUMsc0Q8,2015-03-22 01:30:20+00:00,3454.0,26.0,UCfD3rq06LaA8wc3s2m3LwRQ,6055091,58800,1975
YGrxFjh4YMA,A Beginners Guide to Price Action &amp; Volume on a Stock Market Chart,https://www.youtube.com/watch?v=YGrxFjh4YMA,2015-03-23 14:30:33+00:00,24351.0,309.0,UCNwdy86-C3VmVsp1BH5974A,205826,4100,17
8EqL8T9xi_E,/End of Wk Stock Market Analysis /,https://www.youtube.com/watch?v=8EqL8T9xi_E,2015-03-29 00:14:07+00:00,2994.0,20.0,UCfD3rq06LaA8wc3s2m3LwRQ,6055091,58800,1975
JrbdXYxv-Aw,Predict The Stock Market With Candle Indicators!!!,https://www.youtube.com/watch?v=JrbdXYxv-Aw,2015-03-30 00:48:47+00:00,5445.0,115.0,UCXzEw48vrx5miikrE50I7zg,3060246,66500,487
uBXIR9bLo2Q,Current State of the Market | Stock Market Video,https://www.youtube.com/watch?v=uBXIR9bLo2Q,2015-04-03 18:41:02+00:00,1409.0,3.0,UCPu1mkB9N5oY2kvf-DJ4VxQ,980973,2730,859
CVZbl6gzK14,100 to 1 in the Stock Market Book Review,https://www.youtube.com/watch?v=CVZbl6gzK14,2015-04-09 02:13:29+00:00,1312.0,,UCq2mwp8OI-BDzyAhwzDzLoA,352562,2910,162
cJOEyvDwgM0,Stock Market Bubble in U.S. Now Exceeds 5 Measures of Fair Value!,https://www.youtube.com/watch?v=cJOEyvDwgM0,2015-04-11 18:00:00+00:00,5307.0,265.0,UCngq92xrmmsfEgGdfAJ6giQ,95477532,287000,4232
MiybniIIvx0,Options Trading: Understanding Option Prices,https://www.youtube.com/watch?v=MiybniIIvx0,2015-04-28 05:31:57+00:00,4706286.0,65595.0,UCQU2q2zY1oejRRzK66fIAzA,22217523,474000,48
nkQOrYXIXnE,A Break One Way or Another | Stock Market Video,https://www.youtube.com/watch?v=nkQOrYXIXnE,2015-05-01 15:05:22+00:00,1220.0,1.0,UCPu1mkB9N5oY2kvf-DJ4VxQ,980973,2730,859
vCGBmO6IJA0,This Is How Real Day Traders Make Millions In The Stock Market,https://www.youtube.com/watch?v=vCGBmO6IJA0,2015-05-01 15:39:45+00:00,15479.0,67.0,UCEggVJ_xt6van8nkzyBhK9w,4280381,27600,5413
nEC2mvZg7mw,"Maid&#39;s Salary: From Php0 to Php700,000+ in Stock Market Investment via the Truly Rich Club",https://www.youtube.com/watch?v=nEC2mvZg7mw,2015-05-03 15:36:43+00:00,13314.0,227.0,UCejJUJjb8rWIYqxolod2ykg,254593,3630,19
rx6iCLL3XqY,5 Stock Market Lessons From The Mayweather-Pacquiao Fight,https://www.youtube.com/watch?v=rx6iCLL3XqY,2015-05-03 18:43:14+00:00,10688.0,154.0,UCoSG43KFjTe0trsteSQ46Ng,37429465,462000,1990
0Ii13OEEzWA,Types of Order Trading and their execution,https://www.youtube.com/watch?v=0Ii13OEEzWA,2015-05-05 11:07:49+00:00,2469.0,13.0,UCjDnt2b8-I7bu4MRF9Uwf-A,10483863,94300,835
TP_Y0tC-zPY,Focus on the Best Stocks | Stock Market Video,https://www.youtube.com/watch?v=TP_Y0tC-zPY,2015-05-08 15:24:46+00:00,1486.0,1.0,UCPu1mkB9N5oY2kvf-DJ4VxQ,980973,2730,859
YKy53kdq0i0,Stock Market Tutorial - How to Identify Weakness on a Stock Market Chart (Part 1),https://www.youtube.com/watch?v=YKy53kdq0i0,2015-05-09 02:10:35+00:00,10192.0,167.0,UCNwdy86-C3VmVsp1BH5974A,205826,4100,17
rK2Z2soeo6c,The Stock Market - Dave Rant,https://www.youtube.com/watch?v=rK2Z2soeo6c,2015-05-18 18:24:45+00:00,147052.0,1438.0,UC7eBNeDW1GQf2NJQ6G6gAxw,978914750,2800000,7361
VsqMjJIDgpE,03 Intro To Stocks - Role of Stock Exchange,https://www.youtube.com/watch?v=VsqMjJIDgpE,2015-05-19 05:57:23+00:00,30664.0,394.0,UCrWJo3zUGpbNAepe1OLSjGQ,1863232,30100,109
UOqEwN8S730,Only Price Pays!! Stock Market Analysis for Week Ending 5/22/15,https://www.youtube.com/watch?v=UOqEwN8S730,2015-05-22 20:51:09+00:00,2209.0,13.0,UCfD3rq06LaA8wc3s2m3LwRQ,6055091,58800,1975
fZ2UO7Tyj5c,Dr. Boyce Watkins on Why African Americans Avoid Stock Market,https://www.youtube.com/watch?v=fZ2UO7Tyj5c,2015-05-25 17:20:59+00:00,137223.0,2665.0,UCg7lal8IC-xPyKfgH4rdUcA,5267112252,5660000,29245
ZRy_hwtP5-I,Thom Hartmann: Beware of the Booming Stock Market!,https://www.youtube.com/watch?v=ZRy_hwtP5-I,2015-05-28 22:00:00+00:00,1951.0,48.0,UCbjBOso0vpWgDht9dPIVwhQ,79121140,325000,15631
89FOH48awyQ,Short Term Stock Market Analysis,https://www.youtube.com/watch?v=89FOH48awyQ,2015-05-29 20:47:03+00:00,3915.0,29.0,UCfD3rq06LaA8wc3s2m3LwRQ,6055091,58800,1975
tEbZswUEnsU,WALL STREET HISTORIC FILM  NEW YORK STOCK EXCHANGE &quot;BEHIND THE TICKER TAPE&quot; 72892,https://www.youtube.com/watch?v=tEbZswUEnsU,2015-05-29 20:59:02+00:00,48514.0,883.0,UCddem5RlB3bQe99wyY49g0g,230026562,669000,7956
sbX65NwISEE,Stock Market Crash of 2016,https://www.youtube.com/watch?v=sbX65NwISEE,2015-06-09 02:58:45+00:00,6698.0,76.0,UC8PY4o5sTc1iCGIlSX4f15g,26836021,99200,3072
DmMAoF-x9BA,Warning signals for a stock market crash,https://www.youtube.com/watch?v=DmMAoF-x9BA,2015-06-09 11:07:21+00:00,1158.0,7.0,UCbmYqd55BU-kPmXV-WEd-cA,1365293,6380,5043
rOr4ROz7Zo0,China Stock Market Hits HISTORICAL HIGH Even as Real Economy Drops to Multi-Year Low!,https://www.youtube.com/watch?v=rOr4ROz7Zo0,2015-06-10 15:17:05+00:00,3918.0,236.0,UCngq92xrmmsfEgGdfAJ6giQ,95477532,287000,4232
wBrwyoZh_Eo,URGENT: Stock Market Panic / Great Depression Eminent!,https://www.youtube.com/watch?v=wBrwyoZh_Eo,2015-06-10 20:46:31+00:00,1370.0,7.0,UCYCACtLyJo5E_ZO34RTfDug,261744,1380,160
Bj8r3anW0Vg,The Nigerian Stock Exchange Graduate Trainee Program,https://www.youtube.com/watch?v=Bj8r3anW0Vg,2015-06-21 14:18:40+00:00,2699.0,37.0,UCSOUoyNRP_hCkhuQAxGfxPA,173375,2220,355
RybZBQAI2II,Stock Market Tutorial - How to Identify Strength on a Stock Market Chart (Part 1),https://www.youtube.com/watch?v=RybZBQAI2II,2015-06-26 07:28:36+00:00,6158.0,121.0,UCNwdy86-C3VmVsp1BH5974A,205826,4100,17
OjwCfLgkN2E,GTA V Assassination + Stock Market M1[The Hotel Assassination],https://www.youtube.com/watch?v=OjwCfLgkN2E,2015-07-02 19:40:33+00:00,75588.0,859.0,UCfntG76MppGExnb2AAaN7yw,218578,424,31
_VHnxNy4JFE,How China Can Stop the Bleeding of Its Stock Market,https://www.youtube.com/watch?v=_VHnxNy4JFE,2015-07-07 18:18:48+00:00,9724.0,35.0,UCUMZ7gohGI9HcU9VNsr2FJQ,889570450,3590000,48613
hZKqN-8x2Po,China Stock Market COLLAPSING as Government Begins Buying Shares!,https://www.youtube.com/watch?v=hZKqN-8x2Po,2015-07-09 02:00:01+00:00,21309.0,372.0,UCngq92xrmmsfEgGdfAJ6giQ,95477532,287000,4232
TPMmoJrkxeg,Why China is Panicking About the Stock Market Crash | China Uncensored,https://www.youtube.com/watch?v=TPMmoJrkxeg,2015-07-10 21:38:50+00:00,164423.0,3288.0,UCgFP46yVT-GG4o1TgXn-04Q,492844826,1910000,1939
Yp8Y61rH2To,8 Things You Need to Know About China&#39;s Stock Market Crisis | China Uncensored,https://www.youtube.com/watch?v=Yp8Y61rH2To,2015-07-13 22:14:58+00:00,122784.0,2121.0,UCgFP46yVT-GG4o1TgXn-04Q,492844826,1910000,1939
DBpV4XtWl1U,Business English Vocabulary: The Stock Market,https://www.youtube.com/watch?v=DBpV4XtWl1U,2015-07-14 01:04:55+00:00,463092.0,10957.0,UC_0NfufarVw04vDfWFm8z_Q,148554086,3420000,212
KhTqqY5d46Q,"Stock Market Analysis for Week Ending July 24,  2015",https://www.youtube.com/watch?v=KhTqqY5d46Q,2015-07-24 20:31:49+00:00,3247.0,22.0,UCfD3rq06LaA8wc3s2m3LwRQ,6055091,58800,1975
mD8xp2ill3c,Focus Only on the Best | Stock Market Video,https://www.youtube.com/watch?v=mD8xp2ill3c,2015-07-31 15:51:46+00:00,1186.0,2.0,UCPu1mkB9N5oY2kvf-DJ4VxQ,980973,2730,859
cnrn2xrUuB8,Is it a good time to invest in the Stock Market?,https://www.youtube.com/watch?v=cnrn2xrUuB8,2015-07-31 22:01:02+00:00,3294.0,4.0,UCLnlmc4jwZEOevsxbFjf7gA,8299139,8070,1741
gocNDY8WXhw,Stock Market CRASHING as Central Banks REACT! Here&#39;s Why.,https://www.youtube.com/watch?v=gocNDY8WXhw,2015-08-07 13:39:21+00:00,9514.0,402.0,UCngq92xrmmsfEgGdfAJ6giQ,95477532,287000,4232
I6mEE7HYQHM,Shocking SEC Admission On Stock  Market Manipulation,https://www.youtube.com/watch?v=I6mEE7HYQHM,2015-08-19 23:00:00+00:00,4442.0,93.0,UC-3jIAlnQmbbVMV6gR7K8aQ,786019920,1390000,22882
9bVBJRVA-iE,Global SHOCKWAVE in Stock Market as China Falling &amp; Greece PM Resigns!,https://www.youtube.com/watch?v=9bVBJRVA-iE,2015-08-21 18:29:39+00:00,7347.0,416.0,UCngq92xrmmsfEgGdfAJ6giQ,95477532,287000,4232
MoFCcqsSwT8,"Jeb Handwerger: SHEMITAH: Seven Year Cycle May Prove Ominous for Stock Market &amp; Gold  Aug 22, 2015",https://www.youtube.com/watch?v=MoFCcqsSwT8,2015-08-22 18:08:57+00:00,1839.0,24.0,UC6X0ttmzTAJt_2ebcqcIbYw,20071803,98100,1296
yPd06s2ui-k,Stock Market Crash - What Does It Mean?,https://www.youtube.com/watch?v=yPd06s2ui-k,2015-08-24 16:21:30+00:00,38380.0,517.0,UCkJ1N-7g9Q6n7KnriGit-Ig,41088662,316000,2634
Ebv46VF2B60,Why This Stock Market Crash Is Different - Mike Maloney,https://www.youtube.com/watch?v=Ebv46VF2B60,2015-08-24 22:08:55+00:00,140955.0,1138.0,UCThv5tYUVaG4ZPA3p6EXZbQ,114020374,736000,980
Fx67oHh0n0I,Stock Markets Biggest Crash In 7 Years,https://www.youtube.com/watch?v=Fx67oHh0n0I,2015-08-25 06:02:49+00:00,57299.0,363.0,UCt4t-jeY85JegMlZ-E5UWtA,27141741604,59800000,313742
mzp7NiI0SUU,&quot;Casino Capitalism&quot;: Economist Michael Hudson on Whats Behind the Stock Markets Rollercoaster Ride,https://www.youtube.com/watch?v=mzp7NiI0SUU,2015-08-25 16:31:13+00:00,26220.0,493.0,UCzuqE7-t13O4NIDYJfakrhw,609011320,1810000,15333
DMyFlsf-tWs,Jim Grant: The Fed Turned the Stock Market Into a &#39;Hall of Mirrors&#39;,https://www.youtube.com/watch?v=DMyFlsf-tWs,2015-08-26 14:13:16+00:00,34422.0,320.0,UC0uVZd8N7FfIZnPu0y7o95A,294122718,874000,3704
1z3JVjRg_IE,7 Year Crash Cycle Points to 2015 for Major Stock Market Collapse! September?,https://www.youtube.com/watch?v=1z3JVjRg_IE,2015-08-26 15:36:13+00:00,14513.0,421.0,UCngq92xrmmsfEgGdfAJ6giQ,95477532,287000,4232
pZwo-G9k-4U,"Stock Market Analysis August 28 , 2015",https://www.youtube.com/watch?v=pZwo-G9k-4U,2015-08-28 20:52:47+00:00,3192.0,25.0,UCfD3rq06LaA8wc3s2m3LwRQ,6055091,58800,1975
kPa8QykAbW8,Tactics For Shorting The Stock Market,https://www.youtube.com/watch?v=kPa8QykAbW8,2015-09-01 23:42:58+00:00,3027.0,88.0,UC3HoA_yBZXFyHbcBQXKQchw,87226,2720,99
ppD7PhdBosA,China Central Bank Says Stock Market Has Crashed 40% Since Peak!,https://www.youtube.com/watch?v=ppD7PhdBosA,2015-09-07 06:30:04+00:00,7452.0,478.0,UCngq92xrmmsfEgGdfAJ6giQ,95477532,287000,4232
S2V-6mI0554,Stock Market Analysis for Week Ending 9/11/15,https://www.youtube.com/watch?v=S2V-6mI0554,2015-09-11 20:48:41+00:00,3487.0,24.0,UCfD3rq06LaA8wc3s2m3LwRQ,6055091,58800,1975
OTmISrgSd8Y,How to Calculate the Dow and S&amp;P 500,https://www.youtube.com/watch?v=OTmISrgSd8Y,2015-09-11 21:35:37+00:00,36402.0,362.0,UC5mqdi2fo7MsK2X2h2ija1A,2538844,22500,735
CqDTJbXfygM,10 Steps To Become A Stock Market Millionaire,https://www.youtube.com/watch?v=CqDTJbXfygM,2015-09-17 16:55:06+00:00,101919.0,823.0,UCoSG43KFjTe0trsteSQ46Ng,37429465,462000,1990
7jDswhawtxg,QE4 Necessary as Fed Balance Sheet and Stock Market Price Have Direct Link!,https://www.youtube.com/watch?v=7jDswhawtxg,2015-09-21 14:12:52+00:00,5192.0,356.0,UCngq92xrmmsfEgGdfAJ6giQ,95477532,287000,4232
IqL8814PPSs,FORMER NYSE HEAD: THE STOCK MARKET IS RIGGED,https://www.youtube.com/watch?v=IqL8814PPSs,2015-09-21 17:00:00+00:00,4847.0,92.0,UCLoNQH9RCndfUGOb2f7E1Ew,1109366799,2220000,28638
bmYIIdtGHwk,This Chart PROVES Stock Market Hasn&#39;t Risen Since QE3!,https://www.youtube.com/watch?v=bmYIIdtGHwk,2015-09-29 03:32:48+00:00,3207.0,294.0,UCngq92xrmmsfEgGdfAJ6giQ,95477532,287000,4232
PCv21YZoOvk,Overcome Debt | Be a Stock Market Genius | Binaural + Isochronic,https://www.youtube.com/watch?v=PCv21YZoOvk,2015-09-30 00:07:52+00:00,12249.0,122.0,UCfQXZQMYFfNIeR4iivprsng,6031727,21000,57
U8FDrlzZMI4,Pros &amp; Cons of a &quot;Market Order&quot; on the Stock Market,https://www.youtube.com/watch?v=U8FDrlzZMI4,2015-09-30 00:58:57+00:00,12988.0,281.0,UCANbiv7ZczMkNh67X2IYMrA,16349044,195000,1035
nkDUgeIOkLY,How Stock Market Works | Investing Basics | Animated Short Film | 1957,https://www.youtube.com/watch?v=nkDUgeIOkLY,2015-10-02 13:33:33+00:00,83611.0,1600.0,UC9x7c4tGNWfpJyJTT6atzjw,126686897,454000,311
hledfjWdtlA,Stock Market Tutorial #8: Japanese Candlesticks Continuation Patterns Part 2,https://www.youtube.com/watch?v=hledfjWdtlA,2015-10-07 23:00:07+00:00,4897.0,64.0,UCUA9VvPQu-AklUfVnYKSugA,110879,1690,12
Dugn51K_6WA,Money and Finance: Crash Course Economics #11,https://www.youtube.com/watch?v=Dugn51K_6WA,2015-10-14 16:01:44+00:00,1534836.0,19307.0,UCX6b17PVsYBQ0ip5gyeme-Q,1884446179,15100000,1503
GPOv72Awo68,How it Happened - The 2008 Financial Crisis: Crash Course Economics #12,https://www.youtube.com/watch?v=GPOv72Awo68,2015-10-21 22:32:47+00:00,4120287.0,69578.0,UCX6b17PVsYBQ0ip5gyeme-Q,1884446179,15100000,1503
yFiLyR9KtPM,Stock Market Terms Explained: Odd Lot vs. Round Lot of Shares,https://www.youtube.com/watch?v=yFiLyR9KtPM,2015-11-03 20:53:48+00:00,12536.0,231.0,UCANbiv7ZczMkNh67X2IYMrA,16349044,195000,1035
m4uFZBPr6b4,Random Walk of Stock Prices,https://www.youtube.com/watch?v=m4uFZBPr6b4,2015-11-07 03:55:01+00:00,24105.0,194.0,UCyLvd_2pyC_Y-Sj4y1wZqLg,14814426,129000,235
Z_baAdoLqBs,US Stock Market BEARISH TODAY -  But I Have My Level To Go Bullish,https://www.youtube.com/watch?v=Z_baAdoLqBs,2015-11-12 03:52:44+00:00,1651.0,1.0,UCe6tb9LKiIu9eD2fVZurxnQ,8946837,41000,4286
zlGKxLX9qQk,Probabilities for stock market to go up or down!,https://www.youtube.com/watch?v=zlGKxLX9qQk,2015-11-22 03:12:41+00:00,10176.0,125.0,UCHYHhjW7j2bs22jqxm5bGzA,804729,5350,71
WaDLu9lWjIA,Tim Bennett Explains: The first rule of stock market investing,https://www.youtube.com/watch?v=WaDLu9lWjIA,2015-11-26 11:07:53+00:00,25495.0,,UCrhRZ6gi1ZrBfLi-peh1d8Q,4100447,35900,1377
RtCvcP43C1U,Predicting a Stock Price Using Regression,https://www.youtube.com/watch?v=RtCvcP43C1U,2015-11-30 02:20:16+00:00,147095.0,843.0,UCflGqanGLKKl1nPiLiyyQNA,556496,4140,203
EqSfGjDjNRs,Top 5 Stock Market Lessons of 2015 that were UNLISTED,https://www.youtube.com/watch?v=EqSfGjDjNRs,2015-12-02 01:50:59+00:00,5344.0,82.0,UCANbiv7ZczMkNh67X2IYMrA,16349044,195000,1035
-vCA77hITGk,These Charts PROVE Dozens of Stock Markets Have Crashed in 2015!,https://www.youtube.com/watch?v=-vCA77hITGk,2015-12-08 05:03:47+00:00,3738.0,378.0,UCngq92xrmmsfEgGdfAJ6giQ,95477532,287000,4232
Zwi5S_b47kQ,Should You Quit Your Job to Trade the Stock Market?,https://www.youtube.com/watch?v=Zwi5S_b47kQ,2015-12-10 00:51:59+00:00,3105.0,75.0,UCux4_ZudBYgiZBPDvxVdhVQ,6895402,58300,2757
q49LtMyXK7Q,The secret sneaker market  and why it matters | Josh Luber,https://www.youtube.com/watch?v=q49LtMyXK7Q,2015-12-11 16:41:13+00:00,487256.0,10320.0,UCAuUUnT6oDeKwE6v1NGQxug,2614206429,23600000,4543
UEPlnAVlRZ8,Stock Market in 2015 Suffering as U.S. Middle Class Officially Disappearing!,https://www.youtube.com/watch?v=UEPlnAVlRZ8,2015-12-14 04:00:00+00:00,3408.0,272.0,UCngq92xrmmsfEgGdfAJ6giQ,95477532,287000,4232
uwVuuWAWPGg,"S&amp;P 500 Elliott Wave Technical Analysis - 15th December, 2015",https://www.youtube.com/watch?v=uwVuuWAWPGg,2015-12-16 02:03:12+00:00,1899.0,15.0,UCK5sgIqry2y4XyyONmAYTjw,1299536,15600,963
zQx-Jd_jYhE,How do you view the stock market and opportunity,https://www.youtube.com/watch?v=zQx-Jd_jYhE,2015-12-18 13:47:49+00:00,3037.0,108.0,UCcGsK6yrJ-mp21mWwWveVPg,6684211,81000,538
NViP6UaPUTo,Stock Market Technical Ananalysis,https://www.youtube.com/watch?v=NViP6UaPUTo,2015-12-27 16:42:10+00:00,2671.0,18.0,UCfD3rq06LaA8wc3s2m3LwRQ,6055091,58800,1975
mUvB89DMtww,How Markets REALLY Work - Depth of Market (DOM),https://www.youtube.com/watch?v=mUvB89DMtww,2016-01-02 19:38:57+00:00,243262.0,6513.0,UCl6rm3AYa45v8GkRG3NER6w,998825,37000,49
03l-viRyGBU,Basics of Fundamental Analysis for Beginners (Stock Market) Part 1 | ,https://www.youtube.com/watch?v=03l-viRyGBU,2016-01-03 12:29:54+00:00,567495.0,15250.0,UCUMccND2H_CVS0dMZKCPCXA,350180702,2300000,973
-08uxd7Itzc,China&#39;s Stock Market Crashes! Armed Protesters in OR! Felons Legally Owning Guns,https://www.youtube.com/watch?v=-08uxd7Itzc,2016-01-05 00:32:33+00:00,5326.0,215.0,UCO8MQqy42F8B9Lnk7iQvp1A,24625744,81400,3107
XTXedh-r6zk,Stock Market MELTDOWN as U.S. Tumbles Percent Decline Worst Since 1932!,https://www.youtube.com/watch?v=XTXedh-r6zk,2016-01-05 05:20:06+00:00,7130.0,411.0,UCngq92xrmmsfEgGdfAJ6giQ,95477532,287000,4232
