video_id,Title,Video Link,Publish Date,View Count,Like Count,Channel ID,Channel View,Subscriber Count,Video Count
IJ3mDTk4mHQ,2 STOCKS ? CIRCUIT BREAKER ? | FOLLOW THE PROCESS ? STOCK MARKET TIPS FOR LEARNING,https://www.youtube.com/watch?v=IJ3mDTk4mHQ,2021-12-08 14:13:32+00:00,1640.0,95.0,UCZn38KmU8VEsupVPhrYonzg,32217422,177000,7638
h89uOvUDVO4,Warren Buffett Leaves The Audience SPEECHLESS | One of the Most Inspiring Speeches Ever,https://www.youtube.com/watch?v=h89uOvUDVO4,2021-12-08 14:44:32+00:00,14634888.0,221720.0,UCN-qfPKTQ_Wxr8vZLVfM95w,80302856,1050000,88
ABiiJJXRIKY,HOW TO FIND UPPER CIRCUIT STOCKS ? MUTLIBAGGER STOCKS ? STOCK MARKET TIPS FOR LEARNING,https://www.youtube.com/watch?v=ABiiJJXRIKY,2021-12-09 13:11:14+00:00,1541.0,100.0,UCZn38KmU8VEsupVPhrYonzg,32217422,177000,7638
XipMY-MDvdY,Index Trading Vs Stock Trading | Abhishek Kar,https://www.youtube.com/watch?v=XipMY-MDvdY,2021-12-10 15:45:01+00:00,124325.0,6699.0,UCcanCrgSWVYW7ZFNKQZso0g,80209528,886000,915
89U7Ao9zNg0,Cookie Clicker Most Optimal Strategy Guide #18 [The Stock Market],https://www.youtube.com/watch?v=89U7Ao9zNg0,2021-12-10 21:25:23+00:00,37140.0,422.0,UCgPwBgrKThzXI5uyNOxGJow,1793449,3850,48
5oMNzdXrxd0,Stock Market Crash 2022: Inflation/ Interest Rates/ Debt Crisis *vs* Artificial Intelligence,https://www.youtube.com/watch?v=5oMNzdXrxd0,2021-12-13 13:00:05+00:00,8758.0,461.0,UC-hq1OIl97y7h0DiJx45N3w,18849079,178000,2093
kNOlMUOJoqI,S&amp;P 500 Analysis | Will Jerome Powell Crash The Stock Market?,https://www.youtube.com/watch?v=kNOlMUOJoqI,2021-12-14 22:06:45+00:00,2235.0,118.0,UCH-_Z7YSk4QTFmXbYSSBB4w,3988025,29900,2087
Uw_QyeHo8f0,Warren Buffett | How To Invest For Beginners: 3 Simple Rules,https://www.youtube.com/watch?v=Uw_QyeHo8f0,2021-12-15 15:23:03+00:00,3565862.0,56998.0,UCN-qfPKTQ_Wxr8vZLVfM95w,80302856,1050000,88
8NP8aD8gHSc,FED MEETING DONE - WHATS NEXT FOR STOCK MARKET?,https://www.youtube.com/watch?v=8NP8aD8gHSc,2021-12-16 02:00:01+00:00,5772.0,457.0,UC534py5rn9KK3fXGmfRJ0SQ,1992241,16200,379
lQClxFa54r4,"The Stock Market Isn&#39;t Nearly As Exciting As Reported, In Fact, The Floor Is Starting To Get Thin",https://www.youtube.com/watch?v=lQClxFa54r4,2021-12-17 17:23:02+00:00,6776.0,748.0,UCBLGQrOOfs5l7fay66B2-3Q,25322776,73600,1831
WUeIXdHxgkg,This Trading Strategy Made him Rs.700000 CRORES in Stock Market | Jim Simons Case Study in Tamil,https://www.youtube.com/watch?v=WUeIXdHxgkg,2021-12-17 17:58:41+00:00,162463.0,5907.0,UCqdpvuKq4bShO1cJoFX6zpQ,104888317,1580000,507
kFTUl97I730,Stock Market Breaking News In Hindi By Guide To Investing,https://www.youtube.com/watch?v=kFTUl97I730,2021-12-19 06:28:37+00:00,8277.0,497.0,UCLn6d8Kn3QLutX7YXCx3sMw,27836575,167000,5891
y0rzm7cDaZE,Record Amount Of Chinese Developers Just Defaulted After Evergrande | Stock Market Tanks,https://www.youtube.com/watch?v=y0rzm7cDaZE,2021-12-20 12:00:22+00:00,80069.0,4680.0,UC2FiWOXQosY8RU5bxQCqmIg,52121710,197000,670
JMLVvHL4Ad8,Charlie Munger&#39;s HUGE Warning of a Lost Decade for the Stock Market (2022-2032),https://www.youtube.com/watch?v=JMLVvHL4Ad8,2021-12-20 15:10:07+00:00,222751.0,4860.0,UC2cL3pI1H3tiozKif6A8fmA,26991172,284000,197
RJcHydW7EXY,Share Market Crash Reasons | Nifty 50 &amp; Sensex Crash | Why Stock Market Fall Down?,https://www.youtube.com/watch?v=RJcHydW7EXY,2021-12-21 03:30:10+00:00,338368.0,19228.0,UCEAAzv2OBqxsSczKJ2QZyGQ,772919886,10300000,1341
G_bivLmIHA4,Elon Musk DESTROYS &quot;SENATOR KAREN&quot; Elizabeth Warren as Stock Market Crash Certain from Her Policies,https://www.youtube.com/watch?v=G_bivLmIHA4,2021-12-21 06:25:27+00:00,4889.0,529.0,UCDB5XReUyyqt-FTNdkzFN-A,47714739,203000,5233
DD_0I3fEkCc,OU TA RENMEN F  $1100 CHAK MWA NAN  STOCK MARKET LA SAN KE OU PA REDI POU LI EBYEN GADE VIDEO SA,https://www.youtube.com/watch?v=DD_0I3fEkCc,2021-12-22 01:27:06+00:00,3357.0,247.0,UCrsQnUDBq-qt4tTib5uLFUg,61364,3450,83
vH_2ZpVF0MQ,Ultimate Guide To Stock Market Investing In New Zealand (How To Get Started),https://www.youtube.com/watch?v=vH_2ZpVF0MQ,2021-12-22 08:54:46+00:00,9331.0,345.0,UCUPA8YE1YsF-iO7ibz2qfNQ,345191,7020,169
dRV6d84nrNY,How to be a successful investor | tips for successful investing | stock market tips,https://www.youtube.com/watch?v=dRV6d84nrNY,2021-12-22 13:30:19+00:00,21369.0,2871.0,UCKkFcZ_xE1Pho9-MUJnI01g,30621497,412000,727
tFMvJpr4KZw,How Global Market affects your portfolio | How US market affects Indian stock market |,https://www.youtube.com/watch?v=tFMvJpr4KZw,2021-12-22 13:30:24+00:00,11619.0,721.0,UCNXapAc8mXTwW82MTncdfzQ,8648326,328000,252
z21PrHuEkKg,6. What is a stock market index?,https://www.youtube.com/watch?v=z21PrHuEkKg,2021-12-24 08:30:04+00:00,117679.0,910.0,UCQXwgooTlP6tk2a-u6vgyUA,7812803,260000,177
63oF8BOMMB8,Warren Buffett: You Only Need To Know These 7 Rules,https://www.youtube.com/watch?v=63oF8BOMMB8,2021-12-24 16:21:37+00:00,4033213.0,37046.0,UCN-qfPKTQ_Wxr8vZLVfM95w,80302856,1050000,88
TlHElTjfNAQ,Stock Market Bubble | How to Save Yourself from Market Disasters?,https://www.youtube.com/watch?v=TlHElTjfNAQ,2021-12-25 10:38:02+00:00,3276.0,204.0,UCksVr8lIwOPd1UtJkE3mdJQ,314295335,838000,3149
v_RM-_Gg_Jk,10 Signs You are a Stock Market Addict | How To Save Yourself from Trading Addiction?,https://www.youtube.com/watch?v=v_RM-_Gg_Jk,2021-12-26 09:30:08+00:00,11993.0,562.0,UCksVr8lIwOPd1UtJkE3mdJQ,314295335,838000,3149
VYaT_MYQZ-M,Captain Polyplast | small cap mutibagger share | best penny stock | best stock market course,https://www.youtube.com/watch?v=VYaT_MYQZ-M,2021-12-27 14:30:04+00:00,57199.0,3964.0,UCKkFcZ_xE1Pho9-MUJnI01g,30621497,412000,727
H7BA_qHCWv0,How To Make Easy Money In The Stock Market,https://www.youtube.com/watch?v=H7BA_qHCWv0,2021-12-27 20:00:07+00:00,17450.0,951.0,UCJZ7zr9a6AT6STkyOFztgiQ,41342259,761000,155
OGJcs3AeiHs,GETTING RICH WITH POWER OF COMPOUNDING IN SHARES AND SIP | OUR FIRST INVESTMENT OF 1500 | ZERO RISK,https://www.youtube.com/watch?v=OGJcs3AeiHs,2021-12-28 12:28:20+00:00,699217.0,35404.0,UCurYxozQbvKn-oNUxNJh45Q,542417616,6820000,499
MpTadQpq9LY,My SECRET to analysing stocks!,https://www.youtube.com/watch?v=MpTadQpq9LY,2021-12-29 15:00:19+00:00,296005.0,15133.0,UCqW8jxh4tH1Z1sWPbkGWL4g,195558012,1860000,710
7hrKb-W_viE,Bitcoin: Through The Lens Of The Stock Market,https://www.youtube.com/watch?v=7hrKb-W_viE,2021-12-31 04:03:58+00:00,76546.0,5285.0,UCRvqjQPSeaWn-uEx-w0XOIg,105327376,788000,2073
HXwjs4ZLt2Q,Rakesh Jhunjhunwala Latest Portfolio &amp; Success Story | Investment in Share Market,https://www.youtube.com/watch?v=HXwjs4ZLt2Q,2022-01-02 03:30:16+00:00,833516.0,30863.0,UCEAAzv2OBqxsSczKJ2QZyGQ,772919886,10300000,1341
HQfnC5Q3VMY,The Best UK Investing Apps and Platforms 2022 - Which One Is The Best?,https://www.youtube.com/watch?v=HQfnC5Q3VMY,2022-01-02 19:00:05+00:00,44660.0,776.0,UC2DCjFH0taLx6MB4a3pbLmQ,5233449,64900,258
2ac-6FmAGvw,VOO and Chill | Is An S&amp;P 500 Index Fund Portfolio a Smart Idea?,https://www.youtube.com/watch?v=2ac-6FmAGvw,2022-01-03 21:16:30+00:00,94383.0,2280.0,UC9C17-OMxa-7oRSaCtztObw,12748183,140000,401
8hgA5u5H_H4,My 2021 Stock Market Review &amp; Performance,https://www.youtube.com/watch?v=8hgA5u5H_H4,2022-01-04 10:30:31+00:00,29339.0,970.0,UCK-aOjEvZNJl3HINja0gAiQ,50476667,951000,454
X-iSJGyfx1Q,What is ETF (Exchange Traded Fund)?,https://www.youtube.com/watch?v=X-iSJGyfx1Q,2022-01-04 11:14:18+00:00,26555.0,1139.0,UCw5TLrz3qADabwezTEcOmgQ,167021072,2130000,2122
cwQiytdg2Dc,The Stock Market Is Driven By CHANGE!  Invest Today in The MSFT of 1987.  The Medical Revolution.,https://www.youtube.com/watch?v=cwQiytdg2Dc,2022-01-04 13:00:30+00:00,6777.0,353.0,UC-hq1OIl97y7h0DiJx45N3w,18853212,178000,2093
mSEyghlZchQ,5 Best Vanguard ETFs to Buy and Hold Forever,https://www.youtube.com/watch?v=mSEyghlZchQ,2022-01-05 21:00:17+00:00,482167.0,17819.0,UChKnwYKZBVofxXM2w1XHd0Q,8883802,132000,132
UPRN1ThnzlI,"The Stock Market is Driven by Change, $50,000 turned into $64 Million",https://www.youtube.com/watch?v=UPRN1ThnzlI,2022-01-06 13:00:12+00:00,6843.0,434.0,UC-hq1OIl97y7h0DiJx45N3w,18849079,178000,2093
ujhXhSdGVwE,The Stock Market Crash of 2022 - Do THIS Now!,https://www.youtube.com/watch?v=ujhXhSdGVwE,2022-01-06 19:00:18+00:00,689228.0,19059.0,UCz4XY6NPKaMUWNWMONTw3NQ,18383103,207000,447
WexePWi-hJI,Top 5 Crypto and Day Trading Fails and Meltdowns That&#39;ll Make You Go ALL IN! ,https://www.youtube.com/watch?v=WexePWi-hJI,2022-01-07 03:03:16+00:00,148476.0,1455.0,UCSz2KRfsojB77gzaBKjcTLA,3564059,26300,196
XEjZqazrub0,Don&#39;t do this in Cryptocurrency Trading! | Beware before you Trade/Invest in Bitcoin or Crypto,https://www.youtube.com/watch?v=XEjZqazrub0,2022-01-07 03:45:13+00:00,441965.0,21368.0,UCEAAzv2OBqxsSczKJ2QZyGQ,772919886,10300000,1341
L_JT2CsEeTE,Why I Love Excel (And Why You Should Too) - Stocks and Spreadsheets,https://www.youtube.com/watch?v=L_JT2CsEeTE,2022-01-07 17:00:12+00:00,140448.0,6322.0,UCFCEuCsyWP0YkP3CZ3Mr01Q,57600094,810000,197
dRiHV0Y9OYs,Its LEAKED  FEDs Stock Market Secrets Revealed,https://www.youtube.com/watch?v=dRiHV0Y9OYs,2022-01-08 00:00:23+00:00,49405.0,4829.0,UCXmAl7cO_eWT_JFxgI74lgA,72555474,208000,1581
pXAvoc_iF6U,How to Buy and Sell on EXCHANGE22 | ft. Aakash Chopra,https://www.youtube.com/watch?v=pXAvoc_iF6U,2022-01-08 12:30:21+00:00,329298.0,14090.0,UCQYRGzYaVa7aWd8TsbjdJ6Q,890330041,4140000,2551
TVqJkitAhdU,"How to get success in stock market, how to earn money in stock market",https://www.youtube.com/watch?v=TVqJkitAhdU,2022-01-08 13:54:12+00:00,14002.0,1284.0,UCkE0OqUc6rW15eIOQHD6OBg,22476034,170000,1327
iKslBNnSalY,Why 99% People Face Loss in Stock Market? || Anish Singh Thakur || Booming Bulls,https://www.youtube.com/watch?v=iKslBNnSalY,2022-01-08 15:06:08+00:00,192781.0,21063.0,UC2sIhf108S02F0Qlb2a88eQ,198659454,1950000,1409
LYQ81pmFRPc,Harry Dent: 87% Stock Market Crash By March &amp; It Won&#39;t Recover for Decades,https://www.youtube.com/watch?v=LYQ81pmFRPc,2022-01-09 19:00:12+00:00,131928.0,5117.0,UC2FiWOXQosY8RU5bxQCqmIg,52121710,197000,670
525XbhdQptY,Harry Dent: Be Ready For A Catastrophic Stock Market Crash With 90% Drop,https://www.youtube.com/watch?v=525XbhdQptY,2022-01-10 00:32:05+00:00,53145.0,2849.0,UCSJx2iNjVaCCPaB8SPU_XXw,127077694,594000,944
PLup2G8XmpI,Is The Stock Market Overvalued? Market Valuation 2022 And Opportunities In The New Year,https://www.youtube.com/watch?v=PLup2G8XmpI,2022-01-12 04:00:13+00:00,13462.0,444.0,UCSRCvRgUOrh2bkcYKe4Zbag,2723070,39700,255
ZcEtylIPgP8,STRUGGLING TO SURVIVE - WAGES AND SAVINGS CRUSHED - STOCK MARKET MORE IMPORTANT THAN YOU -BUY ASSETS,https://www.youtube.com/watch?v=ZcEtylIPgP8,2022-01-13 00:14:21+00:00,43140.0,3142.0,UCaJ-6IXnfIL3js2-facsB7A,76915089,192000,1391
xnyuByR5Hrc,Why retail investing has taken off in the U.S. - but not Europe,https://www.youtube.com/watch?v=xnyuByR5Hrc,2022-01-13 14:00:33+00:00,149042.0,2977.0,UCo7a6riBFJ3tkeHjvkXPn1g,238866652,1210000,2520
desZ620a3f8,BET AGAINST STOCK MARKET -- JUST BOUGHT THIS STOCK!!,https://www.youtube.com/watch?v=desZ620a3f8,2022-01-13 19:00:11+00:00,4958.0,310.0,UC534py5rn9KK3fXGmfRJ0SQ,1992241,16200,379
R-fkuWmI3iU,The risks and rewards of online day trading - BBC News,https://www.youtube.com/watch?v=R-fkuWmI3iU,2022-01-15 11:00:54+00:00,210648.0,3208.0,UC16niRr50-MSBwiO3YDb3RA,4904119138,15200000,19894
Xr5ylGR4VpQ,Financial Analyst and Stock Market Jobs in India,https://www.youtube.com/watch?v=Xr5ylGR4VpQ,2022-01-17 13:50:12+00:00,118637.0,4506.0,UCLwD3OVMvculdNXHj9a0jtQ,3325418,68700,114
tjYplbRpGmM,"MORE CHECKS IN 2022, $2T Fourth Stimulus Package Update, Stock Market, Daily News Bites",https://www.youtube.com/watch?v=tjYplbRpGmM,2022-01-17 14:09:00+00:00,5401.0,704.0,UCkRl1YcGwTUP37DqdNjTB3A,12501654,104000,1249
ve3MYRvBxkI,WHY THE STOCK MARKET JUST CRASHED! 180 MILLION OPTIONS WORTHLESS! WHY SOFI WILL 20X!,https://www.youtube.com/watch?v=ve3MYRvBxkI,2022-01-21 21:55:52+00:00,8617.0,696.0,UCvvXMIhBpiEd_CouZ2hchrw,2225704,13600,362
W_GuUktQ_yQ, 45% Stock Market CRASH!  Here&#39;s Why &amp; WHEN it Will Start,https://www.youtube.com/watch?v=W_GuUktQ_yQ,2022-01-22 00:00:17+00:00,55906.0,6425.0,UCXmAl7cO_eWT_JFxgI74lgA,72555474,208000,1581
wqqaLAgb5uo,The #1 Reason People Lose Money In The Stock Market,https://www.youtube.com/watch?v=wqqaLAgb5uo,2022-01-22 03:13:40+00:00,31474.0,1733.0,UCM84WjkyLm1_sa17G8DYzRg,7974043,265000,52
m3TicXLh0U0,Bruce Wayne beat the stock market and faked his death.,https://www.youtube.com/watch?v=m3TicXLh0U0,2022-01-24 08:12:10+00:00,11704.0,967.0,UCAuZQu7T64gwqPCwemKZWKw,9287495,101000,64
YFW397LS9J8,How to Overcome the fear of making losses in stock Market,https://www.youtube.com/watch?v=YFW397LS9J8,2022-01-24 16:22:21+00:00,85192.0,8136.0,UCoCQujyulrT-HM8vrtJuQSg,4353454,402000,66
Osn21U0yijc,Budget surplus accelerating. Bad news for economy and stock market.,https://www.youtube.com/watch?v=Osn21U0yijc,2022-01-25 22:19:45+00:00,1438.0,115.0,UCZhuQXtpH2dXeEAX_5MKGow,2527662,7850,2533
SS-yQg2KWiU,Why Is The Stock Market Crashing January 2022 ???,https://www.youtube.com/watch?v=SS-yQg2KWiU,2022-01-27 13:00:22+00:00,8716.0,468.0,UC-hq1OIl97y7h0DiJx45N3w,18853212,178000,2093
E7Vyyc6YCKk,"Congressional Stock Trading - If You Dont Know, Now You Know | The Daily Show",https://www.youtube.com/watch?v=E7Vyyc6YCKk,2022-01-27 16:57:03+00:00,626875.0,13400.0,UCwWhs_6x42TyRM4Wstoq8HA,5425401800,10500000,5462
4Pzl3_qaWnU,"Bitcoin Becoming Legal Tender in US? Cryptocurrency, Stock Market Update and Analysis",https://www.youtube.com/watch?v=4Pzl3_qaWnU,2022-01-28 21:46:53+00:00,29749.0,1507.0,UCFrYIWkwYECFeV3ppNwcvag,6626832,66700,1929
c4gJQKsDSXE,Apple Just Saved The Stock Market Crash But It&#39;s Not Over,https://www.youtube.com/watch?v=c4gJQKsDSXE,2022-01-28 23:00:14+00:00,62506.0,4122.0,UC2FiWOXQosY8RU5bxQCqmIg,52199140,197000,670
Wl2eng-rUYw,Harshad Mehta Scam Explained | What Really Happened In 1992 Stock Market Scam Of Harshad Mehta?,https://www.youtube.com/watch?v=Wl2eng-rUYw,2022-01-29 13:53:27+00:00,134997.0,4813.0,UCyWN-BnWSKeHEnNOYvvpNnA,43493670,367000,253
k6wBHx0DV00,Best Indicators for Trading in Crypto/Forex/ Stock Market | Share Trading Indicators to Make Money,https://www.youtube.com/watch?v=k6wBHx0DV00,2022-01-29 14:30:14+00:00,768389.0,26382.0,UCEAAzv2OBqxsSczKJ2QZyGQ,774262731,10300000,1342
lmqCCmHOoGo,THE STOCK MARKET IS ABOUT TO BOTTOM,https://www.youtube.com/watch?v=lmqCCmHOoGo,2022-01-29 16:23:08+00:00,22772.0,1502.0,UCTdnYRKmp4BGHOnshT4A0Hg,41174882,675000,1076
YwPbL9W-yv0,&quot;How To Make Millions In A Market Crash&quot;  Peter Lynch,https://www.youtube.com/watch?v=YwPbL9W-yv0,2022-01-31 13:15:01+00:00,1195885.0,17084.0,UCN-qfPKTQ_Wxr8vZLVfM95w,80429997,1050000,87
DgaVeVIWSN4,Bull Call Spread Option Trading Strategy Free Course | Share Market Training,https://www.youtube.com/watch?v=DgaVeVIWSN4,2022-02-01 03:30:14+00:00,618208.0,25508.0,UCEAAzv2OBqxsSczKJ2QZyGQ,774262731,10300000,1342
c-sEfzoNcdM,How to place Stop Loss order ? I Stock Market for Beginners I By Siddharth Bhanushali,https://www.youtube.com/watch?v=c-sEfzoNcdM,2022-02-01 15:30:05+00:00,142104.0,7226.0,UCoi7mlbUebBpQmDtB3L557A,47043118,1090000,178
ZwSreGxMZeg,Stock Market Crash Coming?? S&amp;P 500 Chart Says Yes.,https://www.youtube.com/watch?v=ZwSreGxMZeg,2022-02-03 02:53:35+00:00,19580.0,1092.0,UC7r4-nZ4icT8SIcnisXFSHQ,10518354,127000,894
o-h_zE9AaaI,"WARNING for BITCOIN &amp; Stock Market?? Bitcoin News Today, Bitcoin Price Prediction, Bitcoin Crash",https://www.youtube.com/watch?v=o-h_zE9AaaI,2022-02-03 14:30:35+00:00,7975.0,572.0,UCgY66N1YS_G9lYMvCQko6yw,13003259,139000,1221
vhOCI2eXP8E,How To Read Level 2 Market Data,https://www.youtube.com/watch?v=vhOCI2eXP8E,2022-02-03 16:38:50+00:00,48851.0,1842.0,UCCbv0qixG-cyokxEY3kELtg,39897079,717000,134
Zwed1wcld10,FACEBOOK IMPLODING! SUFFERS WORST DAY IN STOCK MARKET HISTORY!!!,https://www.youtube.com/watch?v=Zwed1wcld10,2022-02-04 17:25:07+00:00,146274.0,22370.0,UCCsiAKRKcgzA_372WbXNBaw,572680395,1170000,4016
SMHZcKQ5SBc,Meet The $100 Billion Company Behind The S&amp;P 500,https://www.youtube.com/watch?v=SMHZcKQ5SBc,2022-02-04 20:00:05+00:00,49766.0,1604.0,UCZRoNJu1OszFqABP8AuJIuw,108110327,522000,911
NWGH_8gcS2Y,REALISTIC Way To Make 100 Crores in Stock Market (Low Risk),https://www.youtube.com/watch?v=NWGH_8gcS2Y,2022-02-05 13:00:12+00:00,2017289.0,60560.0,UCS2NdYUmv_PUyyKeDAo5zYA,185506177,1100000,1995
Q1hLEbSUe08,Best Psychology Video for Stock Market II Motivational Video I Super Trader Lakshya,https://www.youtube.com/watch?v=Q1hLEbSUe08,2022-02-05 15:31:00+00:00,79369.0,7959.0,UCp1p92dYtC6cINJ4rSwJEXw,55461781,729000,1012
1GF6KaD3TQA,The Stock Market Will Have the Last Laugh,https://www.youtube.com/watch?v=1GF6KaD3TQA,2022-02-05 23:00:01+00:00,44762.0,2682.0,UCRIQM-CUkxVazVPv980YZsw,70332464,197000,1269
Fk-juSv2SEQ,Is Insider Trading Cancer for Stock Market | How is SEBI fixing it?,https://www.youtube.com/watch?v=Fk-juSv2SEQ,2022-02-06 12:15:12+00:00,2639.0,150.0,UCksVr8lIwOPd1UtJkE3mdJQ,314843735,838000,3150
uAeyYahK4Lw,Stock Market MELTDOWN OR MELTUP? Keep Your Eyes On The 10-Year Yield And The MMRI. Mannarino,https://www.youtube.com/watch?v=uAeyYahK4Lw,2022-02-07 14:10:14+00:00,31174.0,2759.0,UCoOhzyG-i7IMBEMbyRlI66g,95817128,255000,3453
r_0wwpm6HYs,INVESTING VS TRADING - Which is better for a beginner ?,https://www.youtube.com/watch?v=r_0wwpm6HYs,2022-02-11 11:30:24+00:00,542316.0,19021.0,UC_SJpaFCK0yoRkTRPaPT3kA,1711662,33500,45
e7vzK-fEQks,Top 5 FREE Trading Tools for Beginner Traders 2022,https://www.youtube.com/watch?v=e7vzK-fEQks,2022-02-11 16:27:44+00:00,57277.0,3296.0,UCCbv0qixG-cyokxEY3kELtg,39897079,717000,134
qCVvATG73zA,Global Stock Markets and Their Impact on Indian Stock Market,https://www.youtube.com/watch?v=qCVvATG73zA,2022-02-12 14:24:33+00:00,32019.0,1595.0,UCf6PIMsGE2g0rSRbMSlA2oQ,8871802,357000,246
vvg_OSoEhYo,Trading LEAPs: How to Make Money in the Stock Market,https://www.youtube.com/watch?v=vvg_OSoEhYo,2022-02-12 17:30:07+00:00,9946.0,634.0,UCHn2rtw6FJyEFB81PsX8QPg,535475,10900,24
QNGxHWPC-rQ,How To Trade in  Stock Market Using Stoploss,https://www.youtube.com/watch?v=QNGxHWPC-rQ,2022-02-13 06:20:31+00:00,67491.0,4167.0,UCJq6I2JomkH1V9Arzv9VKyg,18421268,122000,750
MxcVg_pbJSg,"Bitcoin, Crypto, Stock Market Update. Investors await Fed Emergency Decision",https://www.youtube.com/watch?v=MxcVg_pbJSg,2022-02-14 21:51:49+00:00,15178.0,847.0,UCFrYIWkwYECFeV3ppNwcvag,6626832,66700,1929
qtCx2OmTX2o,Top 6 Vanguard Index Funds To Buy in 2024,https://www.youtube.com/watch?v=qtCx2OmTX2o,2022-02-16 00:21:31+00:00,222047.0,8136.0,UCJZ7zr9a6AT6STkyOFztgiQ,41360668,761000,155
ebfP9pGATWs,SHARE MARKET    || How To Earn Money From Share Market In Hindi By Mahendra Dogney,https://www.youtube.com/watch?v=ebfP9pGATWs,2022-02-16 11:30:33+00:00,68415.0,4581.0,UCLLJt2t6WYpxWktsl1e429Q,335680162,3590000,825
zXwA8dOTkjI,How to invest in the Us stock market from Nigeria with $20 Using ( Bamboo App ),https://www.youtube.com/watch?v=zXwA8dOTkjI,2022-02-19 18:00:16+00:00,9313.0,368.0,UC9bchDYL_RAmTiMVaF51sfA,592692,14000,81
4XQznxafMzw,"HOW THE RUSSIA UKRAINE CRISIS AFFECTS THE STOCK MARKET - Tuesday, February 22, 2022",https://www.youtube.com/watch?v=4XQznxafMzw,2022-02-22 04:59:20+00:00,6928.0,653.0,UCxFRGG-_23Kqxe0YexDc1eg,4849176,64800,621
5obFBodSgvQ,Russia Ukraine Conflict - How War Affects The Stock Market,https://www.youtube.com/watch?v=5obFBodSgvQ,2022-02-23 09:36:05+00:00,64658.0,1964.0,UC9OIwUcx-Uss7xj7s1P5XGw,16132092,170000,429
Wk-h2CwEH5k,How To Find Stocks To Day Trade,https://www.youtube.com/watch?v=Wk-h2CwEH5k,2022-02-23 16:50:56+00:00,179732.0,9522.0,UCCbv0qixG-cyokxEY3kELtg,39897079,717000,134
_YfVZzwzATo,The Crypto &amp; Stock Market Crash is Going ALMOST to Plan ,https://www.youtube.com/watch?v=_YfVZzwzATo,2022-02-24 02:51:29+00:00,38461.0,1669.0,UCIb34uXDsfTq4PJKW0eztkA,32449144,294000,994
VTWg_DMUaRY,Impact of Russia Ukraine War on Stock Market | Why stock market is falling | Harsh goela,https://www.youtube.com/watch?v=VTWg_DMUaRY,2022-02-24 18:04:22+00:00,6057.0,423.0,UCN5qpJ_OZl53SfMbVPjA6sg,40357624,506000,1011
tNYJYxsC_pI,"Largest Intraday Gain in History - Why the Stock Market Rose so Much Today - Friday, Feb 25, 2022",https://www.youtube.com/watch?v=tNYJYxsC_pI,2022-02-25 07:42:45+00:00,6137.0,722.0,UCxFRGG-_23Kqxe0YexDc1eg,4849176,64800,621
Ud4gIEvhgAI,Will The Stock Market Rally?...and What To Expect Next Week!,https://www.youtube.com/watch?v=Ud4gIEvhgAI,2022-02-25 14:51:46+00:00,2193.0,76.0,UCqPuAsK0jeUeaWcpUR02w8A,1220162,17300,1915
_QSp-A8oUkE,Stock Market-  Stocks   ? How to Buy Good Stocks ? | #MoneySeries,https://www.youtube.com/watch?v=_QSp-A8oUkE,2022-02-28 11:31:20+00:00,172545.0,9184.0,UCsv9uKTMVLSDlkZrdzqYWgQ,90382663,535000,335
uebUM6vyLHM,Part Time vs Full Time TRADING In Stock Market - What&#39;s Best For YOU?,https://www.youtube.com/watch?v=uebUM6vyLHM,2022-03-01 05:00:17+00:00,276470.0,11993.0,UCS2NdYUmv_PUyyKeDAo5zYA,185506177,1100000,1995
vEDSYoWgy80,"Bitcoin, Crypto, Stock Market Update!!! Will the Pump Continue?",https://www.youtube.com/watch?v=vEDSYoWgy80,2022-03-02 20:52:21+00:00,9517.0,559.0,UCFrYIWkwYECFeV3ppNwcvag,6626832,66700,1929
bP74RBTE8kI,How Redditors Exposed The Stock Market | The Problem With Jon Stewart | Apple TV+,https://www.youtube.com/watch?v=bP74RBTE8kI,2022-03-04 11:00:15+00:00,3567932.0,100996.0,UC5HJaVyYgo7WPCvIBchRBzQ,186357447,1290000,207
PLayXyFPAA8,"Bitcoin, Crypto, Stock Market Update!!! How far will it drop?",https://www.youtube.com/watch?v=PLayXyFPAA8,2022-03-04 20:55:35+00:00,12841.0,674.0,UCFrYIWkwYECFeV3ppNwcvag,6626832,66700,1929
8SS5pMtLdyw,How One Man Crashed the US Stock Market,https://www.youtube.com/watch?v=8SS5pMtLdyw,2022-03-05 05:05:18+00:00,257988.0,8148.0,UCleL9yejvbCSpUnfCVF1ekw,12316039,271000,180
vfwuYS8sQHs,Stock Market for beginners - Course launched by Study IQ on investing and finance,https://www.youtube.com/watch?v=vfwuYS8sQHs,2022-03-06 05:30:11+00:00,33424.0,1889.0,UCrC8mOqJQpoB7NuIMKIS6rQ,4499325012,15600000,46376
oyzR7tMmj9o,Stock Market Crash in Retirement - How to protect your future,https://www.youtube.com/watch?v=oyzR7tMmj9o,2022-03-06 17:31:51+00:00,84390.0,2390.0,UCLXQalldcm6gMYMQfLMliww,8214322,119000,83
CxYPUqZN7h8,THE STOCK MARKET IS GOING TO GO CRAZY THIS WEEK!! - OIL PRICES ARE SURGING!,https://www.youtube.com/watch?v=CxYPUqZN7h8,2022-03-07 01:00:01+00:00,13113.0,1016.0,UCymzDnu-l3vZ1fxuqvRePOA,30648426,300000,2081
SkCnV1-WDnU,What to do in Share Market Now? Sell or Buy Stocks?,https://www.youtube.com/watch?v=SkCnV1-WDnU,2022-03-07 03:30:13+00:00,326016.0,14333.0,UCEAAzv2OBqxsSczKJ2QZyGQ,774262731,10300000,1342
D5OgZKGrULA,Do This When The Stock Market Crashes Even More,https://www.youtube.com/watch?v=D5OgZKGrULA,2022-03-08 21:00:07+00:00,44740.0,1973.0,UChKnwYKZBVofxXM2w1XHd0Q,8883802,132000,132
xFMW9vItQ4c,This Stock Market Crash is Right on Schedule,https://www.youtube.com/watch?v=xFMW9vItQ4c,2022-03-08 21:19:20+00:00,18136.0,1397.0,UCYHosdETLPp6dpJEsgIUTmw,106566087,413000,803
zKX5NGu8kM4,HUGE NEWS : Joe Biden Issues Warning to Americans &amp; The Stock Market Reacts....,https://www.youtube.com/watch?v=zKX5NGu8kM4,2022-03-08 22:30:08+00:00,7726.0,538.0,UCNeBCizpA1NbX7A9_ia6jYg,6363935,68200,666
0b8lWx7LRNM,Avoid Losses using Trading Psychology In Share / Forex / Crypto Market,https://www.youtube.com/watch?v=0b8lWx7LRNM,2022-03-12 03:30:13+00:00,1999793.0,94364.0,UCEAAzv2OBqxsSczKJ2QZyGQ,774262731,10300000,1342
uctMKjcy9DA,TAKOT KA BA MAG-INVEST SA STOCK MARKET? PANOORIN MO ITO!,https://www.youtube.com/watch?v=uctMKjcy9DA,2022-03-13 09:00:17+00:00,7876.0,378.0,UCreMCCwWgFzjw_tqfRUi92Q,6188091,153000,399
CecGfzZs4cE,How to build a GREAT PORTFOLIO with 1Lakh rupees | Financial Wisdom &amp; Stock Market Portfolio,https://www.youtube.com/watch?v=CecGfzZs4cE,2022-03-13 15:02:08+00:00,325527.0,13135.0,UCqW8jxh4tH1Z1sWPbkGWL4g,195710164,1860000,710
Jf0nMO_2OAE,&quot;Outperform 99% Of Investors With This Simple Strategy...&quot; - Peter Lynch,https://www.youtube.com/watch?v=Jf0nMO_2OAE,2022-03-15 00:32:12+00:00,1331853.0,22080.0,UCN-qfPKTQ_Wxr8vZLVfM95w,80429997,1050000,87
_HKPE22o0XI,"STOCK MARKET DOWNGRADED by Goldman Sachs (SPY, QQQ, DIA, ARKK, BTC, TSLA, AAPL)",https://www.youtube.com/watch?v=_HKPE22o0XI,2022-03-15 20:34:16+00:00,2128.0,201.0,UCinBfsRWiOlzxg7DvjZ5mdQ,2058538,18000,556
cgN9KGrNGXY,How To Benefit from the 2023 Recession,https://www.youtube.com/watch?v=cgN9KGrNGXY,2022-03-16 19:36:27+00:00,887931.0,28302.0,UCxgAuX3XZROujMmGphN_scA,209151013,2000000,127
lO41YP1p_uE,Want To 3x Your Stock Market Returns? BUY THIS!,https://www.youtube.com/watch?v=lO41YP1p_uE,2022-03-16 22:47:33+00:00,1202.0,69.0,UCRHD4VyfFMiqJkyeMxgrNVA,1068254,22900,265
t0QFL641knE,7 Rules of Trading in Stock Market/ Crypto / Forex | How to Trade &amp; Make Money?,https://www.youtube.com/watch?v=t0QFL641knE,2022-03-17 03:30:12+00:00,668388.0,39349.0,UCEAAzv2OBqxsSczKJ2QZyGQ,774262731,10300000,1342
CSU28yiq2kE,How to BUY undervalued stocks? [simple strategies] #STOCK MARKET INVESTING FOR BEGINNERS,https://www.youtube.com/watch?v=CSU28yiq2kE,2022-03-17 14:01:16+00:00,199270.0,9412.0,UCqW8jxh4tH1Z1sWPbkGWL4g,195710164,1860000,710
LDEsM8PeWrw,US Stock Market Analysis by d7 at Grok Trade,https://www.youtube.com/watch?v=LDEsM8PeWrw,2022-03-19 01:08:29+00:00,1338.0,83.0,UCLFFMsse8CmY95ylOebx0GQ,1744587,12500,4392
8ajAEKeA3MA,Downside Zig-Zag Still in Play! | S&amp;P500 VIX Elliott Wave U.S. Market Update,https://www.youtube.com/watch?v=8ajAEKeA3MA,2022-03-19 21:49:45+00:00,11214.0,608.0,UCSdmV9HW3ou301MBTSGxbjg,2995821,40300,633
0Tf5uzjRTYM,We Are Facing A Crisis Much Worse Than A Stock Market Crash,https://www.youtube.com/watch?v=0Tf5uzjRTYM,2022-03-20 01:35:04+00:00,92152.0,5258.0,UC2FiWOXQosY8RU5bxQCqmIg,52199140,197000,670
UxJ_MZK5LOA,Glenn Neely Elliott Wave for the Stock Market,https://www.youtube.com/watch?v=UxJ_MZK5LOA,2022-03-20 03:17:35+00:00,4635.0,92.0,UCsSTFcZUvtlppOmL21gwSkQ,131226,4640,31
