video_id,Title,Video Link,Publish Date,View Count,Like Count,Channel ID,Channel View,Subscriber Count,Video Count
gYFEPm5twi4,What is INTRADAY TRADING in stock market?,https://www.youtube.com/watch?v=gYFEPm5twi4,2020-06-23 14:12:50+00:00,1590375.0,59805.0,UCVOTBwF0vnSxMRIbfSE_K_g,1154447217,4440000,1214
2jbNdkxTRIs,Is The Stock Market Manipulated?,https://www.youtube.com/watch?v=2jbNdkxTRIs,2020-06-24 14:01:37+00:00,3978.0,205.0,UCF31eojFKhWQJviyMICWO2w,21014899,210000,1269
nMLVn_n1hb8,What are bonds? Should You Invest? Explained by CA Rachana Ranade,https://www.youtube.com/watch?v=nMLVn_n1hb8,2020-06-24 14:30:04+00:00,593664.0,21966.0,UCe3qdG0A_gr-sEdat5y2twQ,252840634,4600000,1124
dm78tetM07A,What are Options in Share Market | Option trading For Beginners in Hindi,https://www.youtube.com/watch?v=dm78tetM07A,2020-06-24 14:53:48+00:00,2165858.0,79963.0,UCwAdQUuPT6laN-AQR17fe1g,434908562,5700000,432
lYmXOYbKHUI,Correlation For Traders and Investors | Statistics For the Trading Floor | Correlation Trading,https://www.youtube.com/watch?v=lYmXOYbKHUI,2020-06-25 19:30:05+00:00,32425.0,1446.0,UCASM0cgfkJxQ1ICmRilfHLw,55555905,621000,336
hE3J_nusytI,Tomorrow Will Be Epic - Options Trading Watchlist - 2020 Stock Market Today,https://www.youtube.com/watch?v=hE3J_nusytI,2020-06-26 01:00:05+00:00,1497.0,102.0,UCWdOAF2xQGGdV9WHpeHOEPg,2392763,21100,750
H1BGLKXnbC8,Basics of Stock Market (For Beginners) - Episode 1,https://www.youtube.com/watch?v=H1BGLKXnbC8,2020-06-26 13:51:06+00:00,5019.0,360.0,UCPK161zNFtMgY3qNEItDeIg,53256,3220,15
dmqoqVwFopE,The Difference Between Trading and Investing,https://www.youtube.com/watch?v=dmqoqVwFopE,2020-06-26 16:00:11+00:00,1559386.0,49665.0,UCFCEuCsyWP0YkP3CZ3Mr01Q,57600094,810000,197
BhFMl1DnucM,What Stocks to Buy in This Stock Market,https://www.youtube.com/watch?v=BhFMl1DnucM,2020-07-01 11:00:06+00:00,16670.0,1012.0,UC-hq1OIl97y7h0DiJx45N3w,18849079,178000,2093
8JTBeh1IbK8,Technical Analysis for Beginners | Know who you are before Trading | CA Rachana Ranade,https://www.youtube.com/watch?v=8JTBeh1IbK8,2020-07-01 14:30:01+00:00,1159747.0,26975.0,UCe3qdG0A_gr-sEdat5y2twQ,252840634,4600000,1124
8y1lD3hFMGg,#2 Price to Earning PE Ratio | EPS    Stock Market for Beginners | Basics of Stock Market,https://www.youtube.com/watch?v=8y1lD3hFMGg,2020-07-01 14:57:29+00:00,116745.0,5230.0,UCmnEsLQNA0P-t541TmQAdFA,62314610,918000,910
jbIGbXgnUTg,#3 Face Value | Book Value | Market Value | Stock Market for Beginner | Basics of Stock Market Hindi,https://www.youtube.com/watch?v=jbIGbXgnUTg,2020-07-02 14:53:36+00:00,75667.0,4271.0,UCmnEsLQNA0P-t541TmQAdFA,62314610,918000,910
JouJJrdVsJI,     | How to Invest in US Stock Market | Ustocktrade with Sampath Bank,https://www.youtube.com/watch?v=JouJJrdVsJI,2020-07-03 23:11:49+00:00,10488.0,572.0,UCm5mnf3-Nt94bCDzyTKNxeg,129248,4750,64
lYKHTIjgS8E,"How Nifty and Banknifty are impacted by Global Stock market -Dowjones ,Nasdaq etc ??Intraday basics",https://www.youtube.com/watch?v=lYKHTIjgS8E,2020-07-04 08:00:12+00:00,70185.0,3520.0,UCp1p92dYtC6cINJ4rSwJEXw,55426741,728000,1012
oGCxbyekGag,TO BECOME A SUCCESSFUL TRADER HOW MUCH TIME YOU SHOULD INVEST,https://www.youtube.com/watch?v=oGCxbyekGag,2020-07-04 16:42:50+00:00,766347.0,42538.0,UCE5wDMNEZElnuRDk6TDPOYg,187337280,1740000,1103
xCWuqb0lNRE,Basics of Stock Market in TELUGU | Ep-5 | Why Stock Price changes every moment ? | Stock Market Badi,https://www.youtube.com/watch?v=xCWuqb0lNRE,2020-07-06 19:02:02+00:00,2524.0,211.0,UC4UM_wUDT1Scuny5sY-AdRw,623265,14400,218
SrQiOg0TV20,[LIVE] Day Trading | How I Made $460 in 5 Minutes (from start to finish...),https://www.youtube.com/watch?v=SrQiOg0TV20,2020-07-07 15:00:19+00:00,677563.0,7739.0,UCn2JOViAAWssWefchGpTNvw,44782628,597000,3427
aekhc_w9plE,Tomorrow Tech Stocks Go Crazy - Options Trading Watchlist - 2020 Stock Market Today,https://www.youtube.com/watch?v=aekhc_w9plE,2020-07-10 00:00:00+00:00,1670.0,102.0,UCWdOAF2xQGGdV9WHpeHOEPg,2392763,21100,750
eoGYXk3VIsM,The history behind the Johannesburg Stock Exchange,https://www.youtube.com/watch?v=eoGYXk3VIsM,2020-07-11 06:59:29+00:00,8714.0,152.0,UCb5la1jXYjdnr5zExzrcJMw,6671813,33500,622
tS3oxNhA5fk,"Market View: S&amp;P 500 Technical Analysis, Are Markets About To Crash?",https://www.youtube.com/watch?v=tS3oxNhA5fk,2020-07-13 20:47:45+00:00,14021.0,1077.0,UCN2WmKUchJpIcS1MupY-BuA,9438421,127000,884
YbFxI8B1YWc,How to trade Stock Share at Yangon Stock Exchange ?,https://www.youtube.com/watch?v=YbFxI8B1YWc,2020-07-14 13:42:33+00:00,17987.0,949.0,UCFiNL-h6PayaPiWpUTFxXcQ,143485,7150,51
Nmzb_kyy-zs,How To Invest In The S&amp;P 500 (EASY Step By Step Guide!),https://www.youtube.com/watch?v=Nmzb_kyy-zs,2020-07-14 15:00:05+00:00,230748.0,11438.0,UCxX6xCtKtHSStLClPssvFjQ,1051527,16900,337
N6TpT-Apfa8,Massive Crash Ahead in 2021 - The Stock Market Will Crash Again,https://www.youtube.com/watch?v=N6TpT-Apfa8,2020-07-15 11:45:46+00:00,165432.0,3677.0,UC5YKivGUTTQmhSuaXbxfZSg,229519796,1100000,933
B02vBH4Cw5U,BIG Movement NEXT WEEK | 20th July | Wealth First | Fantastic Nifty | Stock Market Commando |Sunphar,https://www.youtube.com/watch?v=B02vBH4Cw5U,2020-07-19 13:17:57+00:00,2791.0,177.0,UC5WUvabceTqo0c_YPaf6mNA,2570825,28600,1049
m_6RjnabpnU,what is Averaging in stock market|50k special Giveaway|most of the traders do this,https://www.youtube.com/watch?v=m_6RjnabpnU,2020-07-20 14:30:05+00:00,41127.0,2302.0,UCXdDntJ93c1cxtMVFxDzflQ,8590388,150000,200
Jds2CU0_N_k,Index Funds vs ETFs vs Mutual Funds - What&#39;s the Difference &amp; Which One You Should Choose?,https://www.youtube.com/watch?v=Jds2CU0_N_k,2020-07-22 21:30:00+00:00,334115.0,22133.0,UCFBpVaKCC0ajGps1vf0AgBg,205677991,1170000,566
X4fPP6s7XUM,Options in Telugu Part 1 | What is Option in Stock Market | Options Basics for Beginners,https://www.youtube.com/watch?v=X4fPP6s7XUM,2020-07-23 03:40:17+00:00,283077.0,9847.0,UCSmR76TED496O28f4dxLjBA,4589324,138000,51
evUtcQE_rXg,"Market View: S&amp;P 500 Technical Analysis,  Where To Buy The Dip? IS THIS The BIG ONE?",https://www.youtube.com/watch?v=evUtcQE_rXg,2020-07-23 20:52:32+00:00,12093.0,762.0,UCN2WmKUchJpIcS1MupY-BuA,9438421,127000,884
apUBZv2CE30,Chapter 1 : What are Options in Stock market? | Understanding Basics of Options (Calls and Puts),https://www.youtube.com/watch?v=apUBZv2CE30,2020-07-24 12:40:38+00:00,109832.0,5855.0,UCpx85F_y2913Z7B8433-vZQ,12814106,283000,490
0TImic4N1ko,Stockmarket v economy: the impact of covid-19,https://www.youtube.com/watch?v=0TImic4N1ko,2020-07-24 14:00:27+00:00,806109.0,12628.0,UC0p5jTq6Xx_DosDFxVXnWaQ,318655641,3190000,584
YyorN8tYCWk,"Market View: S&amp;P 500 Technical Analysis,  ITS A US DOLLAR STORY",https://www.youtube.com/watch?v=YyorN8tYCWk,2020-07-24 21:44:57+00:00,7587.0,453.0,UCN2WmKUchJpIcS1MupY-BuA,9438421,127000,884
hWwTzqCmdI4,How To Invest For Teenagers,https://www.youtube.com/watch?v=hWwTzqCmdI4,2020-07-25 00:45:32+00:00,3038196.0,229252.0,UCGy7SkBjcIAgTiwkXEtPnYg,282482850,2300000,771
HAuwVuOJDTc,Stock Market 4 Big News 27 july to 31 july Latest Stock Market News Latest Share Market News SMKC,https://www.youtube.com/watch?v=HAuwVuOJDTc,2020-07-26 12:16:12+00:00,57674.0,3763.0,UChneGqGy_lmvfcR1v_avL6g,621059312,1650000,8453
OMi3YKFXY6A,Fear of a Stock Market Crash? Don&#39;t Be!,https://www.youtube.com/watch?v=OMi3YKFXY6A,2020-07-26 12:34:01+00:00,53565.0,2339.0,UCK-aOjEvZNJl3HINja0gAiQ,50476667,951000,454
GjRYGM8-j-s,"Market View: S&amp;P 500 Technical Analysis,  Gold &amp; Silver, Bitcoin and US Dollar",https://www.youtube.com/watch?v=GjRYGM8-j-s,2020-07-27 20:53:36+00:00,10831.0,953.0,UCN2WmKUchJpIcS1MupY-BuA,9438421,127000,884
K3lP3BhvnSo,"Understanding the Fed&#39;s &quot;Money Printer&quot; (QE, the Stock Market, and Inflation)",https://www.youtube.com/watch?v=K3lP3BhvnSo,2020-07-31 15:03:51+00:00,378514.0,15040.0,UCDXTQ8nWmx_EhZ2v-kp7QxA,16191035,331000,116
z6_rBXkDig0,20% Returns Simple #Strategy Use   Earn   Positional #Trading Strategy for Beginners #SMC,https://www.youtube.com/watch?v=z6_rBXkDig0,2020-08-01 04:59:33+00:00,418875.0,32724.0,UCY3cHUi4DFx-DyGBlH-tVjw,33683802,869000,214
Xgr6HY36LtU,Chapter-2 | Open Interest trading Strategy | How to Use Open Interest?,https://www.youtube.com/watch?v=Xgr6HY36LtU,2020-08-01 15:41:57+00:00,317205.0,14895.0,UCpx85F_y2913Z7B8433-vZQ,12814106,283000,490
t1CSjGsxHAU,Best Time to Exit Your Trades!,https://www.youtube.com/watch?v=t1CSjGsxHAU,2020-08-01 16:53:25+00:00,630942.0,46053.0,UCE5wDMNEZElnuRDk6TDPOYg,187337280,1740000,1103
GY0L8v_tWR8,Simplest &amp; Easiest Way to Invest in Stock Market For Long Term,https://www.youtube.com/watch?v=GY0L8v_tWR8,2020-08-03 17:55:54+00:00,3727.0,204.0,UCroOaW8bUO6HT3JEaLLARzA,284838,116000,28
7Q-Uce-BYAo,Is Stock Market favourable to you? | Ashish Mehta,https://www.youtube.com/watch?v=7Q-Uce-BYAo,2020-08-06 09:13:38+00:00,97545.0,2413.0,UC4aH3kwy1rjfzLoo6RCnQzA,12268053,125000,413
BiDKoOE6sWE,Back In the Stock Market,https://www.youtube.com/watch?v=BiDKoOE6sWE,2020-08-06 15:00:02+00:00,37957.0,1099.0,UCcnyjTK4IheQN2ycsE7NZTQ,79820353,378000,1188
_mKjr8Xu1Ek,How To Start Investing In ETFs In Australia 2021 - Step By Step Beginners Guide To ETFs On ASX,https://www.youtube.com/watch?v=_mKjr8Xu1Ek,2020-08-07 00:26:41+00:00,83108.0,6079.0,UCXutEl1FPwFMSjX0rynYSuQ,594584,15100,26
dEjey1dAo28,How To Know If A Stock Will Spike or Drop At Market Open,https://www.youtube.com/watch?v=dEjey1dAo28,2020-08-10 20:25:33+00:00,149080.0,5943.0,UCNVxqV5plTxTx3D_57ai5Ow,13571183,169000,1925
Vqj7c9q5X5Q,ROE &amp; ROCE  | Why these Ratios are Important?,https://www.youtube.com/watch?v=Vqj7c9q5X5Q,2020-08-11 16:30:01+00:00,51251.0,2935.0,UCUWbS9qoyLKTdOlvgK1GBlA,57428294,525000,1048
aAxs_XOR0zI,How I made $2000 on Robinhood - Stocks For Beginners,https://www.youtube.com/watch?v=aAxs_XOR0zI,2020-08-11 20:58:53+00:00,706423.0,21259.0,UCl0It9cuBpyq7MSvAPQnGWw,8643324,158000,310
hNM-P1fqUbU,Why the Stock Market Will FAIL at the New Highs,https://www.youtube.com/watch?v=hNM-P1fqUbU,2020-08-14 11:00:22+00:00,52520.0,4349.0,UCOHxDwCcOzBaLkeTazanwcw,29512135,278000,486
B0BpL20QHPU,STOCK MARKET REACHES ALL TIME HIGH | DO THIS NOW,https://www.youtube.com/watch?v=B0BpL20QHPU,2020-08-14 22:00:03+00:00,485507.0,34719.0,UCV6KDgJskWaEckne5aPA0aQ,790814775,4550000,972
SqAlTFEpln4,Stock Market Free Course For Beginners To Advanced -Episode1!,https://www.youtube.com/watch?v=SqAlTFEpln4,2020-08-15 02:45:16+00:00,539852.0,34570.0,UCE5wDMNEZElnuRDk6TDPOYg,187337280,1740000,1103
nsjJWG1eQQ8,How to Make Money from a Stock Market Crash - Market Minutes for August 17th,https://www.youtube.com/watch?v=nsjJWG1eQQ8,2020-08-16 22:00:46+00:00,2859.0,171.0,UC151mnaPrIvTELng72QtFDQ,1665175,18300,855
jg85H26wyLk,The Absolute Chaos of r/Wallstreetbets,https://www.youtube.com/watch?v=jg85H26wyLk,2020-08-17 12:30:02+00:00,5112465.0,193292.0,UCYGDiVemmhY_Q1M-hKp4fvw,41393184,595000,14
sjcsROqiJJU,"Easiest, Low Risk Long Term Stock Market Investment Strategy - Coffee Can  Strategy | Malayalam",https://www.youtube.com/watch?v=sjcsROqiJJU,2020-08-18 14:30:07+00:00,63558.0,3673.0,UC9CKy1ai9qI8p6_Oh0Qa3Rg,91235976,1300000,336
V93zwrzkXwA,HOW TO INVEST IN STOCK MARKET AS A STUDENT IN CANADA | THIS IS HOW I AM DOING IT | MUST WATCH,https://www.youtube.com/watch?v=V93zwrzkXwA,2020-08-19 05:00:03+00:00,209699.0,14545.0,UC6GViDUk_7By5xV31jVTcOw,17675750,197000,241
W-rayXIckgE,Should You Be Scared of the Stock Market?,https://www.youtube.com/watch?v=W-rayXIckgE,2020-08-19 13:05:17+00:00,54089.0,1350.0,UC7eBNeDW1GQf2NJQ6G6gAxw,978914750,2800000,7361
muadMeVO4L8,11 Stock Market Sectors List Explained | How To Invest,https://www.youtube.com/watch?v=muadMeVO4L8,2020-08-19 16:01:48+00:00,3783.0,138.0,UCjU2xFZuIXda8ez5ZeXfK_w,877605,7090,142
ur5IZY9uqi4,Has Wall Street Just Pulled A Shifty On The Stock Market? [S&amp;P 500 Technical Analysis Today],https://www.youtube.com/watch?v=ur5IZY9uqi4,2020-08-20 10:53:39+00:00,5032.0,404.0,UCvJZEG5x-DVYZKTz--pS39w,24588636,153000,1165
RZLltMSeryI,Know When the Stock Market will Crash: Two Key Risk Indicators.,https://www.youtube.com/watch?v=RZLltMSeryI,2020-08-20 19:30:01+00:00,3127.0,284.0,UCgxzDgbociRWqhDUW3YjS9g,1583986,19800,172
7Oz8orTRhpI,Should College Students Invest in Stock Market?,https://www.youtube.com/watch?v=7Oz8orTRhpI,2020-08-20 21:20:13+00:00,10788.0,350.0,UCxUmrHcAH_gqE3PXGXtPOGg,39142370,100000,667
nu3AGc2wjTs,FEAR RISING! Stock Market Technical Analysis | S&amp;P 500 TA | SPY TA | QQQ TA | DIA TA | SP500 TODAY,https://www.youtube.com/watch?v=nu3AGc2wjTs,2020-08-20 22:21:20+00:00,2058.0,134.0,UCUP_ao_7-Yct5FcVIA4Kobg,9650641,61800,919
xhdZzN6cpz0,OPERATORS    ??  How Operators Loot Retail Investors In Stock Market  Pump and Dump  SMC,https://www.youtube.com/watch?v=xhdZzN6cpz0,2020-08-22 04:58:04+00:00,1089910.0,57749.0,UCY3cHUi4DFx-DyGBlH-tVjw,33683802,869000,214
qy3XCynrt_c,PRE-OPEN MARKET Explained - Trading from 9AM to 9:07AM!,https://www.youtube.com/watch?v=qy3XCynrt_c,2020-08-22 05:00:08+00:00,354439.0,13512.0,UCS2NdYUmv_PUyyKeDAo5zYA,185455341,1100000,1994
Tr2Kk8J6Mag,Millionaire Reacts: People Who Are Into the Stock Market | Casually Explained,https://www.youtube.com/watch?v=Tr2Kk8J6Mag,2020-08-22 22:30:13+00:00,3399.0,81.0,UCTtmFQa4J2nlKawlLjveg4g,103239,1590,340
T-cjmNixsOU,WARREN BUFFETT INDICATOR PREDICTS INSANE STOCK MARKET CRASH!,https://www.youtube.com/watch?v=T-cjmNixsOU,2020-08-23 13:00:07+00:00,35206.0,2510.0,UCMtJYS0PrtiUwlk6zjGDEMA,49260902,575000,1066
3dhfYubkleU,How to invest in the Sri Lankan Stock Market - ULTIMATE GUIDE,https://www.youtube.com/watch?v=3dhfYubkleU,2020-08-24 01:48:53+00:00,34565.0,1896.0,UC4wPCWLnUQvi1KFZUVAFIpA,215297,11700,48
6rUovK92M5g,Secret Formula Of  Share Market Billonaires | Case Study | Dr Vivek Bindra,https://www.youtube.com/watch?v=6rUovK92M5g,2020-08-24 02:00:12+00:00,8162560.0,393389.0,UCR-foyF-C6VuAlwy3KZMkgA,1826277362,21300000,1045
B7xKx4_kaZo,The US Birth Rate Will Impact The Stock Market For The Next 30 Years,https://www.youtube.com/watch?v=B7xKx4_kaZo,2020-08-25 04:08:20+00:00,11800.0,753.0,UCcTzK_2JDmFYGnUiaUleQYg,91649119,148000,9354
DoEjOezk9Qw,NO SHORTING! Stock Market Technical Analysis | S&amp;P 500 TA | SPY TA | QQQ TA | DIA TA | SP500 TODAY,https://www.youtube.com/watch?v=DoEjOezk9Qw,2020-08-25 22:29:16+00:00,2189.0,155.0,UCUP_ao_7-Yct5FcVIA4Kobg,9650641,61800,919
HxA1MTF9lu4,Will The Fed Signal Inflation? (Stock Market Analysis for August 27th 2020),https://www.youtube.com/watch?v=HxA1MTF9lu4,2020-08-27 07:35:52+00:00,9190.0,529.0,UCSqNq7kQMKvgf_LXxFmPRQA,5549747,33800,1128
7zV4WpWG8Ts,US Economy In Meltdown.. Stock Market At RECORD HIGHS. Mannarino,https://www.youtube.com/watch?v=7zV4WpWG8Ts,2020-08-28 21:04:57+00:00,28808.0,2570.0,UCoOhzyG-i7IMBEMbyRlI66g,95749460,255000,3452
5HdiRA-loWo,Best Leading Indicators For The Stock Market,https://www.youtube.com/watch?v=5HdiRA-loWo,2020-08-29 09:00:04+00:00,41895.0,1238.0,UC9OIwUcx-Uss7xj7s1P5XGw,16125078,170000,429
BFdiFJ36qzw,Invest Now or Wait for a Stock Market Crash - U.S. Economy Analysis,https://www.youtube.com/watch?v=BFdiFJ36qzw,2020-08-30 14:15:00+00:00,49141.0,2454.0,UCSglJMvX-zSgv3PEJIE_inw,18953780,276000,523
LYCd0JGkS9U,September A New Paradigm (Stock Market Analysis for August 31st 2020),https://www.youtube.com/watch?v=LYCd0JGkS9U,2020-08-31 07:30:10+00:00,12563.0,711.0,UCSqNq7kQMKvgf_LXxFmPRQA,5549747,33800,1128
26W9VeBFzZY,CORRECTION? Stock Market Technical Analysis | S&amp;P 500 TA | SPY TA | QQQ TA | DIA TA | SP500 TODAY,https://www.youtube.com/watch?v=26W9VeBFzZY,2020-08-31 22:12:45+00:00,2403.0,218.0,UCUP_ao_7-Yct5FcVIA4Kobg,9650641,61800,919
8Z1FtcrtA_A,10k per DAY Trading STOCKS (4 hrs a day lang) | Buhay Stock Trader,https://www.youtube.com/watch?v=8Z1FtcrtA_A,2020-09-01 10:05:11+00:00,292874.0,8262.0,UCSRcoP3LBWdLumpSJb3E3Iw,11478164,269000,319
Do5DLoukZ7A,STOCK MARKET BULLS PRESS FORWARD (Stability Breeds Instability) | SP500 Technical Analysis,https://www.youtube.com/watch?v=Do5DLoukZ7A,2020-09-02 01:09:00+00:00,10123.0,701.0,UCfdPOTevbfCh_QHsyPeZ8MQ,12987726,125000,986
1ZqpF3vVHbo,Time Has Come To Become An Independent Trader In Stock Market | Join this Community. #earnwithme,https://www.youtube.com/watch?v=1ZqpF3vVHbo,2020-09-02 12:30:06+00:00,4561.0,387.0,UC5mKnVgAtjv1ms8NjQN5juQ,3376768,82400,836
_XmraYY6QUQ,I Lost My LIFE SAVINGS in the Stock Market - Avoid These Investing Mistakes! (True Story),https://www.youtube.com/watch?v=_XmraYY6QUQ,2020-09-04 15:00:30+00:00,8760.0,292.0,UCslILx8evneGsPxBe8GoBhw,1353911,16500,148
jrN8J2NC5GQ,How to become Rich 10 Rules By Warren Buffett  Stock Market For Beginners  Teachers Day Special,https://www.youtube.com/watch?v=jrN8J2NC5GQ,2020-09-05 04:58:31+00:00,139015.0,13549.0,UCY3cHUi4DFx-DyGBlH-tVjw,33683802,869000,214
rdiGuaZHHFM,Fundamental Analysis Of Stock Market In Telugu - Stock Market Basics For Beginners | Kowshik Maridi,https://www.youtube.com/watch?v=rdiGuaZHHFM,2020-09-05 15:30:02+00:00,25912.0,938.0,UCzaRorDlS1gd6EROE-xGm-Q,494214018,2120000,1854
nli6oai2R08,Nepal Share Market - Understanding the Basics |  Share  -   | Part 1,https://www.youtube.com/watch?v=nli6oai2R08,2020-09-06 08:24:27+00:00,1003222.0,48420.0,UCuv3IZ2RpS657pt5aL7TVtQ,11977388,311000,80
fm2cnP1ruag,How SoftBank&#39;s Billion-Dollar Option Bets Helped Fuel the Stock Market Rally,https://www.youtube.com/watch?v=fm2cnP1ruag,2020-09-07 22:57:49+00:00,33534.0,2169.0,UCYOHtOzMZGwXBLZX1Ltf78g,31048997,432000,199
sgd3WEKXpk4,Nepal Share Market -     |  Share  - Why to Invest in Share Market | Part - 2,https://www.youtube.com/watch?v=sgd3WEKXpk4,2020-09-09 02:29:46+00:00,295519.0,13882.0,UCuv3IZ2RpS657pt5aL7TVtQ,11977388,311000,80
uCOuYZzpNnU,Stock Market Rolls Over Along with Gold &amp; Silver. What Happens Next?,https://www.youtube.com/watch?v=uCOuYZzpNnU,2020-09-10 20:41:42+00:00,35241.0,1953.0,UCN2WmKUchJpIcS1MupY-BuA,9438421,127000,884
KdCs3EWGJvQ,Building Wealth (Ep. 6) - Stocks Portfolio Recommendation (),https://www.youtube.com/watch?v=KdCs3EWGJvQ,2020-09-13 11:00:02+00:00,155041.0,5972.0,UCDovblgxr3wxx20RoolLHYw,10462170,190000,185
8JOQafsH2zw,"Is this a Stock Market Crash, Should You Sell?",https://www.youtube.com/watch?v=8JOQafsH2zw,2020-09-13 17:49:00+00:00,9303.0,469.0,UC151mnaPrIvTELng72QtFDQ,1665175,18300,855
ocYsM2KHhP8,How The Stock Market Works In Under 8 Minutes,https://www.youtube.com/watch?v=ocYsM2KHhP8,2020-09-14 18:26:56+00:00,110672.0,3389.0,UCpko_-a4wgz2u_DgDgd9fqA,17963884486,20100000,7846
FgoTiyoi1Ho,PATIENCE PAYS! Stock Market Technical Analysis | S&amp;P 500 TA | SPY TA | QQQ TA | DIA TA | SP500 TODAY,https://www.youtube.com/watch?v=FgoTiyoi1Ho,2020-09-15 22:02:52+00:00,4114.0,363.0,UCUP_ao_7-Yct5FcVIA4Kobg,9650641,61800,919
vCdTLteTPtM,The 5 BEST Index Funds That Will Make You RICH,https://www.youtube.com/watch?v=vCdTLteTPtM,2020-09-16 22:30:04+00:00,1684959.0,125443.0,UCV6KDgJskWaEckne5aPA0aQ,790814775,4550000,972
h57apTwV9cM,Election 2020= Stock Market Crash?,https://www.youtube.com/watch?v=h57apTwV9cM,2020-09-17 14:05:50+00:00,8073.0,368.0,UCF31eojFKhWQJviyMICWO2w,21014899,210000,1269
2ZVVmxlesMY,Stock Market Defends Critical Support Again As Dollar Gives Back All FOMC Gains,https://www.youtube.com/watch?v=2ZVVmxlesMY,2020-09-17 20:36:36+00:00,19330.0,1177.0,UCN2WmKUchJpIcS1MupY-BuA,9438421,127000,884
-8c7wM6E9GM,HOW LOW? Stock Market Technical Analysis | S&amp;P 500 TA | SPY TA | QQQ TA | DIA TA | SP500 TODAY,https://www.youtube.com/watch?v=-8c7wM6E9GM,2020-09-18 23:28:02+00:00,6907.0,571.0,UCUP_ao_7-Yct5FcVIA4Kobg,9650641,61800,919
pTuPtOxXcM4,How to Invest in the Stock Market in Telugu | What is Stock Market in Telugu,https://www.youtube.com/watch?v=pTuPtOxXcM4,2020-09-19 12:42:05+00:00,83143.0,7203.0,UCjjX7g9T83GQwp-OwUvoL4Q,191481439,1110000,689
OzO8XEu5h5o,How to Trade Pre-Market &amp; After Hours -- Extended Hours Trading Explained,https://www.youtube.com/watch?v=OzO8XEu5h5o,2020-09-19 18:06:59+00:00,60332.0,2163.0,UCYHosdETLPp6dpJEsgIUTmw,106505911,413000,802
cQfifaFGryw,S&amp;P500 VIX Elliott Wave U.S. Market Update,https://www.youtube.com/watch?v=cQfifaFGryw,2020-09-21 06:48:46+00:00,13836.0,1108.0,UCSdmV9HW3ou301MBTSGxbjg,2995383,40300,632
qYJDQ8BL0CI,"COULD A STOCK MARKET CRASH SEND #BITCOIN TO $5,900???",https://www.youtube.com/watch?v=qYJDQ8BL0CI,2020-09-21 17:37:59+00:00,11107.0,1231.0,UCVTbGN6Hzi4sSAz1bKHiDiQ,5827840,70700,710
sMugEuKSiDA,"Stock market crash? Nope, here&#39;s what actually happened yesterday",https://www.youtube.com/watch?v=sMugEuKSiDA,2020-09-22 19:00:47+00:00,6512.0,511.0,UCoJhK5kMc4LjBKdiYrDtzlA,481478651,2190000,3263
zS55xkOsw8Y,"Bears Are Trapped. Whats Next for Stock Market, US Dollar, Gold, Silver &amp; Bitcoin?",https://www.youtube.com/watch?v=zS55xkOsw8Y,2020-09-22 20:44:09+00:00,29395.0,2071.0,UCN2WmKUchJpIcS1MupY-BuA,9438421,127000,884
-DbiBLe69fs,"Nepal Share Market - Secondary Market (  ) | Part 4 | Trading A/c,TMS login &amp; Connect IPS",https://www.youtube.com/watch?v=-DbiBLe69fs,2020-09-23 01:45:14+00:00,635422.0,22148.0,UCuv3IZ2RpS657pt5aL7TVtQ,11977388,311000,80
e9uZA3YAEQs,Upward Correction To Continue... (Stock Market Analysis for September 23rd 2020),https://www.youtube.com/watch?v=e9uZA3YAEQs,2020-09-23 07:33:04+00:00,10501.0,660.0,UCSqNq7kQMKvgf_LXxFmPRQA,5549747,33800,1128
Gskqx8dy9To,Bonds 101 (DETAILED EXPLANATION FOR BEGINNERS),https://www.youtube.com/watch?v=Gskqx8dy9To,2020-09-23 18:11:37+00:00,257241.0,11589.0,UCIbslwukNCyVp-XMz_2-gmw,29680687,758000,147
PLwby4gCDkU,STOCKS LOWER? Stock Market Technical Analysis | S&amp;P 500 TA | SPY TA | QQQ TA | DIA TA | SP500 TODAY,https://www.youtube.com/watch?v=PLwby4gCDkU,2020-09-23 22:22:59+00:00,5510.0,646.0,UCUP_ao_7-Yct5FcVIA4Kobg,9650641,61800,919
oMnmTV5HF5Y,Short Selling explained.. Short Selling for Beginners (Best Broker for Shorting),https://www.youtube.com/watch?v=oMnmTV5HF5Y,2020-09-23 22:30:03+00:00,197168.0,11025.0,UCcIvNGMBSQWwo1v3n-ZRBCw,61049890,1120000,503
vzHHwcfPUNQ,BEST STOCK MARKET SIMULATORS: 2 best FREE stock market simulators that you must use before you trade,https://www.youtube.com/watch?v=vzHHwcfPUNQ,2020-09-24 00:00:06+00:00,320355.0,8026.0,UCPFRKP6frD6ug5FD9lYX3DA,625303,6990,91
BIzKeKLEcjM,How Do Elections Affect the Stock Market? (Here Are The Facts),https://www.youtube.com/watch?v=BIzKeKLEcjM,2020-09-24 13:00:06+00:00,2808.0,105.0,UC9vUu4vlIlMC0dHQCTvQPbg,75388122,383000,3121
RDnDEUcmLrc,"Whats Next for Stock Market? Dollar Slides, Gold &amp; Silver Bounce - Into Resistance",https://www.youtube.com/watch?v=RDnDEUcmLrc,2020-09-24 20:51:57+00:00,23861.0,1246.0,UCN2WmKUchJpIcS1MupY-BuA,9438421,127000,884
N2wpYpz6E3k,Market Remains Dangerous (Stock Market Analysis for September 25th 2020),https://www.youtube.com/watch?v=N2wpYpz6E3k,2020-09-25 08:20:14+00:00,10135.0,762.0,UCSqNq7kQMKvgf_LXxFmPRQA,5549747,33800,1128
IkR4qIwJ-oc,How I Earned My First 1 Crore - Vivek Singhal | How To Make Money In Stock Market,https://www.youtube.com/watch?v=IkR4qIwJ-oc,2020-09-26 11:30:00+00:00,630071.0,29413.0,UCihPYlorLXjroDGnQL17YvQ,46142604,461000,779
sNA1DC_nZVg,"Pair Correlations | US30, NAS100, S&amp;P 500| Stocks &amp; Foreign Exchange",https://www.youtube.com/watch?v=sNA1DC_nZVg,2020-09-26 17:32:56+00:00,8280.0,163.0,UChJS3fR0if4gQgb4O-PHXnQ,100289,2290,52
lvhnBCXag2M,Robert Kiyosaki: The Biggest Stock Market Crash Is On Us NOW!,https://www.youtube.com/watch?v=lvhnBCXag2M,2020-09-27 10:29:43+00:00,241229.0,2920.0,UCmHm0w-JJfC2Ll1Of_WObAQ,55318440,474000,287
3AAlCP6HbVs,How To Get $1000 of Dividends a Month with the S&amp;P 500 Index (VOO VS SWPPX),https://www.youtube.com/watch?v=3AAlCP6HbVs,2020-09-27 16:00:00+00:00,77564.0,2050.0,UCUiDOwEK5lMBiPeDkZiaDxA,1036758,22200,268
au6VVFDoY8I,Profitable Day Trading During a Stock Market Crash - Market Minutes for Sept 28th,https://www.youtube.com/watch?v=au6VVFDoY8I,2020-09-27 17:31:29+00:00,3287.0,275.0,UC151mnaPrIvTELng72QtFDQ,1665175,18300,855
QCAlOAQ_E0A,Open Interest Explained in Telugu | Option Chain Analysis in Telugu | Stock Market in Telugu,https://www.youtube.com/watch?v=QCAlOAQ_E0A,2020-09-28 03:41:26+00:00,123888.0,4319.0,UCSmR76TED496O28f4dxLjBA,4589324,138000,51
2NZ-Q328UBk,Stock Market Terminology for Dummies,https://www.youtube.com/watch?v=2NZ-Q328UBk,2020-09-30 12:45:01+00:00,206242.0,8320.0,UC7muJQNjKAQh0n6bZdYVGKQ,67398932,223000,1573
jy6n_BNuaPI,Investing In The Stock Market For beginners in 2021 | Step By Step To Start Investing,https://www.youtube.com/watch?v=jy6n_BNuaPI,2020-10-01 10:57:05+00:00,44354.0,1771.0,UC5YKivGUTTQmhSuaXbxfZSg,229519796,1100000,933
0NH1Ez6LtN4,Harshad Mehta - Real Interview | Full Story | Biggest Stock Market Scam | Scam 1992,https://www.youtube.com/watch?v=0NH1Ez6LtN4,2020-10-02 13:44:40+00:00,15072434.0,307195.0,UCdlYEn3eWP4Bfo-owDSRyRw,37366560,162000,70
ROOC8-12jNc,STOCK MARKET DOWN (ELECTIONS AND TRUMP IS SICK?) MY PLAN TO DO NOW!,https://www.youtube.com/watch?v=ROOC8-12jNc,2020-10-02 19:26:54+00:00,2831.0,174.0,UC5cEHfCr6WOE1R1zcohd1IA,2934897,28600,1533
E9PnMGjx0u0,Are You a Winner of The Stock Market Lottery,https://www.youtube.com/watch?v=E9PnMGjx0u0,2020-10-03 11:00:03+00:00,13913.0,755.0,UC-hq1OIl97y7h0DiJx45N3w,18849079,178000,2093
E4O1-QW_SrY,How to analyse Foreign Company Stocks? Explained by CA Rachana Ranade,https://www.youtube.com/watch?v=E4O1-QW_SrY,2020-10-03 14:02:23+00:00,81091.0,3456.0,UCe3qdG0A_gr-sEdat5y2twQ,252840634,4600000,1124
OVinkDOFXVk,Why The Stock Market is a Balloon Waiting to Burst,https://www.youtube.com/watch?v=OVinkDOFXVk,2020-10-03 21:11:23+00:00,14799.0,1103.0,UCoJhK5kMc4LjBKdiYrDtzlA,481478651,2190000,3263
hSFRWvxFsw4,"The $8,000,000 Janitor: A True Story of an Unknown Stock Market Legend",https://www.youtube.com/watch?v=hSFRWvxFsw4,2020-10-05 17:00:15+00:00,67795.0,2904.0,UCS4ITAOQlFP9_ny2Zl5b0ig,10170838,188000,211
PVgpKaXj0fk,Vanguard Index Funds: A Complete Beginner&#39;s Guide to Investing,https://www.youtube.com/watch?v=PVgpKaXj0fk,2020-10-06 19:39:28+00:00,526200.0,14921.0,UCTQuKo8v0PaPCvk5aRxc_Yg,57168167,1090000,584
