video_id,Title,Video Link,Publish Date,View Count,Like Count,Channel ID,Channel View,Subscriber Count,Video Count
gtMfYi1vnuI,Peter Schiff: Do This to Survive the Stock Market Bubble,https://www.youtube.com/watch?v=gtMfYi1vnuI,2017-10-31 21:59:08+00:00,15202.0,220.0,UCFX1QGky8xI9BxIFwfskTcA,6288984,38100,2620
k9wwJpgFpFM,STOCK MARKET BASICS : BEYOND THE STOCK PRICE - EPISODE 005,https://www.youtube.com/watch?v=k9wwJpgFpFM,2017-11-03 04:17:46+00:00,1571.0,61.0,UCfkrhXXsLEnvxiT4sIpSa8w,114840,4200,85
IscG_bAeEic,Convolutional Neural Networks And Unconventional Data - Predicting The Stock Market Using Images,https://www.youtube.com/watch?v=IscG_bAeEic,2017-11-04 20:59:43+00:00,18514.0,353.0,UCq4pm1i_VZqxKVVOz5qRBIA,1476216,16500,467
UWHOrSD4TcI,How to survive a stock market crash: what is portfolio diversification,https://www.youtube.com/watch?v=UWHOrSD4TcI,2017-11-06 01:07:42+00:00,1786.0,68.0,UCWpWvzkSqKW6E63RgmQLjbg,4717108,61100,336
B8-_Mxz0Weg,What are Support and Resistance?,https://www.youtube.com/watch?v=B8-_Mxz0Weg,2017-11-08 13:08:34+00:00,524277.0,10791.0,UCfWQuGYMfhZk9qq5x00sb9w,76944001,1200000,224
xjamrHC91l4,Why the Stock Market SHOULD Have Crashed! Weakest 52-Week High ON RECORD!,https://www.youtube.com/watch?v=xjamrHC91l4,2017-11-09 04:54:28+00:00,9329.0,723.0,UCngq92xrmmsfEgGdfAJ6giQ,95477532,287000,4232
mtcBKGbyE70,Cash Equivalents &amp; Alternatives | Non Traditional Investments,https://www.youtube.com/watch?v=mtcBKGbyE70,2017-11-10 16:29:45+00:00,126527.0,4624.0,UCFCEuCsyWP0YkP3CZ3Mr01Q,57600094,810000,197
R2Y0Oywkg4g,Robinhood APP | How to SWING TRADE the Stock Market,https://www.youtube.com/watch?v=R2Y0Oywkg4g,2017-11-12 02:48:29+00:00,17825.0,192.0,UC7R3Xjx3cEixcwmv-Km5Tfw,4488574,35700,958
tFvFAqAx0XQ,Stock Market TAX RATES | How to SAVE MONEY at TAX TIME!,https://www.youtube.com/watch?v=tFvFAqAx0XQ,2017-11-15 01:43:35+00:00,1615.0,70.0,UC7R3Xjx3cEixcwmv-Km5Tfw,4488574,35700,958
C08fDbrEtJE,Investment Books and Stock Market Books,https://www.youtube.com/watch?v=C08fDbrEtJE,2017-11-17 20:49:55+00:00,25740.0,1305.0,UCaGwH4JooqsvBt-gJtB85Lg,38432990,324000,2947
Q1ptq8UV0F4,"   ,    | Stock market Basics for beginners in Hindi | Episode-67 | SM",https://www.youtube.com/watch?v=Q1ptq8UV0F4,2017-11-18 07:35:41+00:00,171193.0,8244.0,UCS8WLwuVszq1g2oeBzboUmQ,132031771,1400000,672
43kjpV7B_V0,How to MAKE MONEY when the STOCK MARKET CRASHES | Investing 101!,https://www.youtube.com/watch?v=43kjpV7B_V0,2017-11-19 05:46:18+00:00,1673.0,62.0,UC7R3Xjx3cEixcwmv-Km5Tfw,4488574,35700,958
Xgj_Zr4u4I0,Why the Stock Market Will Crash by a MINIMUM of 50%! Some Stocks Will Drop to 0,https://www.youtube.com/watch?v=Xgj_Zr4u4I0,2017-11-19 07:57:29+00:00,53189.0,1854.0,UCngq92xrmmsfEgGdfAJ6giQ,95477532,287000,4232
REFqsIJYF0w,TAX on DIVIDEND PAYMENTS and STOCK MARKET GAINS?  | Investing 101,https://www.youtube.com/watch?v=REFqsIJYF0w,2017-11-22 03:36:40+00:00,5434.0,144.0,UC7R3Xjx3cEixcwmv-Km5Tfw,4488574,35700,958
3mpL7tGa0FI,Global stock market trading hours and when to trade for best results.,https://www.youtube.com/watch?v=3mpL7tGa0FI,2017-11-26 15:25:53+00:00,5004.0,71.0,UCKywiJmo2z66ylCOQSJ64hw,5587393,76800,700
uvoKlSt2YAQ,High Yield Bond Fund | Dividend Capture Stock Market Investing!,https://www.youtube.com/watch?v=uvoKlSt2YAQ,2017-11-27 05:22:02+00:00,1461.0,40.0,UC7R3Xjx3cEixcwmv-Km5Tfw,4488574,35700,958
KKFkodX8X4U,Basic example of day trading stock market Philippines,https://www.youtube.com/watch?v=KKFkodX8X4U,2017-11-28 15:23:26+00:00,27129.0,335.0,UCUYO1VUGRd7Qi2yKaFfG5IQ,341486,4920,110
f1Dx9lzyRUs,What is Stock Market Index? | Equity Index | Sensex and Nifty Explained | Stock Market for Beginners,https://www.youtube.com/watch?v=f1Dx9lzyRUs,2017-11-29 05:00:01+00:00,109326.0,1681.0,UCPohbSYq4IXhv0yxiy-sT4g,54461453,777000,1566
CJjPOGQKwf0,   Regular Income  ?  Passive Income | Recurring Revenue | Dr Vivek Bindra,https://www.youtube.com/watch?v=CJjPOGQKwf0,2017-12-04 15:43:57+00:00,13782073.0,412427.0,UCR-foyF-C6VuAlwy3KZMkgA,1826277362,21300000,1045
y9TEX18jVUM,17 Stock market: Square off :Short sell : Volatility : volume :stock symbol  complete explanation,https://www.youtube.com/watch?v=y9TEX18jVUM,2017-12-05 17:10:29+00:00,36760.0,1010.0,UC7Xf4yml02QYUoKQ5nOdwqQ,5848087,102000,398
HVGr68RzkY0,LEGENDS OF TRADING: THE STORY OF JESSE LIVERMORE,https://www.youtube.com/watch?v=HVGr68RzkY0,2017-12-06 21:16:42+00:00,837746.0,23193.0,UCHdE6HODo3UXD9E-QplAFOw,14166633,183000,315
pF91cdE7i90,Day Trading Strategy - How to Trade the US Open Like a Professional Trader,https://www.youtube.com/watch?v=pF91cdE7i90,2017-12-09 22:36:03+00:00,73998.0,1859.0,UCKywiJmo2z66ylCOQSJ64hw,5587393,76800,700
an-mozw_XIE,A Moral Problem with Trading the Stock Market?,https://www.youtube.com/watch?v=an-mozw_XIE,2017-12-14 15:20:37+00:00,7899.0,149.0,UCn2JOViAAWssWefchGpTNvw,44782628,597000,3427
GAmAk1LNvJA,Billionaire Ken Fisher Reveals His 2018 Stock Market Outlook,https://www.youtube.com/watch?v=GAmAk1LNvJA,2017-12-14 16:14:53+00:00,154012.0,1248.0,UCp6aBHRM6ZS_kLeC57HV4kg,38044588,98600,26605
7hMy6i1G0rc,Build a Stock Market Portfolio + Top Stock Picks | Warren Buffet Style | 50% Return p.a,https://www.youtube.com/watch?v=7hMy6i1G0rc,2017-12-14 19:01:09+00:00,14342.0,439.0,UC1jzOzpbEoqf-x_tbYWvkAw,3767289,97000,150
7CWjZuU2g2A,Leverage | Trading Terms,https://www.youtube.com/watch?v=7CWjZuU2g2A,2017-12-15 12:04:16+00:00,140003.0,2442.0,UCfWQuGYMfhZk9qq5x00sb9w,76944001,1200000,224
INW1MxyDy-0,BEST Stock Market Investing Strategy! | Doctor Dividend,https://www.youtube.com/watch?v=INW1MxyDy-0,2017-12-18 17:49:07+00:00,2797.0,96.0,UC7R3Xjx3cEixcwmv-Km5Tfw,4488574,35700,958
UvT1OJOdffY,"Aries  January: Lotteries, Casino, Career, Biz, Forex, Stock Market Prediction.",https://www.youtube.com/watch?v=UvT1OJOdffY,2017-12-31 03:48:17+00:00,4520.0,87.0,UCeQF6en3e7vBlIjj8nyKmkQ,17525605,131000,8586
zxPn17wm51M,"Aquarius - January: Lotteries, Casino, Career, Biz, Forex, Stock Market Prediction",https://www.youtube.com/watch?v=zxPn17wm51M,2017-12-31 13:23:32+00:00,3489.0,73.0,UCeQF6en3e7vBlIjj8nyKmkQ,17525605,131000,8586
mLq_d9UiUDI,"Scorpio - January: Lotteries, Casino, Career, Biz, Forex, Stock Market Prediction",https://www.youtube.com/watch?v=mLq_d9UiUDI,2017-12-31 13:34:51+00:00,1245.0,38.0,UCeQF6en3e7vBlIjj8nyKmkQ,17525605,131000,8586
je8EIAPFrwk,"Pisces - January: Lotteries, Casino, Career, Biz, Forex, Stock Market Prediction",https://www.youtube.com/watch?v=je8EIAPFrwk,2017-12-31 13:42:42+00:00,2132.0,52.0,UCeQF6en3e7vBlIjj8nyKmkQ,17525605,131000,8586
OsrEe8ME-bM,"Capricorn - January: Lotteries, Casino, Career, Biz, Forex, Stock Market Prediction",https://www.youtube.com/watch?v=OsrEe8ME-bM,2017-12-31 13:44:04+00:00,14294.0,236.0,UCeQF6en3e7vBlIjj8nyKmkQ,17525605,131000,8586
WiS0tF3R-I4,Stock Market Career - Earn 1 Crore in a Year Without Any Investment [HINDI],https://www.youtube.com/watch?v=WiS0tF3R-I4,2018-01-05 15:35:01+00:00,1588075.0,27750.0,UCqvVj1LkOpA8tjb7RadTvOg,81141743,1000000,1630
vPhiTQaL3io,Stock Market Education - How to Learn for FREE? [HINDI],https://www.youtube.com/watch?v=vPhiTQaL3io,2018-01-06 15:28:53+00:00,47697.0,3787.0,UCqvVj1LkOpA8tjb7RadTvOg,81141743,1000000,1630
mYfoh0xLKeQ,BITCOIN  INVESTMENT    I Complete Analysis I Dr Vivek Bindra,https://www.youtube.com/watch?v=mYfoh0xLKeQ,2018-01-07 12:15:18+00:00,9311326.0,352368.0,UCR-foyF-C6VuAlwy3KZMkgA,1826277362,21300000,1045
LzBPiZeuBrg,Stock Market Analysis - My Excel Sheet | Part I (HINDI),https://www.youtube.com/watch?v=LzBPiZeuBrg,2018-01-07 15:44:33+00:00,157017.0,4684.0,UCqvVj1LkOpA8tjb7RadTvOg,81141743,1000000,1630
Fbw-lRBIdUw,The Stock Market Is Going To Tank,https://www.youtube.com/watch?v=Fbw-lRBIdUw,2018-01-08 21:31:04+00:00,130730.0,4168.0,UCldfgbzNILYZA4dmDt4Cd6A,1099945137,1070000,19336
7uARQt015IM,TOP 6 REASONS TO SELL A STOCK! | Stock Market Investing,https://www.youtube.com/watch?v=7uARQt015IM,2018-01-09 02:59:31+00:00,1942.0,90.0,UC7R3Xjx3cEixcwmv-Km5Tfw,4488574,35700,958
MzgMa6VJeDY,DANGERS of PENNY STOCKS! | Stock Market Investing,https://www.youtube.com/watch?v=MzgMa6VJeDY,2018-01-15 05:17:43+00:00,2221.0,65.0,UC7R3Xjx3cEixcwmv-Km5Tfw,4488574,35700,958
OfyhDBmgBNs,Should you Trade the Dow Jones or S&amp;P 500? ,https://www.youtube.com/watch?v=OfyhDBmgBNs,2018-01-18 11:17:16+00:00,12675.0,233.0,UCnKPQUoCRb1Vu-qWwWituGQ,69229500,387000,4782
bE0ZlUMmGXo,What is a Pip or Point | Trading Terms,https://www.youtube.com/watch?v=bE0ZlUMmGXo,2018-01-21 10:00:02+00:00,155911.0,3091.0,UCfWQuGYMfhZk9qq5x00sb9w,76944001,1200000,224
LVn_L2-it-4,THIS Hasnt Happened in the U.S. Stock Market Ever In History! Meltdown Prevented by the Fed!,https://www.youtube.com/watch?v=LVn_L2-it-4,2018-01-22 05:33:30+00:00,14412.0,1066.0,UCngq92xrmmsfEgGdfAJ6giQ,95477532,287000,4232
amPa-YE3b4k,LIMITS on DAY and SWING Trading? | Stock Market Education!,https://www.youtube.com/watch?v=amPa-YE3b4k,2018-01-23 02:38:37+00:00,1997.0,90.0,UC7R3Xjx3cEixcwmv-Km5Tfw,4488574,35700,958
SbNhXR5C0kw,Ray Dalio: US Markets In &#39;Beautiful Goldilocks&#39; Period | CNBC,https://www.youtube.com/watch?v=SbNhXR5C0kw,2018-01-23 16:07:12+00:00,99988.0,809.0,UCvJJ_dzjViJCoLf5uKUTwoA,1438424656,3220000,15112
kW6S-x8tsgw,Stock Market Index - 7 Types of Indices [HINDI],https://www.youtube.com/watch?v=kW6S-x8tsgw,2018-01-27 16:06:29+00:00,80921.0,2600.0,UCqvVj1LkOpA8tjb7RadTvOg,81141743,1000000,1630
_qrzem8x9MA,Stock Market Risk - 4 Types You Should Know [HINDI],https://www.youtube.com/watch?v=_qrzem8x9MA,2018-01-28 15:58:18+00:00,28504.0,1292.0,UCqvVj1LkOpA8tjb7RadTvOg,81141743,1000000,1630
0OCF1UjyW0A,Trading Equities at the London Stock Exchange,https://www.youtube.com/watch?v=0OCF1UjyW0A,2018-01-29 18:25:52+00:00,4879.0,49.0,UCbY1hA0wpRcbyjBLxI-dxvQ,23164089,88000,1563
rDOLi-Igkaw,"Aries  February 2018, Lotteries, Casino, Career, Biz, Forex, Stock Market Prediction",https://www.youtube.com/watch?v=rDOLi-Igkaw,2018-01-30 21:50:27+00:00,5989.0,107.0,UCeQF6en3e7vBlIjj8nyKmkQ,17525605,131000,8586
ZYvYWlM98MI,"Taurus   February 2018, Lotteries, Casino, Career, Biz, Forex, Stock Market Prediction",https://www.youtube.com/watch?v=ZYvYWlM98MI,2018-01-30 22:02:05+00:00,1182.0,34.0,UCeQF6en3e7vBlIjj8nyKmkQ,17525605,131000,8586
FFIUDvhkYng,"Libra   February 2018 Lotteries, Casino, Career, Biz, Forex, Stock Market Prediction",https://www.youtube.com/watch?v=FFIUDvhkYng,2018-01-31 05:23:20+00:00,2358.0,48.0,UCeQF6en3e7vBlIjj8nyKmkQ,17525605,131000,8586
Ia6GXKOr56o,"Pisces   February 2018 Lotteries, Casino, Career, Biz, Forex, Stock Market Prediction",https://www.youtube.com/watch?v=Ia6GXKOr56o,2018-01-31 06:33:13+00:00,4266.0,95.0,UCeQF6en3e7vBlIjj8nyKmkQ,17525605,131000,8586
-ZSG_z-5w3w,Trading 101: Online Broker Fees Explained,https://www.youtube.com/watch?v=-ZSG_z-5w3w,2018-02-01 15:00:00+00:00,42587.0,736.0,UCn2JOViAAWssWefchGpTNvw,44782628,597000,3427
VUgi0s907PQ,Alpha of a Stock - Why it is Important? [HINDI],https://www.youtube.com/watch?v=VUgi0s907PQ,2018-02-01 16:31:14+00:00,41396.0,1907.0,UCqvVj1LkOpA8tjb7RadTvOg,81141743,1000000,1630
sZK4Zinv6DE,Stock Market Insanity Reaching Nose-Bleed Levels,https://www.youtube.com/watch?v=sZK4Zinv6DE,2018-02-02 14:13:50+00:00,17044.0,298.0,UCED7G7CZfqdSV9zttlr1M_g,1320589,20400,121
F2rc0HM-L2U,BETTER INVESTMENT - BITCOIN or STOCK MARKET? | Investing 101,https://www.youtube.com/watch?v=F2rc0HM-L2U,2018-02-04 05:04:18+00:00,2142.0,61.0,UC7R3Xjx3cEixcwmv-Km5Tfw,4488574,35700,958
Jn8v3AfyrX0,Here&#39;s why you&#39;ll NEVER make money in Forex. The Forex Cycle of Doom...,https://www.youtube.com/watch?v=Jn8v3AfyrX0,2018-02-05 18:02:57+00:00,3390994.0,85091.0,UCYBI0zHsYhXPvVWThQOXkGA,17205918,404000,632
AaODVT5Sjk0,ALGO Trading    ? | Episode-19 | Stock market Basics for beginners in Hindi | SM,https://www.youtube.com/watch?v=AaODVT5Sjk0,2018-02-08 06:32:29+00:00,462669.0,11948.0,UCS8WLwuVszq1g2oeBzboUmQ,132031771,1400000,672
aSmhvOwp2xc,What&#39;s Next For The Stock Market After 800 Point Drop &amp; How WIll Gold &amp; Silver React?,https://www.youtube.com/watch?v=aSmhvOwp2xc,2018-02-08 20:59:47+00:00,5212.0,123.0,UCRFGG_cqU3NzQ5A-0HTCIxg,4839416,27300,1268
2Lad3Qz3KMs,MAKE 30% with STOCK MARKET FEAR! | Stock Market Investing,https://www.youtube.com/watch?v=2Lad3Qz3KMs,2018-02-09 05:08:46+00:00,3039.0,82.0,UC7R3Xjx3cEixcwmv-Km5Tfw,4488574,35700,958
wKkMyeThO6I,Hyperwave - Bitcoin &amp; GBTC Continue To Climb | US Stock Market Downtrend Reverses,https://www.youtube.com/watch?v=wKkMyeThO6I,2018-02-09 22:26:24+00:00,1142.0,19.0,UCLJxbdXt4jG9pSy79TMVQSw,1242244,15000,195
GsBcGDySGSg,U.S. Stock Market RESCUED By Plunge Protection Team! This Is PROVEN Market Manipulation!,https://www.youtube.com/watch?v=GsBcGDySGSg,2018-02-10 06:59:06+00:00,11961.0,890.0,UCngq92xrmmsfEgGdfAJ6giQ,95477532,287000,4232
XetwySrLUMA,Python Stock Market Analysis Solutions - Part Two,https://www.youtube.com/watch?v=XetwySrLUMA,2018-02-12 11:01:33+00:00,1141.0,15.0,UCXdWgO_5F8Ep_i6f3BFdxuw,59307,423,67
TCfvqXNPZYI,How to Read Balance Sheet on Moneycontrol? (Hindi) Part 1,https://www.youtube.com/watch?v=TCfvqXNPZYI,2018-02-12 12:02:09+00:00,2695992.0,91019.0,UCUMccND2H_CVS0dMZKCPCXA,350180702,2300000,973
9W4IqwzOrBg,4 Most Important Growth Numbers - Low Risk Stock Market Investing,https://www.youtube.com/watch?v=9W4IqwzOrBg,2018-02-13 13:00:00+00:00,2665.0,116.0,UCODr9HUJ90xtWD-0Xoz4vPw,9994116,138000,501
iWq0Wy6RRIg,STOCK MARKET NEWS - WILL INFLATION CRASH STOCKS OR PUSH THEM HIGHER?,https://www.youtube.com/watch?v=iWq0Wy6RRIg,2018-02-17 22:00:03+00:00,5078.0,182.0,UCrTTBSUr0zhPU56UQljag5A,26013237,226000,1418
bwYcgeCGCk4,Easiest Way to Accurately Value a Stock -  Low Risk Stock Market Investing,https://www.youtube.com/watch?v=bwYcgeCGCk4,2018-02-25 00:51:40+00:00,17757.0,654.0,UCODr9HUJ90xtWD-0Xoz4vPw,9994116,138000,501
q6Kr6i8Icp8,PSE Stock Market Perfect Entry and Exit Strategy   PIVOCCI Part 1,https://www.youtube.com/watch?v=q6Kr6i8Icp8,2018-02-26 05:24:48+00:00,2343.0,41.0,UCu3e6J2sLpq_P-UbXaGeNUg,66885,1570,148
OPF8tGZ3Mds,How To Make $300 A Day Investing In The Stock Market,https://www.youtube.com/watch?v=OPF8tGZ3Mds,2018-02-26 19:19:56+00:00,62517.0,1031.0,UCtlAFoYl2aWb6pMiHCctQHA,105824861,1160000,3623
3FTbs2qCaFY,"Aquarius - March 2018 Lotteries, Casino, Career, Biz, Forex, Stock Market Prediction",https://www.youtube.com/watch?v=3FTbs2qCaFY,2018-02-27 04:47:16+00:00,6248.0,99.0,UCeQF6en3e7vBlIjj8nyKmkQ,17525605,131000,8586
VSGcIXCkpaE,The #1 Sign That the Stock Market Will Collapse EXTREMELY FAST and We Just Got A Warning!,https://www.youtube.com/watch?v=VSGcIXCkpaE,2018-02-27 14:18:02+00:00,25843.0,1161.0,UCngq92xrmmsfEgGdfAJ6giQ,95477532,287000,4232
6_vdQR3Gers,Technical Analysis of Stock Market | Europe &amp; the Hangman,https://www.youtube.com/watch?v=6_vdQR3Gers,2018-03-03 21:29:12+00:00,1654.0,105.0,UCtTn6Xa2JOsQVxOS_jI7nuQ,1854643,27000,1036
Z_SEr5Na2yw,The Top 10 Global Risks! Stock Market Crash Is the #1 Potential Danger For 2018!,https://www.youtube.com/watch?v=Z_SEr5Na2yw,2018-03-05 05:38:34+00:00,13576.0,667.0,UCngq92xrmmsfEgGdfAJ6giQ,95477532,287000,4232
q1UftYkI1ec,THIS One Company Owns 7% of the U.S. Stock Market! Can You Guess Which One?,https://www.youtube.com/watch?v=q1UftYkI1ec,2018-03-05 14:02:51+00:00,15219.0,747.0,UCngq92xrmmsfEgGdfAJ6giQ,95477532,287000,4232
MIj47icgdg4,Which Way Will Gold And Silver Break  | Stock Market Volume Charting Technique,https://www.youtube.com/watch?v=MIj47icgdg4,2018-03-07 22:59:27+00:00,1830.0,63.0,UCe6tb9LKiIu9eD2fVZurxnQ,8946837,41000,4286
t0ebaB0yPpY,Paano Kumita sa Stock Market | How to Earn Money in the Stock Market,https://www.youtube.com/watch?v=t0ebaB0yPpY,2018-03-09 12:50:34+00:00,256241.0,4818.0,UCDXx8CrhB5uQPrIGd57tEww,8406171,132000,882
EBR7xirkOj0,DIVIDEND CAPTURE with BUY and HOLD Stocks! | Stock Market Investing,https://www.youtube.com/watch?v=EBR7xirkOj0,2018-03-11 04:24:03+00:00,2457.0,94.0,UC7R3Xjx3cEixcwmv-Km5Tfw,4488574,35700,958
EE3AftNnVNk,Intraday       ? | Best &amp; Simple Intraday Strategy | Episode-25 | SM,https://www.youtube.com/watch?v=EE3AftNnVNk,2018-03-12 05:23:53+00:00,1353604.0,46511.0,UCS8WLwuVszq1g2oeBzboUmQ,132031771,1400000,672
QRXykQrfZhg,How To Make +$500 A Day | Stock Market,https://www.youtube.com/watch?v=QRXykQrfZhg,2018-03-12 18:52:19+00:00,12921.0,287.0,UCtlAFoYl2aWb6pMiHCctQHA,105824861,1160000,3623
PitfvqHXKt4,WHAT IS SWING TRADING?,https://www.youtube.com/watch?v=PitfvqHXKt4,2018-03-13 14:00:02+00:00,60385.0,1300.0,UCTovmBbgOEgi4iXqSH3IxjQ,23570017,219000,2370
eAsxSAkfIbY,2 Swing Trades vs Dividend capture + Swing Trade? | Stock Market 101,https://www.youtube.com/watch?v=eAsxSAkfIbY,2018-03-16 03:27:51+00:00,1986.0,66.0,UC7R3Xjx3cEixcwmv-Km5Tfw,4488574,35700,958
SCKBDQ4wY2U,Stock Market Bitcoin and Gold Analysis March 16 2018 Alphatrends,https://www.youtube.com/watch?v=SCKBDQ4wY2U,2018-03-16 20:29:48+00:00,2212.0,,UCfD3rq06LaA8wc3s2m3LwRQ,6055091,58800,1975
N42HXtzP3RQ,Why ONLY 1 SHARE of a Stock? | Stock Market Portfolio Explained!,https://www.youtube.com/watch?v=N42HXtzP3RQ,2018-03-17 04:55:55+00:00,23303.0,396.0,UC7R3Xjx3cEixcwmv-Km5Tfw,4488574,35700,958
hBNtkTnYYlM,Technical Analysis of Stock Market | the Magazine Cover,https://www.youtube.com/watch?v=hBNtkTnYYlM,2018-03-17 22:35:22+00:00,1650.0,75.0,UCtTn6Xa2JOsQVxOS_jI7nuQ,1854643,27000,1036
iT4e41sSodU,WHAT A STOCK MARKET CRASH LOOKS LIKE ,https://www.youtube.com/watch?v=iT4e41sSodU,2018-03-20 19:40:04+00:00,41439.0,1500.0,UC3mjMoJuFnjYRBLon_6njbQ,66193275,806000,581
BrPt4FfF0oc,What is the Most Important Thing in Your Life? | Sankarsh Chanda | TEDxNMIMSBangalore,https://www.youtube.com/watch?v=BrPt4FfF0oc,2018-03-20 20:47:49+00:00,205922.0,5078.0,UCsT0YIqwnpJCM-mx7-gSA4Q,7577612051,39600000,205525
dNqIkI6b7y8,5 Reasons TO BUY a Stock | Stock Market Investing!,https://www.youtube.com/watch?v=dNqIkI6b7y8,2018-03-21 04:46:17+00:00,2400.0,98.0,UC7R3Xjx3cEixcwmv-Km5Tfw,4488574,35700,958
s94Fnc1wwHI,SWOT Analysis for Stocks (HINDI),https://www.youtube.com/watch?v=s94Fnc1wwHI,2018-03-21 16:25:12+00:00,28622.0,1474.0,UCqvVj1LkOpA8tjb7RadTvOg,81141743,1000000,1630
PmT2oTTF8NE,Stock Market Cycles - askSlim Special Presentation 03/22/18,https://www.youtube.com/watch?v=PmT2oTTF8NE,2018-03-22 14:21:10+00:00,1066.0,13.0,UCoAuxtwgh8LSHeMFqEwjgHA,4566837,38700,1799
ffoCiG-YOxw,Stock Market in Japan 1989! What happened after rising interest rates?!,https://www.youtube.com/watch?v=ffoCiG-YOxw,2018-03-23 00:20:24+00:00,2107.0,19.0,UCHylXoREffYSx9YiVJvsrjw,3275309,18700,1043
kkqTGMjd0ys,39 Stock Market Statistics That Will Blow Your Mind - Video,https://www.youtube.com/watch?v=kkqTGMjd0ys,2018-03-23 14:15:39+00:00,1628.0,13.0,UCI1IQHHh9S3mBtcnHjpzt1w,168423,1140,107
No7vSs7zv9o,why the stock market is going down...,https://www.youtube.com/watch?v=No7vSs7zv9o,2018-03-23 20:53:48+00:00,25687.0,810.0,UCnMn36GT_H0X-w5_ckLtlgQ,107169921,720000,2402
eIQRNIpTJ_M,Stock Market TANKS 1400 Points This Week! WORST Weekly Decline In Years!,https://www.youtube.com/watch?v=eIQRNIpTJ_M,2018-03-24 06:13:26+00:00,15692.0,993.0,UCngq92xrmmsfEgGdfAJ6giQ,95477532,287000,4232
eIEBBS7o5J8,Preparing for Trading This Coming Crazy Week in the Stock Market,https://www.youtube.com/watch?v=eIEBBS7o5J8,2018-03-25 15:10:47+00:00,20724.0,417.0,UCoSG43KFjTe0trsteSQ46Ng,37429465,462000,1990
0TLeIcFmC7s,  Body Language | Psychological Concept Behind it ? | Ep -75 | Sunil Minglani,https://www.youtube.com/watch?v=0TLeIcFmC7s,2018-03-27 12:16:35+00:00,139199.0,7904.0,UCS8WLwuVszq1g2oeBzboUmQ,132031771,1400000,672
N_xdQ2CFEUY,"How I Lost Over $100,000 In the Stock Market",https://www.youtube.com/watch?v=N_xdQ2CFEUY,2018-03-27 14:43:29+00:00,33643.0,817.0,UCnuX2QbzkFx_Iouk4DmPr4Q,890269,10000,1346
sL45c0Jx45s,My best stock market trade of all time,https://www.youtube.com/watch?v=sL45c0Jx45s,2018-03-27 20:20:22+00:00,2452.0,110.0,UCafCiSnC9iMRB7Dv7a68Ixw,1035137,11200,338
O4NZjMe1TW8,Stock Market Recap 3-27-18 SPY IWM QQQ TLT USO UNG GLD SLV,https://www.youtube.com/watch?v=O4NZjMe1TW8,2018-03-27 20:46:41+00:00,1349.0,40.0,UCgR3p6SLdiHKGBbp8dbKV6w,1447262,23900,1031
TETSZeSoAlk,Risk - Understanding Investment Uncertainty,https://www.youtube.com/watch?v=TETSZeSoAlk,2018-03-30 14:54:11+00:00,67598.0,2387.0,UCFCEuCsyWP0YkP3CZ3Mr01Q,57600094,810000,197
BIyUUm3Y-Ug,Stock Market Crash In 2018? | History of Stock Market Crashes,https://www.youtube.com/watch?v=BIyUUm3Y-Ug,2018-03-30 20:00:01+00:00,44528.0,1103.0,UCbsDR27rGCFdDKQVRl_tgEQ,16831001,206000,259
uCkCgabiPto,2008 Financial Crisis  2   | 2008 recession Explained and Simplified in Hindi,https://www.youtube.com/watch?v=uCkCgabiPto,2018-04-01 14:40:16+00:00,1418082.0,52849.0,UCUMccND2H_CVS0dMZKCPCXA,350180702,2300000,973
UuT8ZlMCvQU,"Leo - April 2018,: Lotteries, Casino, Career, Biz, Forex, Stock Market Prediction",https://www.youtube.com/watch?v=UuT8ZlMCvQU,2018-04-02 08:49:27+00:00,5246.0,91.0,UCeQF6en3e7vBlIjj8nyKmkQ,17525605,131000,8586
VNaNHO06c8Q,"Pisces - April 2018: Lotteries, Casino, Career, Biz, Forex, Stock Market Prediction",https://www.youtube.com/watch?v=VNaNHO06c8Q,2018-04-02 08:54:52+00:00,7408.0,148.0,UCeQF6en3e7vBlIjj8nyKmkQ,17525605,131000,8586
jjCE4hXUMxo,Friday&#39;s Stock Market Crash  - China Tariffs - What is To Happen Monday,https://www.youtube.com/watch?v=jjCE4hXUMxo,2018-04-06 12:57:14+00:00,12443.0,121.0,UCenLy4V5NgxEz7pwosA9hiw,1132063,20500,631
vEhOAtA_4LY,"The stock market has been crashing, and it&#39;s a great time to make money",https://www.youtube.com/watch?v=vEhOAtA_4LY,2018-04-07 11:00:26+00:00,3334.0,142.0,UCQcPBLsq9rRc5TxDqSz_Dog,145447120,500000,14480
6az148A1qSM,HOW to GET PAID to SELL STOCKS | Stock Market Investing!,https://www.youtube.com/watch?v=6az148A1qSM,2018-04-08 00:57:42+00:00,2630.0,102.0,UC7R3Xjx3cEixcwmv-Km5Tfw,4488574,35700,958
J-CWVVngC0I,Stock Market Following EXACT Pattern of 1987 and 1929! What Will Be the TRIGGER Event?,https://www.youtube.com/watch?v=J-CWVVngC0I,2018-04-08 05:41:29+00:00,21401.0,947.0,UCngq92xrmmsfEgGdfAJ6giQ,95477532,287000,4232
Fk3krhLtAAU,THIS Stock Market Indicator Just Flashed A Warning Signal Same As 2007 and 2000!,https://www.youtube.com/watch?v=Fk3krhLtAAU,2018-04-09 13:03:26+00:00,14318.0,960.0,UCngq92xrmmsfEgGdfAJ6giQ,95477532,287000,4232
YDeDMJslhL8,How to Read Profit and Loss Statement on Money Control? (Hindi) Part 3,https://www.youtube.com/watch?v=YDeDMJslhL8,2018-04-11 13:01:06+00:00,306118.0,11957.0,UCUMccND2H_CVS0dMZKCPCXA,350180702,2300000,973
rhdLxMqe9zc,Gta 5 Make $Billion dollars stock market glitch (become billionaire)in minutes,https://www.youtube.com/watch?v=rhdLxMqe9zc,2018-04-11 22:00:55+00:00,31593.0,812.0,UCH-QOBY98lJdbCgEIikwzuQ,12040492,41900,261
RpcG9f-dnNs,How to invest in stock markets? Here is a simple guide to follow,https://www.youtube.com/watch?v=RpcG9f-dnNs,2018-04-13 05:54:18+00:00,5965.0,105.0,UCkXopQ3ubd-rnXnStZqCl2w,926361456,3250000,90179
5dHs15NNT6s,    ? What is a Share and Stock market? Share Bazar Basics for beginners in Hindi,https://www.youtube.com/watch?v=5dHs15NNT6s,2018-04-13 13:21:17+00:00,1798824.0,53025.0,UCwAdQUuPT6laN-AQR17fe1g,434908562,5700000,432
utLIlOAwLeU,Behavioral Finance | Investor Irrationality,https://www.youtube.com/watch?v=utLIlOAwLeU,2018-04-13 17:17:00+00:00,119437.0,3818.0,UCFCEuCsyWP0YkP3CZ3Mr01Q,57600094,810000,197
xgcagSWfL0Q,Learn How to Evaluate Stocks | Stock Market Investing for Beginners!,https://www.youtube.com/watch?v=xgcagSWfL0Q,2018-04-15 04:45:52+00:00,2682.0,109.0,UC7R3Xjx3cEixcwmv-Km5Tfw,4488574,35700,958
UnhfveQfbgw,The ONE Factor Everyone Ignores About Why the U.S Stock Market Hasnt Crashed!,https://www.youtube.com/watch?v=UnhfveQfbgw,2018-04-17 18:12:49+00:00,16328.0,1004.0,UCngq92xrmmsfEgGdfAJ6giQ,95477532,287000,4232
5AWfUfUTnHw,How To Practice Patience In Stock market | Share Market Tips | Dhanashri Academy (Video in Hindi),https://www.youtube.com/watch?v=5AWfUfUTnHw,2018-04-18 12:35:09+00:00,22668.0,578.0,UCoKN6p15-vGydbXELuf0FcQ,4129303,67700,1633
g-KoBfXeYKw,"As China Stock Market Hits CRITICAL Low, Did the PBOC Just Save the Day By Printing MASSIVE Money?!",https://www.youtube.com/watch?v=g-KoBfXeYKw,2018-04-19 12:53:01+00:00,13527.0,922.0,UCngq92xrmmsfEgGdfAJ6giQ,95477532,287000,4232
8sIljqmgJnw,Technical Analysis of Stock Market | Collateral Damage,https://www.youtube.com/watch?v=8sIljqmgJnw,2018-04-21 22:20:56+00:00,2901.0,127.0,UCtTn6Xa2JOsQVxOS_jI7nuQ,1854643,27000,1036
ZpSaqOMCFdk,Similarities between Cricket &amp; Stock Market Rules |       ? | Sunil Minglani,https://www.youtube.com/watch?v=ZpSaqOMCFdk,2018-04-22 04:40:39+00:00,30339.0,1896.0,UCS8WLwuVszq1g2oeBzboUmQ,132031771,1400000,672
gAswWVETWKo,Can Investing In Solar Beat The Stock Market?? Results Will Surprise You! FarmCraft101 solar pt4,https://www.youtube.com/watch?v=gAswWVETWKo,2018-04-24 21:18:26+00:00,38657.0,1410.0,UCO4AaIooUgGTlBH64KWO76w,74153752,437000,211
WJ5UA3JLV38,Stock Market Bitcoin and Gold Analysis April 27 2018,https://www.youtube.com/watch?v=WJ5UA3JLV38,2018-04-27 20:29:38+00:00,2612.0,,UCfD3rq06LaA8wc3s2m3LwRQ,6055091,58800,1975
QjzpDD_for4,Fundamental Analysis Books for Stock Market [Top 7],https://www.youtube.com/watch?v=QjzpDD_for4,2018-05-02 16:07:24+00:00,14647.0,242.0,UCksVr8lIwOPd1UtJkE3mdJQ,314295335,838000,3149
V8eJ135Z640,The Best Way to Invest Your Money,https://www.youtube.com/watch?v=V8eJ135Z640,2018-05-07 15:30:00+00:00,2183047.0,34591.0,UC7eBNeDW1GQf2NJQ6G6gAxw,978914750,2800000,7361
eQXF_SiT9QU,Where &amp; How to Place Stop loss ? |         ? |Ep-30| sunilminglani.com,https://www.youtube.com/watch?v=eQXF_SiT9QU,2018-05-10 14:26:09+00:00,1158976.0,35953.0,UCS8WLwuVszq1g2oeBzboUmQ,132031771,1400000,672
T1cqSZUviiQ,Investing | 5 Steps for Getting Started,https://www.youtube.com/watch?v=T1cqSZUviiQ,2018-05-11 15:42:55+00:00,53160.0,2542.0,UCFCEuCsyWP0YkP3CZ3Mr01Q,57600094,810000,197
