video_id,Title,Video Link,Publish Date,View Count,Like Count,Channel ID,Channel View,Subscriber Count,Video Count
NmQVEKlP-aE,"Stock Market Day Trading Live with TodayTrader Jan 7, 2009",https://www.youtube.com/watch?v=NmQVEKlP-aE,2010-01-07 23:54:48+00:00,4968.0,26.0,UCOnefmG-8hSp66O2dHr3vgg,3124210,10000,547
lF7j6RFg8eo,Stock Market Technical Analysis Review 1/8/10,https://www.youtube.com/watch?v=lF7j6RFg8eo,2010-01-08 21:57:57+00:00,3168.0,25.0,UCfD3rq06LaA8wc3s2m3LwRQ,6055929,58800,1975
_qX1Cnl97jA,"Technical Analysis Stock Market Review Jan 12, 2010",https://www.youtube.com/watch?v=_qX1Cnl97jA,2010-01-12 21:29:52+00:00,1380.0,20.0,UCfD3rq06LaA8wc3s2m3LwRQ,6055929,58800,1975
4gucww_XbBg,Stock Market Trading Help online trading for Jan 21,https://www.youtube.com/watch?v=4gucww_XbBg,2010-01-22 03:27:10+00:00,2255.0,32.0,UCOnefmG-8hSp66O2dHr3vgg,3124210,10000,547
zeyj-SAdJjA,Online Trading Stock Market discussion for the day Jan 31,https://www.youtube.com/watch?v=zeyj-SAdJjA,2010-01-31 19:18:46+00:00,1236.0,34.0,UCOnefmG-8hSp66O2dHr3vgg,3124210,10000,547
6FQlHtvgOXk,Stockscores.com Weekly Market Analysis for Feb 1 2010.mp4,https://www.youtube.com/watch?v=6FQlHtvgOXk,2010-02-02 05:31:33+00:00,1033.0,2.0,UC151mnaPrIvTELng72QtFDQ,1665628,18300,855
T3aA5ZErKD8,"Online Trading and Stock Market help day Feb 18, 2010",https://www.youtube.com/watch?v=T3aA5ZErKD8,2010-02-19 02:55:25+00:00,3072.0,25.0,UCOnefmG-8hSp66O2dHr3vgg,3124210,10000,547
8qpIwMl7yrk,Stock Market Statistics &amp; Learning From a Broker - SentimenTrader Jason Goepfert,https://www.youtube.com/watch?v=8qpIwMl7yrk,2010-02-19 08:35:52+00:00,1577.0,2.0,UCIbdTTriG-IxoCdg1Zwbv5Q,294289,1000,99
nWann9eKlgs,Day Trading | Stock Market Reaction | Online Software,https://www.youtube.com/watch?v=nWann9eKlgs,2010-02-19 18:13:16+00:00,10586.0,53.0,UCLDuZe12blTBAbT3hrTdIiA,107602,893,30
seeH-ZH6HAA,Type and size of orders in the Stock Market 1: An Introduction,https://www.youtube.com/watch?v=seeH-ZH6HAA,2010-02-19 21:54:00+00:00,1611.0,,UCjWmQ6C0i02nUyLd_ykfr8g,3537606,15100,105
i0Y0SxVDGjc,"Weekend Technical Analysis - Market Swings, Bumps, Blasts To Continue...Pattern, Price, Setups",https://www.youtube.com/watch?v=i0Y0SxVDGjc,2010-02-21 16:58:44+00:00,1067.0,9.0,UCEggVJ_xt6van8nkzyBhK9w,4280992,27600,5415
AyIWw7djtVY,(Part 1 of 10)  10 Things Documentary - Stock Market Prophecy  Master Prophet Bishop Bernard Jordan,https://www.youtube.com/watch?v=AyIWw7djtVY,2010-02-21 19:48:28+00:00,7502.0,14.0,UCnCAKZScn89E63xmtlH5rQA,3857198,11900,3239
0BcnQ09B768,Market Technical Analysis - Market Slammed On Economic News But Dollar Saves The Day!,https://www.youtube.com/watch?v=0BcnQ09B768,2010-02-25 19:27:39+00:00,1633.0,10.0,UCEggVJ_xt6van8nkzyBhK9w,4280992,27600,5415
x65ndyrsaPI,Online Trading and Swing Trading the Stock Market day Feb 25,https://www.youtube.com/watch?v=x65ndyrsaPI,2010-02-26 03:13:34+00:00,2648.0,18.0,UCOnefmG-8hSp66O2dHr3vgg,3124210,10000,547
6TmleJXjp00,Stockscores Market Analysis for Mar 1 2010,https://www.youtube.com/watch?v=6TmleJXjp00,2010-03-02 05:50:04+00:00,1182.0,2.0,UC151mnaPrIvTELng72QtFDQ,1665628,18300,855
-VFk5LOQp74,"Market Technical Analysis - Markets Float Into Double Top, Master Trade On PALM, Key Stock Analysis",https://www.youtube.com/watch?v=-VFk5LOQp74,2010-03-02 19:12:42+00:00,1788.0,9.0,UCEggVJ_xt6van8nkzyBhK9w,4280992,27600,5415
uOJk8ZHbXHA,Market Technical Analysis - Markets Initially Jump Higher On Jobs Report Then Stall. 52 Week Highs?,https://www.youtube.com/watch?v=uOJk8ZHbXHA,2010-03-05 19:07:12+00:00,1103.0,10.0,UCEggVJ_xt6van8nkzyBhK9w,4280992,27600,5415
hnkACUP6NWE,Online Trading Day Trading and Stock Market ideas for Monday,https://www.youtube.com/watch?v=hnkACUP6NWE,2010-03-08 01:29:59+00:00,1943.0,27.0,UCOnefmG-8hSp66O2dHr3vgg,3124210,10000,547
ccNilnpvbJg,The Crash of 1929 &amp; The Great Depression (PBS) 1of6,https://www.youtube.com/watch?v=ccNilnpvbJg,2010-03-13 03:58:59+00:00,402988.0,799.0,UCBsHVT_fAGIZG56oh8nWR_Q,40792261,78500,319
9iz95It5c_Q,Market Technical Analysis - Markets Lower As Bear Flag Plays Out...New One Forming But Volume Dead,https://www.youtube.com/watch?v=9iz95It5c_Q,2010-03-15 18:19:51+00:00,1008.0,7.0,UCEggVJ_xt6van8nkzyBhK9w,4280992,27600,5415
P36CmETsVWs,Online Trading Stock Market Review,https://www.youtube.com/watch?v=P36CmETsVWs,2010-03-20 15:36:19+00:00,1244.0,23.0,UCfD3rq06LaA8wc3s2m3LwRQ,6055929,58800,1975
mmAo99SW6_E,OSHO: I Respect Money (Preview),https://www.youtube.com/watch?v=mmAo99SW6_E,2010-03-21 17:20:40+00:00,1396471.0,18835.0,UCS0s6BFzIcvC2gTH52_vBEA,186941685,1150000,2048
BRvZXekEGos,Part 1 - Stock Market Investing with Dr Dar on I Mean Business,https://www.youtube.com/watch?v=BRvZXekEGos,2010-04-25 14:56:12+00:00,1150.0,4.0,UC4HKInLNA3_eW0_KyjjrlTw,2646806,5290,3028
REGnWnPoEq4,Online Trading Stock Market Review 5/7/10,https://www.youtube.com/watch?v=REGnWnPoEq4,2010-05-07 21:42:00+00:00,3192.0,22.0,UCfD3rq06LaA8wc3s2m3LwRQ,6055929,58800,1975
WrxlVjZJawQ,Stock Market Flash Crash - May 6th 2010,https://www.youtube.com/watch?v=WrxlVjZJawQ,2010-05-11 20:49:03+00:00,29515.0,135.0,UCLdZZPcnxZLB_G7bzG8ZM7A,1727642,20100,194
QO4WacxSps0,Stock Market Review 5/12/10,https://www.youtube.com/watch?v=QO4WacxSps0,2010-05-12 20:41:52+00:00,1877.0,19.0,UCfD3rq06LaA8wc3s2m3LwRQ,6055929,58800,1975
qz0aHQ8KUpQ,"Stock market, U.S. economy, financial regs, exchange controls",https://www.youtube.com/watch?v=qz0aHQ8KUpQ,2010-05-20 21:31:50+00:00,29295.0,678.0,UCIjuLiLHdFxYtFmWlbTGQRQ,125674755,567000,2398
o-ehyLfTgu4,"Weekend Technical Analysis - Market Psychology, Technical Analysis Gives Profits. Learn It!",https://www.youtube.com/watch?v=o-ehyLfTgu4,2010-05-23 15:09:06+00:00,1362.0,10.0,UCEggVJ_xt6van8nkzyBhK9w,4280992,27600,5415
qXeIqkUWiZ8,Using Calculus to Make Money on the Stock Market Problem - Calculus - User Submitted Quesiton,https://www.youtube.com/watch?v=qXeIqkUWiZ8,2010-05-26 03:07:55+00:00,30919.0,287.0,UC_k_A_2-782aX_42pCZGTTw,526389,1110,199
jGcb3yhT9KM,Craig Ferguson Monologue 2006.06.26 Stock Market,https://www.youtube.com/watch?v=jGcb3yhT9KM,2010-05-29 19:10:34+00:00,5839.0,32.0,UC4To_u1goNDhAnHUrGTjYbQ,1597964,924,427
Uo_yf6C2MeU,Stock Market Trading Strategies,https://www.youtube.com/watch?v=Uo_yf6C2MeU,2010-06-03 15:37:59+00:00,2400.0,4.0,UCqsjBcxpPrrrRIjfDB_YbPg,33512,188,62
KsSm9xb1xkE,Stock Market Investing the Right Way,https://www.youtube.com/watch?v=KsSm9xb1xkE,2010-06-14 00:46:48+00:00,4075.0,67.0,UCwRXb5dUK4cvsHbx-rGzSgw,119413318,1270000,1232
cbomGzMjrEM,Stock Market Forecast Anatomy of a Bear Market - ASX,https://www.youtube.com/watch?v=cbomGzMjrEM,2010-06-20 01:04:54+00:00,2325.0,3.0,UC4vgOyM0JR649M94a8d8skg,28148,183,164
Ne4cD9UYoo4,The Mystery of the Stock Market Flash Crash - The Ring Of Fire,https://www.youtube.com/watch?v=Ne4cD9UYoo4,2010-06-29 17:39:31+00:00,2884.0,18.0,UCYWIEbibRcZav6xMLo9qWWw,1045618675,971000,20653
L0x7TOIrs5A,"Do You Know When to Stand Aside?  S&amp;P 500, Nasdaq Easy Emini Day Trade Set Ups 6-30-10",https://www.youtube.com/watch?v=L0x7TOIrs5A,2010-07-01 12:07:34+00:00,1023.0,,UCbZ7G5UQ69rUe31iJTPSYLQ,503911,3430,376
ySXlV4vz__c,"Lower Stock Prices Ahead, Bear Market Getting Stronger",https://www.youtube.com/watch?v=ySXlV4vz__c,2010-07-01 22:24:46+00:00,2432.0,23.0,UCmp8PhCEfZaWEDPYrowYujQ,5428543,35400,1106
wK-nQ7OUYpQ,Dow Jones Stock Market Trading Analysis &amp; Global Trends: Bear Case Part 1,https://www.youtube.com/watch?v=wK-nQ7OUYpQ,2010-07-18 14:44:22+00:00,2264.0,10.0,UCJBHw3WIta5ozyZ_izMWakw,3980488,10900,8855
ATONy6neSN4,Dow Jones Stock Market Trading Analysis &amp; Global Trends: Bear Case Part 2,https://www.youtube.com/watch?v=ATONy6neSN4,2010-07-18 15:05:49+00:00,2659.0,7.0,UCJBHw3WIta5ozyZ_izMWakw,3980488,10900,8855
SLG3TLsX0x0,Using the Trend to Predict the Next Move in the Stock Market,https://www.youtube.com/watch?v=SLG3TLsX0x0,2010-07-18 21:13:30+00:00,1928.0,4.0,UCxt-bSHoD3JObnfvps77Hbg,799244,1170,428
8hOMLw9Ev4Q,"Market Technical Analysis - Market Rips Higher, Key Plays To Watch and Profit From",https://www.youtube.com/watch?v=8hOMLw9Ev4Q,2010-07-22 19:18:17+00:00,1095.0,4.0,UCEggVJ_xt6van8nkzyBhK9w,4280992,27600,5415
ClG3QacbqSY,Stock Market Manipulation-The Truth.avi,https://www.youtube.com/watch?v=ClG3QacbqSY,2010-07-24 19:40:08+00:00,6414.0,18.0,UCEN0rg-Sa7tnGOrtolozA1Q,427189,4170,368
NWNP6Hhsoeg,"Market Technical Analysis - Markets Surge On Volume And Optimism,Money Flows On Winning Plays",https://www.youtube.com/watch?v=NWNP6Hhsoeg,2010-08-02 18:44:31+00:00,1052.0,8.0,UCEggVJ_xt6van8nkzyBhK9w,4280992,27600,5415
HJZhN8N6NJ8,"Elliott Wave and Technical Analysis of Short Term S&amp;P 500,  Long Term Dow Jones, Copper",https://www.youtube.com/watch?v=HJZhN8N6NJ8,2010-08-04 20:51:25+00:00,1191.0,4.0,UCSmbbWQjXYnhQlXNGzrW_PQ,143599,504,155
1Tkf2zkX45Q,Stock Market Trading Live Online  Day Aug 18 TodayTrader,https://www.youtube.com/watch?v=1Tkf2zkX45Q,2010-08-19 00:40:05+00:00,5014.0,25.0,UCOnefmG-8hSp66O2dHr3vgg,3124210,10000,547
10Y1onXXSL8,Stock Market Online Trading discussion  Sept 5 SPY,https://www.youtube.com/watch?v=10Y1onXXSL8,2010-09-05 18:55:49+00:00,4396.0,17.0,UCOnefmG-8hSp66O2dHr3vgg,3124210,10000,547
uXWB19V0frY,THE STOCK MARKET DEATH CROSS AND GOLDEN CROSS,https://www.youtube.com/watch?v=uXWB19V0frY,2010-09-17 19:29:54+00:00,12164.0,65.0,UCT4WixjPnohEg6r4EJuE0kw,70652,468,85
qpQ_TrX2Ibo,"Stock Market Technical Analysis - PPT Light Volume Float Keeping Market Flat, Key Levels Revealed",https://www.youtube.com/watch?v=qpQ_TrX2Ibo,2010-09-27 18:48:06+00:00,2379.0,6.0,UCEggVJ_xt6van8nkzyBhK9w,4280992,27600,5415
DWB4ypeYJL8,Market Technical Analysis - Plunge Protection Team Saves The Day Again As Dollar Drops,https://www.youtube.com/watch?v=DWB4ypeYJL8,2010-09-28 18:38:35+00:00,1101.0,11.0,UCEggVJ_xt6van8nkzyBhK9w,4280992,27600,5415
Yz_Uw692qCk,Stock Market Technical Analysis - Markets Have Major Reversal After Massive Gap Higher,https://www.youtube.com/watch?v=Yz_Uw692qCk,2010-09-30 18:37:55+00:00,1046.0,10.0,UCEggVJ_xt6van8nkzyBhK9w,4280992,27600,5415
OGkWVKy_OKI,"Weekend Stock Market Analysis - Big Move To Start This Week, Watch These Levels, Join To Profit!",https://www.youtube.com/watch?v=OGkWVKy_OKI,2010-10-03 17:03:32+00:00,1275.0,7.0,UCEggVJ_xt6van8nkzyBhK9w,4280992,27600,5415
w55P6XDb66Y,"Stock Market Analysis Weekend Edition - Earnings Galore, Dollar Key As Volatility Will Rock!",https://www.youtube.com/watch?v=w55P6XDb66Y,2010-10-10 16:21:35+00:00,1059.0,6.0,UCEggVJ_xt6van8nkzyBhK9w,4280992,27600,5415
WstJM_aNSj8,Wall Street: The Speed Traders,https://www.youtube.com/watch?v=WstJM_aNSj8,2010-10-10 23:08:22+00:00,306405.0,1538.0,UClzCn8DxRSCuMFv_WfzkcrQ,1991158318,2080000,50841
bMq-emn6A7o,"Stock Market Video - Weekend Edition - Dollar And Earnings At Center Stage, Be Ready For Action",https://www.youtube.com/watch?v=bMq-emn6A7o,2010-10-16 18:10:45+00:00,1093.0,9.0,UCEggVJ_xt6van8nkzyBhK9w,4280992,27600,5415
bUJvWbrl9Rs,"Stock Market Analysis Video - China Strikes Back, Fed Continues To Prop",https://www.youtube.com/watch?v=bUJvWbrl9Rs,2010-10-19 16:36:54+00:00,1160.0,16.0,UCEggVJ_xt6van8nkzyBhK9w,4280992,27600,5415
ZYxagpG1xsE,Stock Market and Online Trading Help for Oct 21,https://www.youtube.com/watch?v=ZYxagpG1xsE,2010-10-21 23:33:52+00:00,3501.0,15.0,UCOnefmG-8hSp66O2dHr3vgg,3124210,10000,547
itoNb1lb5hY,Currency Exchange Introduction,https://www.youtube.com/watch?v=itoNb1lb5hY,2010-10-24 15:12:19+00:00,778576.0,3990.0,UC4a-Gbdw7vOaccHmFo40b9g,2097916959,8140000,8454
HCVnxv5nNTw,Stock Market Video: POMO Saves The Day As Markets Await Elections And QE2,https://www.youtube.com/watch?v=HCVnxv5nNTw,2010-10-26 17:38:46+00:00,2550.0,10.0,UCEggVJ_xt6van8nkzyBhK9w,4280992,27600,5415
afpwofm9Ggk,Stock Market Structure,https://www.youtube.com/watch?v=afpwofm9Ggk,2010-10-28 01:56:22+00:00,3408.0,29.0,UCfD3rq06LaA8wc3s2m3LwRQ,6055929,58800,1975
Niwco2h2Up4,Stock Market Video: Crazy Trading During Crazier Times,https://www.youtube.com/watch?v=Niwco2h2Up4,2010-10-28 17:13:37+00:00,1264.0,7.0,UCEggVJ_xt6van8nkzyBhK9w,4280992,27600,5415
BPnJHfiFWJw,Milton Friedman - Solutions to Market Failures,https://www.youtube.com/watch?v=BPnJHfiFWJw,2010-10-29 21:05:50+00:00,97284.0,1524.0,UC51_awyLXl2nxCduuzzmw4w,74756753,225000,2115
9Qg_zP6e9ZY,2010 November 2 Congressional Elections and the Stock Market,https://www.youtube.com/watch?v=9Qg_zP6e9ZY,2010-11-01 23:02:40+00:00,2702.0,3.0,UCPAxB5TPQ_5PVXWYIgAx4Mw,1205676,3310,695
_2Kt4moES0U,How the Stock Market Works for Dummies,https://www.youtube.com/watch?v=_2Kt4moES0U,2010-11-02 05:08:17+00:00,427429.0,2753.0,UC69oUh89EBxjxTKvDOoqTug,1903488,1390,158
Gqp_1EAKrrY,Are You Prepared to Trade in the Stock Market,https://www.youtube.com/watch?v=Gqp_1EAKrrY,2010-11-04 16:26:35+00:00,1230.0,5.0,UCi3HkGY69ZLZhAHE729Rz6w,624359,2830,290
pVj2Qyd6or0,Stock Market Video: The Reality Of The Game,https://www.youtube.com/watch?v=pVj2Qyd6or0,2010-11-04 19:22:15+00:00,1497.0,12.0,UCEggVJ_xt6van8nkzyBhK9w,4280992,27600,5415
WqZZcR5tIz4,"Weekend Stock Market Video: The Truth Behind The Market Rally, Play It Right.",https://www.youtube.com/watch?v=WqZZcR5tIz4,2010-11-07 16:40:59+00:00,1296.0,11.0,UCEggVJ_xt6van8nkzyBhK9w,4280992,27600,5415
QFRNUej-ma0,Stock Market Video: Markets Collapse As China Gets Crushed,https://www.youtube.com/watch?v=QFRNUej-ma0,2010-11-12 18:36:33+00:00,1469.0,9.0,UCEggVJ_xt6van8nkzyBhK9w,4280992,27600,5415
djgQS0sk8T8,Beginner&#39;s guide to investing: the currency markets - MoneyWeek Investment Tutorials,https://www.youtube.com/watch?v=djgQS0sk8T8,2010-12-03 10:17:16+00:00,347146.0,2439.0,UCLnZvwNt6xDtlwIEmDJEtrA,3050020,38300,29
RVlRj1xxOGE,Making Money from Stock Market by Intra-day Trading in Equity Shares,https://www.youtube.com/watch?v=RVlRj1xxOGE,2010-12-05 18:54:34+00:00,76312.0,32.0,UCPbHsTFbBE3DOtsRE0P-gnw,457502,682,393
75afiFcdZHc,Stock Market Video: How An Amateur Loser Becomes A Pro Winner,https://www.youtube.com/watch?v=75afiFcdZHc,2010-12-07 18:32:40+00:00,1127.0,11.0,UCEggVJ_xt6van8nkzyBhK9w,4280992,27600,5415
fboNrR6IZjo,"Stock Market Video: Markets See Small Declines, Key Setups Revealed",https://www.youtube.com/watch?v=fboNrR6IZjo,2010-12-15 18:40:17+00:00,1735.0,18.0,UCEggVJ_xt6van8nkzyBhK9w,4280992,27600,5415
FCoO4BGK60E,A beginner&#39;s guide to the stock market.flv,https://www.youtube.com/watch?v=FCoO4BGK60E,2010-12-22 20:33:47+00:00,18945.0,295.0,UCKKLtHejpnK45xi6s-8qmJg,308382,1130,639
gaK5G_sf330,How to Buy a Pullback in the Stock Market,https://www.youtube.com/watch?v=gaK5G_sf330,2011-01-22 23:07:28+00:00,2255.0,6.0,UC3-xjExu0Qr4L_5SCcqsoeA,47868,276,35
Q9GEZeDjB3w,"Stock Market Video: Markets Collapse on Global Instability, Volatility Equals Great Trades",https://www.youtube.com/watch?v=Q9GEZeDjB3w,2011-01-28 18:19:44+00:00,1005.0,15.0,UCEggVJ_xt6van8nkzyBhK9w,4280992,27600,5415
PzoSJhF7p7o,Tradescores Market Analysis for Feb 9 2011,https://www.youtube.com/watch?v=PzoSJhF7p7o,2011-02-10 02:59:33+00:00,2623.0,4.0,UC151mnaPrIvTELng72QtFDQ,1665628,18300,855
jBNvGLFjupo,"Stock Market Video: Markets Whip As Friday Looms Large, Key Levels, Master Trades and Profits",https://www.youtube.com/watch?v=jBNvGLFjupo,2011-03-09 18:39:19+00:00,1809.0,12.0,UCEggVJ_xt6van8nkzyBhK9w,4280992,27600,5415
l7DBftejri4,"Stock Market Video: Markets Continue Their Bounce, Major Pivots Shown",https://www.youtube.com/watch?v=l7DBftejri4,2011-03-21 18:28:25+00:00,1092.0,11.0,UCEggVJ_xt6van8nkzyBhK9w,4280992,27600,5415
a4bzfvtq8n0,03/28/2011 Oscar Carboni Points out how the Stock Market is Poised to move Higher Continued,https://www.youtube.com/watch?v=a4bzfvtq8n0,2011-03-28 06:07:58+00:00,2408.0,,UCez8uA1o_fDYsrSf4auWSjg,4278829,13900,2175
YP8fw2yveRY,Stock Chart Tips for the Long Term Stock Market Investor,https://www.youtube.com/watch?v=YP8fw2yveRY,2011-04-01 14:03:56+00:00,6252.0,25.0,UCI1IQHHh9S3mBtcnHjpzt1w,168494,1140,107
UOwi7MBSfhk,An introduction to financial markets - MoneyWeek Investment Tutorials,https://www.youtube.com/watch?v=UOwi7MBSfhk,2011-04-01 16:42:46+00:00,222296.0,3078.0,UCKrz9GW8_Dtm41aOc05S4Vg,21305452,293000,448
wNv__bi-AVw,How Will Raising the Debt Ceiling Impact U.S. Markets?,https://www.youtube.com/watch?v=wNv__bi-AVw,2011-04-14 00:53:34+00:00,4958.0,13.0,UC6ZFN9Tx6xh-skXCuRHCDpQ,2334000454,3840000,47436
0rxS15Bsh-Y,Volatility calculation in Excel,https://www.youtube.com/watch?v=0rxS15Bsh-Y,2011-04-30 13:03:47+00:00,120574.0,622.0,UCqqQctA6wHQrpmoJwmWkJbA,841408,2150,25
XabI5QjqdOU,"Stock Market Video: Commodities Crash, Market Top In",https://www.youtube.com/watch?v=XabI5QjqdOU,2011-05-05 17:26:40+00:00,1028.0,12.0,UCEggVJ_xt6van8nkzyBhK9w,4280992,27600,5415
Bx2HGseD9Ao,Stock Market Trading For Beginners Using Dynamic System | Part #2,https://www.youtube.com/watch?v=Bx2HGseD9Ao,2011-05-10 18:07:40+00:00,8847.0,63.0,UCImlmqO0-0og9Pmt8c_IKJQ,198848,3200,953
7dg0-O2iXDE,Stock Market Trading For Beginners Using Dynamic System | Part #3,https://www.youtube.com/watch?v=7dg0-O2iXDE,2011-05-10 18:25:15+00:00,4904.0,47.0,UCImlmqO0-0og9Pmt8c_IKJQ,198848,3200,953
_0d3fTZ3y_Y,Millionaire: The Stock Market Simulation for the Apple II,https://www.youtube.com/watch?v=_0d3fTZ3y_Y,2011-05-25 05:16:00+00:00,3641.0,15.0,UCrqu6imeJQ_A7YcB-dLFlfQ,14494568,12500,9798
mbWhKM77r0I,Wall Street: The speed traders,https://www.youtube.com/watch?v=mbWhKM77r0I,2011-06-06 00:00:00+00:00,493118.0,5369.0,UC8p1vwvWtl6T73JiExfWs1g,4669000492,5410000,115974
I5nAovTXu6I,Wall Street: The speed traders,https://www.youtube.com/watch?v=I5nAovTXu6I,2011-06-06 00:00:00+00:00,6138.0,57.0,UClzCn8DxRSCuMFv_WfzkcrQ,1991158318,2080000,50841
w2lBE6ei-9g,"Stock Market Videos: Stocks Set To Bounce, Projections, Analysis",https://www.youtube.com/watch?v=w2lBE6ei-9g,2011-06-11 18:03:19+00:00,1542.0,23.0,UCEggVJ_xt6van8nkzyBhK9w,4280992,27600,5415
iAExE1fbh5k,What is technical analysis in stock market,https://www.youtube.com/watch?v=iAExE1fbh5k,2011-06-21 02:27:03+00:00,43437.0,168.0,UCSGEUt-evPiTlVcHKBAI6Mg,105849,912,19
zoKaGGOaYFk,What are trends in technical analysis ( stock market) ?,https://www.youtube.com/watch?v=zoKaGGOaYFk,2011-06-27 18:04:11+00:00,30158.0,79.0,UCSGEUt-evPiTlVcHKBAI6Mg,105849,912,19
NmGc7qH4-hw,Occult Stock Market Codes,https://www.youtube.com/watch?v=NmGc7qH4-hw,2011-07-04 04:27:53+00:00,3727.0,48.0,UCRSur8lNUQN7uh1BDGvEFVA,2804115,17500,2968
xtR9qV3vkwk,Accounting for Stock Transactions,https://www.youtube.com/watch?v=xtR9qV3vkwk,2011-07-09 18:15:05+00:00,11399.0,52.0,UCTJpki0vWP0iU6v4gYBhr-Q,5087921,25300,181
l0zwLt1pjZ8,Stock Market Videos: Make Money In The Market Today,https://www.youtube.com/watch?v=l0zwLt1pjZ8,2011-07-18 17:52:36+00:00,1215.0,13.0,UCEggVJ_xt6van8nkzyBhK9w,4280992,27600,5415
k1AZMWOHz24,"Stock Market Videos: Profiting From Uncertainty, Rules Of The Trade",https://www.youtube.com/watch?v=k1AZMWOHz24,2011-07-25 18:29:01+00:00,1200.0,14.0,UCEggVJ_xt6van8nkzyBhK9w,4280992,27600,5415
zbUuCDcP6FE,"Stock Market Videos: Markets Collapse On Europe, Trades, Levels, Profits",https://www.youtube.com/watch?v=zbUuCDcP6FE,2011-08-04 18:38:41+00:00,2295.0,15.0,UCEggVJ_xt6van8nkzyBhK9w,4280992,27600,5415
3DkcLAGCMAU,"Stock Market Videos: Master Insight Into The Markets, Profit With The Pros",https://www.youtube.com/watch?v=3DkcLAGCMAU,2011-08-05 18:39:32+00:00,1341.0,22.0,UCEggVJ_xt6van8nkzyBhK9w,4280992,27600,5415
ZDOW7ppQSUI,Penny Stock Pump &amp; Dump - Stock Market Terminology,https://www.youtube.com/watch?v=ZDOW7ppQSUI,2011-08-06 21:16:37+00:00,2403.0,11.0,UCDtnOp7jxs-OxlHrYw6QTAg,66878967,90800,10325
wuNa01L0_SY,"Stock Market Trading Watch List for Tuesday, August 9th, 2011",https://www.youtube.com/watch?v=wuNa01L0_SY,2011-08-09 01:43:04+00:00,1032.0,5.0,UCQRO58I8i5NUKY-t2mylDCA,199767,758,620
PRVrSRkceHU,"Stock Market Videos: Rally Beginning, Enjoy The Profits",https://www.youtube.com/watch?v=PRVrSRkceHU,2011-08-10 18:19:54+00:00,1261.0,23.0,UCEggVJ_xt6van8nkzyBhK9w,4280992,27600,5415
LTVxK6Rqpco,Stock Market Analysis 8/10/11,https://www.youtube.com/watch?v=LTVxK6Rqpco,2011-08-10 20:21:21+00:00,2028.0,19.0,UCfD3rq06LaA8wc3s2m3LwRQ,6055929,58800,1975
enm5cLrOvNw,"Stock market Trading Watch List For Friday, August 19th, 2011",https://www.youtube.com/watch?v=enm5cLrOvNw,2011-08-19 04:40:24+00:00,1015.0,535.0,UCQRO58I8i5NUKY-t2mylDCA,199767,758,620
b8JW6orf1Z4,"Stock Market Videos: Markets Nearing Key Breakpoint, Profit now",https://www.youtube.com/watch?v=b8JW6orf1Z4,2011-08-22 18:37:36+00:00,1191.0,21.0,UCEggVJ_xt6van8nkzyBhK9w,4280992,27600,5415
JDWjBWx2-EQ,Stock Market Videos: How To Trade The Future Like Institutions,https://www.youtube.com/watch?v=JDWjBWx2-EQ,2011-08-25 18:49:00+00:00,1190.0,20.0,UCEggVJ_xt6van8nkzyBhK9w,4280992,27600,5415
tqwb3KjL_Ao,Stock Market Videos: The Keys To Profiting From Next Week,https://www.youtube.com/watch?v=tqwb3KjL_Ao,2011-09-04 18:23:41+00:00,1274.0,22.0,UCEggVJ_xt6van8nkzyBhK9w,4280992,27600,5415
l8WO2cNyTwc,Stock Market Analysis 9/6/11,https://www.youtube.com/watch?v=l8WO2cNyTwc,2011-09-06 20:31:50+00:00,1842.0,14.0,UCfD3rq06LaA8wc3s2m3LwRQ,6055929,58800,1975
zp-0y1IW0ls,What is a Gagged Transfer Agent (&quot;TA&quot;)? - Stock Market Terminology,https://www.youtube.com/watch?v=zp-0y1IW0ls,2011-09-07 01:40:51+00:00,1483.0,3.0,UCDtnOp7jxs-OxlHrYw6QTAg,66878967,90800,10325
OEzsdiX3qAs,Bull flag Bear flag chart patterns on the E-mini S&amp;P 500,https://www.youtube.com/watch?v=OEzsdiX3qAs,2011-09-13 08:08:29+00:00,1817.0,15.0,UCe6tb9LKiIu9eD2fVZurxnQ,8947557,41000,4286
GRnE38YyNC4,Stock Market Videos: Learn How To Trade From The Pros,https://www.youtube.com/watch?v=GRnE38YyNC4,2011-09-13 18:34:53+00:00,1088.0,11.0,UCEggVJ_xt6van8nkzyBhK9w,4280992,27600,5415
ObD4qO7gVlY,Bearish Stock Market Outlook Intact,https://www.youtube.com/watch?v=ObD4qO7gVlY,2011-09-19 03:52:41+00:00,1604.0,,UC_ywfvIR2JrnMuZt33y7QYQ,8327980,69000,654
7b3lGTNBdBU,Stock Market Videos: Markets Up Ahead Of Key Fed Announcement,https://www.youtube.com/watch?v=7b3lGTNBdBU,2011-09-20 18:43:55+00:00,1296.0,13.0,UCEggVJ_xt6van8nkzyBhK9w,4280992,27600,5415
xH3Pn3baG1Q,Selling Short - How To Profit From A Stock Market Crash,https://www.youtube.com/watch?v=xH3Pn3baG1Q,2011-10-02 13:08:38+00:00,46279.0,521.0,UCnJjRjmthxPCoQaAL44tR6g,43854246,376000,769
Y8hiaEu68k8,"Stock Market Videos: Markets Tag Master Low, Key Levels Revealed",https://www.youtube.com/watch?v=Y8hiaEu68k8,2011-10-03 18:24:33+00:00,1164.0,13.0,UCEggVJ_xt6van8nkzyBhK9w,4280992,27600,5415
Fy0gYxMjCuY,Stock Market Videos: Wild Swings As Key Levels Create Profits,https://www.youtube.com/watch?v=Fy0gYxMjCuY,2011-10-04 18:37:52+00:00,1042.0,16.0,UCEggVJ_xt6van8nkzyBhK9w,4280992,27600,5415
0k20uP03ci0,Stock Market Expert Videos: Will The S&amp;P 500 Surge Continue,https://www.youtube.com/watch?v=0k20uP03ci0,2011-10-16 02:21:04+00:00,1349.0,10.0,UCEggVJ_xt6van8nkzyBhK9w,4280992,27600,5415
dbfkbZwlXio,What is a stock exchange? - MoneyWeek Investment Tutorials,https://www.youtube.com/watch?v=dbfkbZwlXio,2011-10-20 15:44:15+00:00,178658.0,1611.0,UCKrz9GW8_Dtm41aOc05S4Vg,21305452,293000,448
F6_h6go5bwQ,10.25.2011 - Stock Market and Silver Technical Analysis,https://www.youtube.com/watch?v=F6_h6go5bwQ,2011-10-25 15:03:20+00:00,1732.0,35.0,UCoWvWMmXMPXiu1T9B1ZekOA,3557868,12000,4775
hi2XpUNS2Wo,"Stock Market Videos: Sell On Earnings, Europe, Economic News",https://www.youtube.com/watch?v=hi2XpUNS2Wo,2011-10-25 18:54:45+00:00,1148.0,14.0,UCEggVJ_xt6van8nkzyBhK9w,4280992,27600,5415
FinRqCocwGE,The Gun Markets of Pakistan with Suroosh Alvi,https://www.youtube.com/watch?v=FinRqCocwGE,2011-10-26 16:24:13+00:00,13867495.0,99112.0,UCn8zNIfYAQNdrFRrr8oibKw,4791011838,17500000,3973
Qwj7t5RlPOI,Stock Market Videos: Here Is The Trade Off The Hangover,https://www.youtube.com/watch?v=Qwj7t5RlPOI,2011-10-28 18:28:20+00:00,1252.0,18.0,UCEggVJ_xt6van8nkzyBhK9w,4280992,27600,5415
0tQ4y3yIyg0,Halloween Black Monday 10/31/11 Stock Market Update!,https://www.youtube.com/watch?v=0tQ4y3yIyg0,2011-10-31 14:33:22+00:00,2652.0,56.0,UC4SH8rh0OjYV3zwqnIfqNbA,247848122,367000,16011
4iybvz69MRg,"Basic Stock Market Investing Strategies:  Breakouts, Pullbacks and Bollinger Bands",https://www.youtube.com/watch?v=4iybvz69MRg,2011-11-06 14:07:53+00:00,9862.0,21.0,UCi3HkGY69ZLZhAHE729Rz6w,624359,2830,290
wQ7fDvfqwbc,Stock Market Videos: Analysis And Trade Setups For Today,https://www.youtube.com/watch?v=wQ7fDvfqwbc,2011-11-08 19:32:21+00:00,1193.0,19.0,UCEggVJ_xt6van8nkzyBhK9w,4280992,27600,5415
nwnt9VZ_qWs,"Stock Market Videos: Live Trade Taken, Profits Everywhere",https://www.youtube.com/watch?v=nwnt9VZ_qWs,2011-11-09 19:43:40+00:00,1253.0,19.0,UCEggVJ_xt6van8nkzyBhK9w,4280992,27600,5415
yZWoQl4FuCY,Alphatrends Stock Market Analysis 11/14/11,https://www.youtube.com/watch?v=yZWoQl4FuCY,2011-11-14 21:22:04+00:00,1348.0,5.0,UCfD3rq06LaA8wc3s2m3LwRQ,6055929,58800,1975
tdrpCsm9sNI,www.SP500Chart.com S&amp;P 500 Technical Analysis Weekly Review for 11/18/2011,https://www.youtube.com/watch?v=tdrpCsm9sNI,2011-11-19 15:50:47+00:00,1094.0,,UCdpLlkAPtsMMJPvg26V-KJA,327249,1350,1151
EkUfa9oO2zY,Stockscores Market Analysis for Nov 21,https://www.youtube.com/watch?v=EkUfa9oO2zY,2011-11-22 06:41:19+00:00,1351.0,7.0,UC151mnaPrIvTELng72QtFDQ,1665628,18300,855
fnU2x2PlAmk,Alphatrends Stock Market Analysis 11/25/11,https://www.youtube.com/watch?v=fnU2x2PlAmk,2011-11-25 19:32:26+00:00,1805.0,19.0,UCfD3rq06LaA8wc3s2m3LwRQ,6055929,58800,1975
QmKC86W4TBg,Setting Up Templates &amp; Layouts In Stock Market Software Metastock,https://www.youtube.com/watch?v=QmKC86W4TBg,2011-11-28 11:32:28+00:00,8244.0,39.0,UCveoezNsTziAUt89zn0GMTQ,79458,509,36
Ti4eqnL_L1s,What is the relationship between Gold Prices and the US Dollar,https://www.youtube.com/watch?v=Ti4eqnL_L1s,2011-11-29 05:23:55+00:00,62601.0,726.0,UCgV0Ej3y9m2shjfy1mNsSkw,66089,526,39
ntoAWMLj4tM,"Stock Market Videos: If You Were Not Long, Shame!",https://www.youtube.com/watch?v=ntoAWMLj4tM,2011-11-30 19:47:33+00:00,1580.0,20.0,UCEggVJ_xt6van8nkzyBhK9w,4280992,27600,5415
